id;date;author;target;description;attack;target_class;attack_class;country;link;author_report;date_report;views
1;13/02/2020;?;Grand Est;The Grand Est region is hit with a ransomware attack.;Malware;O Public administration and defence, compulsory social security;CC;FR;https://www.databreaches.net/butler-county-community-college-recovering-from-ransomware-attack/;Paolo Passeri					;2020-03-17T10:01:13+00:00;12,802
2;14/02/2020;?;INA Group;A ransomware attack cripples some business operations at INA Group, Croatia's biggest oil company, and its largest petrol station chain.;Malware;D Electricity gas steam and air conditioning supply;CC;HR;https://www.databreaches.net/butler-county-community-college-recovering-from-ransomware-attack/;Paolo Passeri					;2020-03-17T10:01:13+00:00;12,802
3;14/02/2020;?;BST;A Maze ransomware attack on BST, an accounting firm in December exposes the patient data of Community Care Physicians, a large upstate New York medical group, as well as other clients of the firm.;Malware;K Financial and insurance activities;CC;US;https://www.databreaches.net/butler-county-community-college-recovering-from-ransomware-attack/;Paolo Passeri					;2020-03-17T10:01:13+00:00;12,802
4;14/02/2020;?;Tennessee Orthopaedic Alliance;Tennessee Orthopaedic Alliance notifies more than 81,000 patients after discovering two employee email accounts had been compromised on October 18, 2019.;Account Hijacking;Q Human health and social work activities;CC;US;https://www.databreaches.net/butler-county-community-college-recovering-from-ransomware-attack/;Paolo Passeri					;2020-03-17T10:01:13+00:00;12,802
5;15/02/2020;?;Neebs Gaming YouTube channel;Neebs Gaming, a highly popular YouTube gaming channel is hacked by unidentified crypto scammers, who change its name and banner to Coinbase Pro to collect Bitcoin from its viewers/subscribers.;Account Hijacking;R Arts entertainment and recreation;CC;US;https://www.databreaches.net/butler-county-community-college-recovering-from-ransomware-attack/;Paolo Passeri					;2020-03-17T10:01:13+00:00;12,802
6;15/02/2020;?;Lodi School District;School officials in Lodi are investigating after student data is breached at two different schools: Bear Creek High and Ronald E. McNair High.;Unknown;P Education;CC;US;https://www.databreaches.net/butler-county-community-college-recovering-from-ransomware-attack/;Paolo Passeri					;2020-03-17T10:01:13+00:00;12,802
7;16/02/2020;Fox Kitten;Companies from the IT, Telecommunication, Oil and Gas, Aviation, Government, and Security sectors;Researchers from ClearSky reveal that Iran's government-backed hacking units have made a top priority last year to exploit VPN bugs to infiltrate and plant backdoors in companies all over the world.;CVE-2019-11510, CVE-2018-13379, CVE-2019-1579, CVE-2019-19781;Y Multiple Industries;CE;>1;https://www.databreaches.net/butler-county-community-college-recovering-from-ransomware-attack/;Paolo Passeri					;2020-03-17T10:01:13+00:00;12,802
8;16/02/2020;APT-C-23;Israel Defense Force (IDF) soldiers;An IDF’s spokesperson reveals that IDF (Israel Defense Force) and ISA (Israel Security Agency AKA “Shin Bet”) conducted a joint operation to take down a Hamas operation targeting IDF soldiers, dubbed ‘Rebound’.;Targeted Attack;O Public administration and defence, compulsory social security;CE;IL;https://www.databreaches.net/butler-county-community-college-recovering-from-ransomware-attack/;Paolo Passeri					;2020-03-17T10:01:13+00:00;12,802
9;16/02/2020;?;Vulnerable Wordpress sites;Researchers from WebARX reveal the details of a currently exploited vulnerability targeting the ThemeGrill Demo Importer plugin that allows the attackers to completely wipe a Wordpress site.;Wordpress plugins vulnerabilities;Y Multiple Industries;CC;>1;https://www.databreaches.net/butler-county-community-college-recovering-from-ransomware-attack/;Paolo Passeri					;2020-03-17T10:01:13+00:00;12,802
10;16/02/2020;?;Butler County Community College;Butler County Community College is hit with a ransomware attack.;Malware;P Education;CC;US;https://www.databreaches.net/butler-county-community-college-recovering-from-ransomware-attack/;Paolo Passeri					;2020-03-17T10:01:13+00:00;12,802
11;17/02/2020;?;ISS World;A ransomware attack hits the major facilities company ISS World, which has half a million employees worldwide.;Malware;N Administrative and support service activities;CC;DK;https://www.bleepingcomputer.com/news/security/zero-day-in-wordpress-plugin-exploited-to-create-admin-accounts/;Paolo Passeri					;2020-03-17T10:01:13+00:00;12,802
12;17/02/2020;?;More than 80 Turkish companies;Check Point researchers discover an evolving, ongoing malspam campaign targeting more than 80 Turkish companies, distributing the Adwind RAT.;Malicious Spam;Y Multiple Industries;CC;TR;https://www.bleepingcomputer.com/news/security/zero-day-in-wordpress-plugin-exploited-to-create-admin-accounts/;Paolo Passeri					;2020-03-17T10:01:13+00:00;12,802
13;17/02/2020;?;Multiple targets;IBM X-Force Threat Intelligence researchers discover a phishing campaign distributing the Lokibot information stealer malware via emails designed to look like they're sent by the Ministry of Health of the People's Republic of China and containing emergency Coronavirus regulations in English.;Malware;Y Multiple Industries;CC;>1;https://www.bleepingcomputer.com/news/security/zero-day-in-wordpress-plugin-exploited-to-create-admin-accounts/;Paolo Passeri					;2020-03-17T10:01:13+00:00;12,802
14;17/02/2020;?;Single Individuals;The World Health Organization (WHO) warns of ongoing Coronavirus-themed phishing attacks that impersonate the organization with the end goal of stealing information and delivering malware.;Malicious Spam;X Individual;CC;>1;https://www.bleepingcomputer.com/news/security/zero-day-in-wordpress-plugin-exploited-to-create-admin-accounts/;Paolo Passeri					;2020-03-17T10:01:13+00:00;12,802
15;17/02/2020;?;Instagram users in Russia;A large-scale phishing campaign is running on Instagram to bait Russians with a fake presidential decree that promises a lump-sum payment for a citizen to start their own business.;Account Hijacking;X Individual;CC;RU;https://www.bleepingcomputer.com/news/security/zero-day-in-wordpress-plugin-exploited-to-create-admin-accounts/;Paolo Passeri					;2020-03-17T10:01:13+00:00;12,802
16;17/02/2020;?;Rabun County;The Rabun County is hit with a ransomware attack.;Malware;O Public administration and defence, compulsory social security;CC;US;https://www.bleepingcomputer.com/news/security/zero-day-in-wordpress-plugin-exploited-to-create-admin-accounts/;Paolo Passeri					;2020-03-17T10:01:13+00:00;12,802
17;17/02/2020;?;East House;East House provide notices of a phishing attack occurred on July 25, 2019.;Account Hijacking;Q Human health and social work activities;CC;US;https://www.bleepingcomputer.com/news/security/zero-day-in-wordpress-plugin-exploited-to-create-admin-accounts/;Paolo Passeri					;2020-03-17T10:01:13+00:00;12,802
18;17/02/2020;?;Monroe County Hospital & Clinics;More than 7,000 patients of Monroe County Hospital & Clinics are notified that their personal information may have been leaked in a phishing attack occurred on December 2019.;Account Hijacking;Q Human health and social work activities;CC;US;https://www.bleepingcomputer.com/news/security/zero-day-in-wordpress-plugin-exploited-to-create-admin-accounts/;Paolo Passeri					;2020-03-17T10:01:13+00:00;12,802
19;18/02/2020;?;Undisclosed natural gas compression facility;The Cybersecurity and Infrastructure Security Agency (CISA) alerts organizations across all critical U.S. infrastructure sectors about a recent ransomware attack that affected a natural gas compression facility.;Malware;D Electricity gas steam and air conditioning supply;CC;US;https://www.bleepingcomputer.com/news/security/zero-day-in-wordpress-plugin-exploited-to-create-admin-accounts/;Paolo Passeri					;2020-03-17T10:01:13+00:00;12,802
20;18/02/2020;?;Vulnerable Wordpress sites;Researchers from Wordfence reveal that a zero-day vulnerability in the ThemeREX Addons, a WordPress plugin installed on thousands of sites, is actively exploited by attackers to create user accounts with admin permissions and potentially fully taking over the vulnerable website.;Wordpress plugins vulnerabilities;Y Multiple Industries;CC;>1;https://www.bleepingcomputer.com/news/security/zero-day-in-wordpress-plugin-exploited-to-create-admin-accounts/;Paolo Passeri					;2020-03-17T10:01:13+00:00;12,802
21;18/02/2020;?;ProtonVPN users;Researchers from Kaspersky discover a fake ProtonVPN website used since November 2019 to deliver the AZORult information-stealing malware to potential victims in the form of fake ProtonVPN installers.;Malware;X Individual;CC;>1;https://securityaffairs.co/wordpress/98124/cyber-crime/uncovering-new-magecart-implant.html;Paolo Passeri					;2020-03-17T10:01:13+00:00;12,802
22;18/02/2020;?;Windows users in Italy;Threat actors are distributing the Dharma Ransomware in a new spam campaign targeting Windows users in Italy.   ;Malware;X Individual;CC;IT;https://securityaffairs.co/wordpress/98124/cyber-crime/uncovering-new-magecart-implant.html;Paolo Passeri					;2020-03-17T10:01:13+00:00;12,802
23;18/02/2020;?;Government Data Center in Rwanda;A Rwandan data centre that hosts servers related to the country’s government is taken down by hackers.;DDoS;O Public administration and defence, compulsory social security;CC;RW;https://securityaffairs.co/wordpress/98124/cyber-crime/uncovering-new-magecart-implant.html;Paolo Passeri					;2020-03-17T10:01:13+00:00;12,802
24;19/02/2020;?;MGM Resorts;The personal details of more than 10.6 million users who stayed at MGM Resorts hotels have been published on a hacking forum this week.;Cloud Misconfiguration;I Accommodation and food service activities;CC;US;https://securityaffairs.co/wordpress/98124/cyber-crime/uncovering-new-magecart-implant.html;Paolo Passeri					;2020-03-17T10:01:13+00:00;12,802
25;19/02/2020;DRBControl;Gambling companies located in Southeast Asia, Europe and the Middle East;Researchers from Trend Micro and Talent-Jump reveal the details of DRBControl, a criminal organization focused on gambling companies.;Targeted Attack;R Arts entertainment and recreation;CC;>1;https://securityaffairs.co/wordpress/98124/cyber-crime/uncovering-new-magecart-implant.html;Paolo Passeri					;2020-03-17T10:01:13+00:00;12,802
26;19/02/2020;Exaggerated Lion;Thousands of U.S. companies;Researchers uncover a new business email compromise (BEC) threat actor, which they call Exaggerated Lion, targeting thousands of U.S. companies with money pilfering scams.;Business Email Compromise;Y Multiple Industries;CC;US;https://securityaffairs.co/wordpress/98124/cyber-crime/uncovering-new-magecart-implant.html;Paolo Passeri					;2020-03-17T10:01:13+00:00;12,802
27;19/02/2020;?;US Taxpayers;Proofpoint researchers detect the first attacks in theme with the tax season carried out via tax-themed emails with malicious attachments, and legitimate tax-focused websites compromised to deliver malware;Malware;X Individual;CC;US;https://securityaffairs.co/wordpress/98124/cyber-crime/uncovering-new-magecart-implant.html;Paolo Passeri					;2020-03-17T10:01:13+00:00;12,802
28;19/02/2020;?;Swiss companies;Switzerland’s Reporting and Analysis Centre for Information Assurance (MELANI) warns of ongoing ransomware attacks targeting the systems of Swiss small, medium-sized, and large companies.;Malware;Y Multiple Industries;CC;CH;https://securityaffairs.co/wordpress/98124/cyber-crime/uncovering-new-magecart-implant.html;Paolo Passeri					;2020-03-17T10:01:13+00:00;12,802
29;19/02/2020;?;Multiple targets;"Researchers from Prevailion reveal the details of ""PHPs Labyrinth"", a campaign active since 2017, infecting more than 20,000 WordPress sites via malicious plugins.";Malicious Wordpress plugins;Y Multiple Industries;CC;>1;https://securityaffairs.co/wordpress/98124/cyber-crime/uncovering-new-magecart-implant.html;Paolo Passeri					;2020-03-17T10:01:13+00:00;12,802
30;19/02/2020;?;Multiple targets;Security researcher Marco Ramilli discover a new batch of e-commerce sites compromised by a Magecart attack.;Malicious Script Injection;G Wholesale and retail trade;CC;>1;https://securityaffairs.co/wordpress/98124/cyber-crime/uncovering-new-magecart-implant.html;Paolo Passeri					;2020-03-17T10:01:13+00:00;12,802
31;19/02/2020;?;Ministère de l’Éducation et de l’Enseignement Supérieur;The PII of at least 51,400, and possibly as many as 360,000 educators, in Quebec Province are exposed when a malicious actor obtained login credentials to the Ministère de l’Éducation et de l’Enseignement Supérieur network.;Unknown;O Public administration and defence, compulsory social security;CC;CA;https://www.databreaches.net/ca-vibrantcare-rehabilitation-notifies-patients-after-employee-email-account-compromised/;Paolo Passeri					;2020-03-17T10:01:13+00:00;12,802
32;19/02/2020;?;US Bank Customers;Researchers from IBM X-Force discover a new Emotet campaign spread via SMS messages pretending to be from banks and may have ties to the TrickBot trojan.;Malware;K Financial and insurance activities;CC;US;https://www.databreaches.net/ca-vibrantcare-rehabilitation-notifies-patients-after-employee-email-account-compromised/;Paolo Passeri					;2020-03-17T10:01:13+00:00;12,802
33;19/02/2020;?;Maroof International Hospital;Maroof International Hospital is hit with a severe ransomware attack;Malware;Q Human health and social work activities;CC;PK;https://www.databreaches.net/ca-vibrantcare-rehabilitation-notifies-patients-after-employee-email-account-compromised/;Paolo Passeri					;2020-03-17T10:01:13+00:00;12,802
34;19/02/2020;?;City of Wayne;The city of Wayne is hit with a ransomware attack.;Malware;O Public administration and defence, compulsory social security;CC;US;https://www.databreaches.net/ca-vibrantcare-rehabilitation-notifies-patients-after-employee-email-account-compromised/;Paolo Passeri					;2020-03-17T10:01:13+00:00;12,802
35;19/02/2020;?;United Regional Health Care System;United Regional Health Care System discloses an incident that occurred last July when someone accessed an employee email account. 2,000 individuals are affected.;Account Hijacking;P Education;CC;US;https://www.databreaches.net/ca-vibrantcare-rehabilitation-notifies-patients-after-employee-email-account-compromised/;Paolo Passeri					;2020-03-17T10:01:13+00:00;12,802
36;20/02/2020;?;Defence Information Systems Agency (DISA);The U.S. Defence Information Systems Agency reveals that Social Security numbers and other personal data in its network may have been compromised between May and July 2019;Unknown;O Public administration and defence, compulsory social security;CC;US;https://www.databreaches.net/ca-vibrantcare-rehabilitation-notifies-patients-after-employee-email-account-compromised/;Paolo Passeri					;2020-03-17T10:01:13+00:00;12,802
37;20/02/2020;?;Targets in Southeast Asia;Researchers from Cisco Talos uncover a new campaign, carried out via a remote access tool dubbed ObliqueRAT, focused on targets in Southeast Asia. ;Targeted Attack;Y Multiple Industries;CE;>1;https://www.databreaches.net/ca-vibrantcare-rehabilitation-notifies-patients-after-employee-email-account-compromised/;Paolo Passeri					;2020-03-17T10:01:13+00:00;12,802
38;20/02/2020;?;IIT Madras;IIT Madras is hit with the GlobeImposter ransomware.;Malware;P Education;CC;IN;https://www.databreaches.net/ca-vibrantcare-rehabilitation-notifies-patients-after-employee-email-account-compromised/;Paolo Passeri					;2020-03-17T10:01:13+00:00;12,802
39;20/02/2020;?;Nine websites;Security researchers discover a new batch of nine websites infected with malicious JavaScript that steals payment card info from online shoppers.;Malicious Script Injection;G Wholesale and retail trade;CC;>1;https://www.databreaches.net/ca-vibrantcare-rehabilitation-notifies-patients-after-employee-email-account-compromised/;Paolo Passeri					;2020-03-17T10:01:13+00:00;12,802
40;20/02/2020;?;VibrantCare Rehabilitation;VibrantCare Rehabilitation notifies 1,655 patients after an employee’s email account is accessed.;Account Hijacking;Q Human health and social work activities;CC;US;https://www.databreaches.net/ca-vibrantcare-rehabilitation-notifies-patients-after-employee-email-account-compromised/;Paolo Passeri					;2020-03-17T10:01:13+00:00;12,802
41;20/02/2020;?;San Felipe Del Rio CISD;A business email compromise targets the San Felipe Del Rio CISD.;Business Email Compromise;P Education;CC;US;https://www.databreaches.net/ms-fbi-investigating-after-jackson-public-schools-computer-system-hacked/;Paolo Passeri					;2020-03-17T10:01:13+00:00;12,802
42;20/02/2020;?;South Adams Schools district;The South Adams Schools district is hit with a ransomware attack.;Malware;P Education;CC;US;https://www.databreaches.net/ms-fbi-investigating-after-jackson-public-schools-computer-system-hacked/;Paolo Passeri					;2020-03-17T10:01:13+00:00;12,802
43;21/02/2020;?;Android users;Security researchers from Check Point discover a new mobile threat called Haken, hidden in 8 applications.;Malware;X Individual;CC;>1;https://www.databreaches.net/ms-fbi-investigating-after-jackson-public-schools-computer-system-hacked/;Paolo Passeri					;2020-03-17T10:01:13+00:00;12,802
44;21/02/2020;Lynx;Slickwraps;Slickwraps suffers a data breach after an individual is able to access their systems and after receiving no response to emails, publicly discloses how the access to the site was gained and the data that was exposed.;Path traversal vulnerability;C Manufacturing;CC;US;https://www.databreaches.net/ms-fbi-investigating-after-jackson-public-schools-computer-system-hacked/;Paolo Passeri					;2020-03-17T10:01:13+00:00;12,802
45;21/02/2020;?;Reading Municipal Light Department (RMLD);The Reading Municipal Light Department (RMLD), an electric utility in Massachusetts, announces it was hit by a ransomware attack.;Malware;D Electricity gas steam and air conditioning supply;CC;US;https://www.databreaches.net/ms-fbi-investigating-after-jackson-public-schools-computer-system-hacked/;Paolo Passeri					;2020-03-17T10:01:13+00:00;12,802
46;21/02/2020;Pakistan?;Indian diplomats and military personnel in some embassies;Researchers from Cybaze-Yoroi ZLab discover that operation Transparent Tribe, allegedly carried out by Pakistan against Indian targets is back after four years.;Targeted Attack;O Public administration and defence, compulsory social security;CE;IN;https://www.databreaches.net/ms-fbi-investigating-after-jackson-public-schools-computer-system-hacked/;Paolo Passeri					;2020-03-17T10:01:13+00:00;12,802
47;21/02/2020;?;Multiple targets;Researchers from Cofense discover an uptick in phishing attempts using a fake and badly created Office 365 credentials update form.;Account Hijacking;Y Multiple Industries;CC;>1;https://www.databreaches.net/ms-fbi-investigating-after-jackson-public-schools-computer-system-hacked/;Paolo Passeri					;2020-03-17T10:01:13+00:00;12,802
48;21/02/2020;?;Endeavor Energy Resources;Endeavor Energy Resources notifies employees and dependents after employee fell prey to phishing attack on January 14.;Account Hijacking;D Electricity gas steam and air conditioning supply;CC;US;https://www.databreaches.net/ms-fbi-investigating-after-jackson-public-schools-computer-system-hacked/;Paolo Passeri					;2020-03-17T10:01:13+00:00;12,802
49;21/02/2020;?;Moses Lake School District;The Moses Lake School District is hit by a ransomware attack.;Malware;P Education;CC;US;https://www.databreaches.net/ms-fbi-investigating-after-jackson-public-schools-computer-system-hacked/;Paolo Passeri					;2020-03-17T10:01:13+00:00;12,802
50;21/02/2020;?;Jackson Public Schools;Jackson Public Schools is hit with a ransomware attack.;Malware;P Education;CC;US;https://www.databreaches.net/ms-fbi-investigating-after-jackson-public-schools-computer-system-hacked/;Paolo Passeri					;2020-03-17T10:01:13+00:00;12,802
51;22/02/2020;?;Major cryptovalues investor;An unknown investor claims to have lost reported $45 million worth of cryptovalues In a SIM Swapping attack.;Account Hijacking;V Fintech;CC;N/A;https://securityaffairs.co/wordpress/98390/malware/lampion-malware-v2.html;Paolo Passeri					;2020-03-17T10:01:13+00:00;12,802
52;22/02/2020;?;Single Individuals;Security research collective MalwareHunterTeam discover a 3-page Coronavirus-themed Microsoft Office document containing malicious macros, pretending to be from the Center for Public Health of the Ministry of Health of Ukraine, and designed to drop a backdoor malware with clipboard stealing, keylogging, and screenshot capabilities.;Malware;X Individual;CC;UA;https://securityaffairs.co/wordpress/98390/malware/lampion-malware-v2.html;Paolo Passeri					;2020-03-17T10:01:13+00:00;12,802
53;23/02/2020;?;Mexico’s economy ministry;Mexico’s economy ministry detects a cyber attack on some of its servers.;Unknown;O Public administration and defence, compulsory social security;CC;MX;https://securityaffairs.co/wordpress/98390/malware/lampion-malware-v2.html;Paolo Passeri					;2020-03-17T10:01:13+00:00;12,802
54;23/02/2020;?;Prince Edward Island ;Prince Edward Island reveals it was hit with a Maze ransomware attack.;Malware;O Public administration and defence, compulsory social security;CC;CA;https://securityaffairs.co/wordpress/98390/malware/lampion-malware-v2.html;Paolo Passeri					;2020-03-17T10:01:13+00:00;12,802
55;23/02/2020;?;Total Quality Logistics (TQL) ;Total Quality Logistics confirms it was the victim of a data breach.;Unknown;N Administrative and support service activities;CC;US;https://securityaffairs.co/wordpress/98390/malware/lampion-malware-v2.html;Paolo Passeri					;2020-03-17T10:01:13+00:00;12,802
56;24/02/2020;?;German PayPal users;According to multiple reports, a critical PayPal vulnerability is behind thefts over recent days from numerous German PayPal users (fraudulent transactions with U.S. stores). ;PayPal vulnerability;K Financial and insurance activities;CC;DE;https://securityaffairs.co/wordpress/98390/malware/lampion-malware-v2.html;Paolo Passeri					;2020-03-17T10:01:13+00:00;12,802
57;24/02/2020;Magecart 12;40 websites;Security Researcher Max Kersten publishes a list of 40 websites targeted by the Magecart 12 group.;Malicious Script Injection;G Wholesale and retail trade;CC;>1;https://securityaffairs.co/wordpress/98390/malware/lampion-malware-v2.html;Paolo Passeri					;2020-03-17T10:01:13+00:00;12,802
58;24/02/2020;?;Ordnance Survey;A hacker stole the personal data of 1,000 employees of the Ordnance Survey, the government-owned mapping agency for Britain. The breach occurred on January this year.;Unknown;O Public administration and defence, compulsory social security;CC;UK;https://securityaffairs.co/wordpress/98390/malware/lampion-malware-v2.html;Paolo Passeri					;2020-03-17T10:01:13+00:00;12,802
59;24/02/2020;?;Multiple targets;Researchers from MalwareHunterTeam discover Mozart, a malware using DNS to communicate with its command and control and evade detection.;Malware;Y Multiple Industries;CC;>1;https://securityaffairs.co/wordpress/98390/malware/lampion-malware-v2.html;Paolo Passeri					;2020-03-17T10:01:13+00:00;12,802
60;24/02/2020;?;Portuguese Banking users.;A new campaign carried out via the Lampion malware in disguise of a DPD email, is discovered targeting Portuguese users.;Malware;K Financial and insurance activities;CC;PT;https://securityaffairs.co/wordpress/98390/malware/lampion-malware-v2.html;Paolo Passeri					;2020-03-17T10:01:13+00:00;12,802
61;24/02/2020;?;Pacific Specialty Insurance;Pacific Specialty Insurance notifies plan members of a phishing attack that occurred in March, 2019;Account Hijacking;K Financial and insurance activities;CC;US;https://securityaffairs.co/wordpress/98614/cyber-crime/nrc-health-ransomware.html;Paolo Passeri					;2020-03-17T10:01:13+00:00;12,802
62;24/02/2020;?;Grayson County;Grayson County is hit with a ransomware attack.;Malware;O Public administration and defence, compulsory social security;CC;US;https://securityaffairs.co/wordpress/98614/cyber-crime/nrc-health-ransomware.html;Paolo Passeri					;2020-03-17T10:01:13+00:00;12,802
63;24/02/2020;?;Transavia;The data of 80,000 Transavia passengers are compromised after a phishing attack.;Account Hijacking;H Transportation and storage;CC;NL;https://securityaffairs.co/wordpress/98614/cyber-crime/nrc-health-ransomware.html;Paolo Passeri					;2020-03-17T10:01:13+00:00;12,802
64;24/02/2020;?;Transmit Security;Transmit Security is breached after a security researcher contacts some of its customers and reports unauthorized access to the data.;Unknown;M Professional scientific and technical activities;CC;IL;https://securityaffairs.co/wordpress/98614/cyber-crime/nrc-health-ransomware.html;Paolo Passeri					;2020-03-17T10:01:13+00:00;12,802
65;25/02/2020;?;Multiple targets;Google releases a Chrome update to address three security bugs, including CVE-2020-6418, a zero-day vulnerability actively exploited in the wild.;Google Chrome Vulnerability (CVE-2020-6418);Y Multiple Industries;CC;>1;https://securityaffairs.co/wordpress/98614/cyber-crime/nrc-health-ransomware.html;Paolo Passeri					;2020-03-17T10:01:13+00:00;12,802
66;25/02/2020;?;La Salle County;La Salle County is hit with a PwndLocker ransomware attack.;Malware;O Public administration and defence, compulsory social security;CC;US;https://securityaffairs.co/wordpress/98614/cyber-crime/nrc-health-ransomware.html;Paolo Passeri					;2020-03-17T10:01:13+00:00;12,802
67;25/02/2020;?;Single Individuals;Researchers from Cybaze/Yoroi ZLab discover a new campaign exploiting the Coronavirus theme to distribute the Remcos RAT.;Malware;X Individual;CC;>1;https://securityaffairs.co/wordpress/98614/cyber-crime/nrc-health-ransomware.html;Paolo Passeri					;2020-03-17T10:01:13+00:00;12,802
