id;date;author;target;description;attack;target_class;attack_class;country;link;author_report;date_report;views
68;25/02/2020;?;Reprint Mint;Researchers from Sanguine Security reveal that attackers successfully implanted multiple skimmers, for 30 months on Reprint Mint photo store.;Malicious Script Injection;G Wholesale and retail trade;CC;US;https://securityaffairs.co/wordpress/98614/cyber-crime/nrc-health-ransomware.html;Paolo Passeri					;2020-03-17T10:01:13+00:00;12,802
69;25/02/2020;"tonyredball
solarsalvador1234";Vulnerable Wordpress sites;Other Cybercriminals are taking advantage of the security flaws reported recently in popular WordPress plugins (ThemeGrill Demo Importer, Profile Builder, and Duplicator).;Wordpress plugins vulnerabilities;Y Multiple Industries;CC;>1;https://securityaffairs.co/wordpress/98614/cyber-crime/nrc-health-ransomware.html;Paolo Passeri					;2020-03-17T10:01:13+00:00;12,802
70;25/02/2020;?;NRC Health;NRC Health discloses that it was hit by a ransomware attack that took place on February 11.;Malware;M Professional scientific and technical activities;CC;US;https://securityaffairs.co/wordpress/98614/cyber-crime/nrc-health-ransomware.html;Paolo Passeri					;2020-03-17T10:01:13+00:00;12,802
71;25/02/2020;?;Undisclosed target;Researchers from Sophos reveal the details of Cloud Snooper, a sophisticated malware hiding in the cloud, probably backed by an advanced state sponsored actor.;Unknown;Z Unknown;CE;N/A;https://www.theregister.co.uk/2020/02/28/southern_water_phishing/;Paolo Passeri					;2020-03-17T10:01:13+00:00;12,802
72;25/02/2020;;Overlake Medical Center & Clinics;Overlake Medical Center & Clinics reveals to have been hit by a phishing attack from Dec. 6 to 9, 2019.;Account Hijacking;Q Human health and social work activities;CC;US;https://www.theregister.co.uk/2020/02/28/southern_water_phishing/;Paolo Passeri					;2020-03-17T10:01:13+00:00;12,802
73;25/02/2020;?;Advocate Aurora Health;"The personal information of some current and former Advocate Aurora Health employees, including their Social Security numbers and bank accounts, might have been compromised in an email phishing campaign.
";Account Hijacking;Q Human health and social work activities;CC;US;https://www.theregister.co.uk/2020/02/28/southern_water_phishing/;Paolo Passeri					;2020-03-17T10:01:13+00:00;12,802
74;25/02/2020;?;Gadsden Independent School District (GISD);Gadsden Independent School District (GISD) shuts down its internet and communication systems, after a RYUK ransomware attack.;Malware;P Education;CC;US;https://www.theregister.co.uk/2020/02/28/southern_water_phishing/;Paolo Passeri					;2020-03-17T10:01:13+00:00;12,802
75;25/02/2020;?;Hutt Valley High School;Hutt Valley High School reveals that it was hit with a cyber attack.;Unknown;P Education;CC;NZ;https://www.theregister.co.uk/2020/02/28/southern_water_phishing/;Paolo Passeri					;2020-03-17T10:01:13+00:00;12,802
76;26/02/2020;?;Clearview AI;Clearview AI discloses to its customers that an intruder “gained unauthorized access” to its list of customers, to the number of user accounts those customers had set up, and to the number of searches its customers have conducted.;Misconfiguration;M Professional scientific and technical activities;CC;US;https://www.theregister.co.uk/2020/02/28/southern_water_phishing/;Paolo Passeri					;2020-03-17T10:01:13+00:00;12,802
77;26/02/2020;?;Bretagne Télécom;Cloud services provider Bretagne Télécom is hacked by the threat actors behind the DoppelPaymer Ransomware using CVE-2019-19781.;Malware;M Professional scientific and technical activities;CC;FR;https://www.theregister.co.uk/2020/02/28/southern_water_phishing/;Paolo Passeri					;2020-03-17T10:01:13+00:00;12,802
78;26/02/2020;?;Multiple targets;Attackers are actively scanning the Internet for Microsoft Exchange Servers vulnerable to the CVE-2020-0688 remote code execution.;CVE-2020-0688 vulnerability;Y Multiple Industries;CC;>1;https://www.theregister.co.uk/2020/02/28/southern_water_phishing/;Paolo Passeri					;2020-03-17T10:01:13+00:00;12,802
79;26/02/2020;?;Multiple targets;Researchers from Malwarebytes discover Magecart actors cloaking their credit card skimmers using fake content delivery network domains.;Malicious Script Injection;Y Multiple Industries;CC;>1;https://www.theregister.co.uk/2020/02/28/southern_water_phishing/;Paolo Passeri					;2020-03-17T10:01:13+00:00;12,802
80;26/02/2020;?;Southern Water;British utility Southern Water is the victim of a phishing attack, resulting in a shutdown of some of the company's systems.;Account Hijacking;D Electricity gas steam and air conditioning supply;CC;UK;https://www.theregister.co.uk/2020/02/28/southern_water_phishing/;Paolo Passeri					;2020-03-17T10:01:13+00:00;12,802
81;26/02/2020;Cobalt Ulster (AKA MuddyWater, Seedworm, TEMP.Zagros, and Static Kitten);Governmental organizations in Turkey, Jordan, Iraq along with intergovernmental and other agencies in Georgia and Azerbaijan.;Researchers from Secureworks reveal the details of the latest cyber espionage campaign carried out by the Iranian state-sponsored actor Cobalt Ulster;Targeted Attack;O Public administration and defence, compulsory social security;CE;>1;https://www.forbes.com/sites/thomasbrewster/2020/02/28/fbi-warned-of-fraudsters-paradise-up-to-130000-hacked-asus-routers-on-sale-for-a-few-dollars/#79a330d82009;Paolo Passeri					;2020-03-17T10:01:13+00:00;12,802
82;26/02/2020;?;Rady’s Children’s Hospital;"Rady’s Children’s Hospital notifies patients whose data were accessed via an ""open port"" on June 2019, and January 2020.";Unknown;Q Human health and social work activities;CC;US;https://www.forbes.com/sites/thomasbrewster/2020/02/28/fbi-warned-of-fraudsters-paradise-up-to-130000-hacked-asus-routers-on-sale-for-a-few-dollars/#79a330d82009;Paolo Passeri					;2020-03-17T10:01:13+00:00;12,802
83;27/02/2020;?;Barbara Corcoran;Barbara Corcoran, a renowned real-estate broker and business expert, admits she lost $380,000 via a BEC scam.;Business Email Compromise;L Real estate activities;CC;US;https://www.forbes.com/sites/thomasbrewster/2020/02/28/fbi-warned-of-fraudsters-paradise-up-to-130000-hacked-asus-routers-on-sale-for-a-few-dollars/#79a330d82009;Paolo Passeri					;2020-03-17T10:01:13+00:00;12,802
84;27/02/2020;?;Kenneth Cole Productions;The operators behind the Sodinokibi Ransomware (AKA Revil) publish the download links to files containing what they claim is financial and work documents, as well as customers' personal data stolen from Kenneth Cole Productions.;Malware;C Manufacturing;CC;US;https://www.forbes.com/sites/thomasbrewster/2020/02/28/fbi-warned-of-fraudsters-paradise-up-to-130000-hacked-asus-routers-on-sale-for-a-few-dollars/#79a330d82009;Paolo Passeri					;2020-03-17T10:01:13+00:00;12,802
85;27/02/2020;?;Single Individuals;Researchers from Malwarebytes and X-Force discover an ongoing malspam campaign using emails disguised as messages from secret lovers to deliver Nemty Ransomware payloads on the computers of potential victims.;Malware;X Individual;CC;>1;https://www.forbes.com/sites/thomasbrewster/2020/02/28/fbi-warned-of-fraudsters-paradise-up-to-130000-hacked-asus-routers-on-sale-for-a-few-dollars/#79a330d82009;Paolo Passeri					;2020-03-17T10:01:13+00:00;12,802
86;27/02/2020;?;Multiple targets;Researchers from Palo Alto discover a new phishing campaign installing the NetSupport Manager RAT via a Fake Norton LifeLock document.;Malicious Spam;Y Multiple Industries;CC;>1;https://www.forbes.com/sites/thomasbrewster/2020/02/28/fbi-warned-of-fraudsters-paradise-up-to-130000-hacked-asus-routers-on-sale-for-a-few-dollars/#79a330d82009;Paolo Passeri					;2020-03-17T10:01:13+00:00;12,802
87;27/02/2020;?;"BGR.in
tradinggame.au.com
S3 Production";Hackers share three SQL databases from S3 buckets, one dump belonging to the BGR tech news site in India.;Misconfigured AWS S3 Bucket;Y Multiple Industries;CC;>1;https://www.forbes.com/sites/thomasbrewster/2020/02/28/fbi-warned-of-fraudsters-paradise-up-to-130000-hacked-asus-routers-on-sale-for-a-few-dollars/#79a330d82009;Paolo Passeri					;2020-03-17T10:01:13+00:00;12,802
88;27/02/2020;?;Democratic National Committee;The Democratic National Committee warns its presidential candidates to be cautious after Bernie Sanders’ campaign reported that an “impersonator” with a domain registered overseas had posed as one of its staffers and sought conversations with members of at least two other campaigns.;Account Hijacking;S Other service activities;CE;US;https://www.forbes.com/sites/thomasbrewster/2020/02/28/fbi-warned-of-fraudsters-paradise-up-to-130000-hacked-asus-routers-on-sale-for-a-few-dollars/#79a330d82009;Paolo Passeri					;2020-03-17T10:01:13+00:00;12,802
89;27/02/2020;?;Jordan Health;Jordan Health is hit with a ransomware attack.;Malware;P Education;CC;US;https://www.forbes.com/sites/thomasbrewster/2020/02/28/fbi-warned-of-fraudsters-paradise-up-to-130000-hacked-asus-routers-on-sale-for-a-few-dollars/#79a330d82009;Paolo Passeri					;2020-03-17T10:01:13+00:00;12,802
90;28/02/2020;?;130,000 Asus routers;An unknown criminal manages to breach as many as 130,000 Asus routers, and sells the access to them for few dollars.;Router vulnerability;Y Multiple Industries;CC;>1;https://www.forbes.com/sites/thomasbrewster/2020/02/28/fbi-warned-of-fraudsters-paradise-up-to-130000-hacked-asus-routers-on-sale-for-a-few-dollars/#79a330d82009;Paolo Passeri					;2020-03-17T10:01:13+00:00;12,802
91;28/02/2020;?;Multiple targets;Researchers from Morphisec discover a widespread campaign using the remote desktop ActiveX control in Word documents to automatically execute on Windows 10 a malware downloader called Ostap adopted by TrickBot for delivery.;Malware;Y Multiple Industries;CC;>1;https://www.theregister.co.uk/2020/03/02/financial_startup_loqbox_data_breach/;Paolo Passeri					;2020-03-17T10:01:13+00:00;12,802
92;28/02/2020;?;Vulnerable Wordpress sites;Researchers from Defiant discover that attackers took over tens of thousands of WordPress sites by exploiting multiple zero-days in the following plugins:  Flexible Checkout Fields for WooCommerce, Async JavaScript, 10Web Map Builder for Google Maps, Modern Events Calendar Lite.;Wordpress plugins vulnerabilities;Y Multiple Industries;CC;>1;https://www.theregister.co.uk/2020/03/02/financial_startup_loqbox_data_breach/;Paolo Passeri					;2020-03-17T10:01:13+00:00;12,802
93;28/02/2020;?;Munson Healthcare Group;Munson Healthcare Group discloses that hackers gained access to patient data placed by compromising the email accounts of at least two employees. Patient records were accessed from July 31, 2019, to October 22, 2019, but the breach went undetected until January 16, 2020.;Account Hijacking;Q Human health and social work activities;CC;US;https://www.theregister.co.uk/2020/03/02/financial_startup_loqbox_data_breach/;Paolo Passeri					;2020-03-17T10:01:13+00:00;12,802
94;29/02/2020;?;Epiq Global;Legal services giant Epiq Global is hit by a ransomware attack.;Malware;M Professional scientific and technical activities;CC;US;https://www.theregister.co.uk/2020/03/02/financial_startup_loqbox_data_breach/;Paolo Passeri					;2020-03-17T10:01:13+00:00;12,802
95;29/02/2020;?;RailWorks Corporation;RailWorks Corporation, one of the leading providers of rail infrastructure solutions in North America, discloses a ransomware attack.;Malware;C Manufacturing;CC;US;https://www.theregister.co.uk/2020/03/02/financial_startup_loqbox_data_breach/;Paolo Passeri					;2020-03-17T10:01:13+00:00;12,802
96;29/02/2020;?;Vulnerable Apache Tomcat servers;Security researchers detect ongoing scans for Apache Tomcat servers unpatched against the Ghostcat (CVE-2020-1938) vulnerability.;Ghostcat (CVE-2020-1938) vulnerability;Y Multiple Industries;CC;>1;https://www.theregister.co.uk/2020/03/02/financial_startup_loqbox_data_breach/;Paolo Passeri					;2020-03-17T10:01:13+00:00;12,802
97;29/02/2020;?;Loqbox;"Fintech startup Loqbox reveals to have suffered an ""attack"" which potentially revealed its customers' names, postal addresses, dates of birth, email addresses and phone numbers.";Unknown;V Fintech;CC;UK;https://www.theregister.co.uk/2020/03/02/financial_startup_loqbox_data_breach/;Paolo Passeri					;2020-03-17T10:01:13+00:00;12,802
1;06/03/2019;Egypt’s General Intelligence Service;Egyptian civil rights activists and journalists;Amnesty International discovers a wave of attacks, likely originated from government-backed bodies, starting from early January 2019 and targeting the email accounts of several Egyptian human rights defenders, media and civil society organizations;Account Hijacking;Not Found;Not Found;EG;https://edition.cnn.com/2019/10/01/politics/fbi-hacking-attempt-alleged-mobile-voting-app-voatz/index.html;Paolo Passeri					;2019-11-07T14:18:06+00:00;20,249
2;17/09/2019;?;Multiple targets;The Federal Bureau of Investigation (FBI) sends a security advisory to private industry partners about the rising threat of attacks against organizations and their employees that can bypass MFA.;Account Hijacking;Not Found;Not Found;US;https://edition.cnn.com/2019/10/01/politics/fbi-hacking-attempt-alleged-mobile-voting-app-voatz/index.html;Paolo Passeri					;2019-11-07T14:18:06+00:00;20,249
3;17/09/2019;?;Kent State University;Kent State University announces over 3,000 student emails has been hacked the week before, as a result of credential harvesting.;Account Hijacking;Not Found;Not Found;US;https://edition.cnn.com/2019/10/01/politics/fbi-hacking-attempt-alleged-mobile-voting-app-voatz/index.html;Paolo Passeri					;2019-11-07T14:18:06+00:00;20,249
4;25/09/2019;?;US, Italian, and Japanese users;Researchers from Confiant discover OSX/Tarmac, a new malware was distributed to macOS users via online malvertising campaigns.;Malware;Not Found;Not Found;"US
IT
JP";https://edition.cnn.com/2019/10/01/politics/fbi-hacking-attempt-alleged-mobile-voting-app-voatz/index.html;Paolo Passeri					;2019-11-07T14:18:06+00:00;20,249
5;27/09/2019;?;Cancer Treatment Centers of America at Southeastern Regional Medical Center;Cancer Treatment Centers of America at Southeastern Regional Medical Center notifies of a phishing incident, potentially impacting 4,559 patients.;Account Hijacking;Not Found;Not Found;US;https://edition.cnn.com/2019/10/01/politics/fbi-hacking-attempt-alleged-mobile-voting-app-voatz/index.html;Paolo Passeri					;2019-11-07T14:18:06+00:00;20,249
6;27/09/2019;?;Catholic Health Initiative (CHI) at Lakeside Hospital;The CHI Health clinic at Lakeside Hospital informs patients that their personal information may have been exposed during a ransomware incident, occurred Aug. 1.;Malware;Not Found;Not Found;US;https://edition.cnn.com/2019/10/01/politics/fbi-hacking-attempt-alleged-mobile-voting-app-voatz/index.html;Paolo Passeri					;2019-11-07T14:18:06+00:00;20,249
7;30/09/2019;?;Bradford City Hall;Bradford City Hall suffers a ransomware attack.;Malware;Not Found;Not Found;US;https://edition.cnn.com/2019/10/01/politics/fbi-hacking-attempt-alleged-mobile-voting-app-voatz/index.html;Paolo Passeri					;2019-11-07T14:18:06+00:00;20,249
8;01/10/2019;?;US petroleum industry;Researchers from Netskope discover a campaign against the US petroleum industry carried out via a new Adwind Remote Access Trojan (RAT) variant.;Targeted Attack;Not Found;Not Found;US;https://edition.cnn.com/2019/10/01/politics/fbi-hacking-attempt-alleged-mobile-voting-app-voatz/index.html;Paolo Passeri					;2019-11-07T14:18:06+00:00;20,249
9;01/10/2019;?;DCH Regional Medical Center in Tuscaloosa;DCH Regional Medical Center in Tuscaloosa is paralyzed by a Ryuk ransomware attack and forced to turn away patients.;Malware;Not Found;Not Found;US;https://edition.cnn.com/2019/10/01/politics/fbi-hacking-attempt-alleged-mobile-voting-app-voatz/index.html;Paolo Passeri					;2019-11-07T14:18:06+00:00;20,249
10;01/10/2019;?;Voatz, West Virginia's mobile voting app;The FBI is investigating after someone allegedly tried to hack into Voatz, West Virginia's mobile voting app during the 2018 midterm elections.;Unknown;Not Found;Not Found;US;https://edition.cnn.com/2019/10/01/politics/fbi-hacking-attempt-alleged-mobile-voting-app-voatz/index.html;Paolo Passeri					;2019-11-07T14:18:06+00:00;20,249
11;01/10/2019;?;Northport Medical Center;Northport Medical Center is also paralyzed by a Ryuk ransomware attack.;Malware;Not Found;Not Found;US;https://www.bleepingcomputer.com/news/security/threat-group-uses-bitly-blogspot-pastebin-to-deliver-trojans-rats/;Paolo Passeri					;2019-11-07T14:18:06+00:00;20,249
12;01/10/2019;?;Fayette Medical Center;… And the Fayette Medical Center suffers the same fate…;Malware;Not Found;Not Found;US;https://www.bleepingcomputer.com/news/security/threat-group-uses-bitly-blogspot-pastebin-to-deliver-trojans-rats/;Paolo Passeri					;2019-11-07T14:18:06+00:00;20,249
13;01/10/2019;?;Seven Hospitals in Victoria Australia;Seven hospitals in Victoria, Australia, are also paralyzed for more than 24 hours for a ransomware attack.;Malware;Not Found;Not Found;AU;https://www.bleepingcomputer.com/news/security/threat-group-uses-bitly-blogspot-pastebin-to-deliver-trojans-rats/;Paolo Passeri					;2019-11-07T14:18:06+00:00;20,249
14;01/10/2019;?;North Florida OB-GYN;North Florida OB-GYN notifies its patients of a ransomware attack discovered on July 27. Potentially 520,000 users are affected.;Malware;Not Found;Not Found;US;https://www.bleepingcomputer.com/news/security/threat-group-uses-bitly-blogspot-pastebin-to-deliver-trojans-rats/;Paolo Passeri					;2019-11-07T14:18:06+00:00;20,249
15;01/10/2019;?;Single Individuals;Researchers from The Media Trust discover a malvertising operation designed to infect online publishers with browser-hijacking malware called Ghostcat-3PC, which launched at least 18 separate infection campaigns in the last three months alone.;Malvertising;Not Found;Not Found;>1;https://www.bleepingcomputer.com/news/security/threat-group-uses-bitly-blogspot-pastebin-to-deliver-trojans-rats/;Paolo Passeri					;2019-11-07T14:18:06+00:00;20,249
16;01/10/2019;?;Luzerne County;A school district in Luzerne County confirms it was the victim of a ransomware attack that locked up their computers for weeks.;Malware;Not Found;Not Found;US;https://www.bleepingcomputer.com/news/security/threat-group-uses-bitly-blogspot-pastebin-to-deliver-trojans-rats/;Paolo Passeri					;2019-11-07T14:18:06+00:00;20,249
17;02/10/2019;?;Multiple Targets;The UK’s National Cyber Security Centre (NCSC) warns of attacks exploiting recently disclosed VPN vulnerabilities in Fortinet, Palo Alto Networks and Pulse Secure.;CVE-2019-11510, CVE-2019-11539, CVE-2018-13379;Not Found;Not Found;UK;https://www.bleepingcomputer.com/news/security/threat-group-uses-bitly-blogspot-pastebin-to-deliver-trojans-rats/;Paolo Passeri					;2019-11-07T14:18:06+00:00;20,249
18;02/10/2019;?;Zendesk;Customer service software company Zendesk notifies a security incident, occurred in 2016, that might have impacted roughly 10,000 Zendesk Support and Chat accounts activated prior to November 1, 2016.;Unknown;Not Found;Not Found;US;https://www.bleepingcomputer.com/news/security/threat-group-uses-bitly-blogspot-pastebin-to-deliver-trojans-rats/;Paolo Passeri					;2019-11-07T14:18:06+00:00;20,249
19;02/10/2019;?;McAlister's Deli, Moe’s Southwest Grill, and Schlotzsky’s;McAlister's Deli, Moe’s Southwest Grill, and Schlotzsky’s (all of them owned by Focus Brands) disclose publicly that their networks were infected with point-of-sale malware.;PoS Malware;Not Found;Not Found;US;https://www.bleepingcomputer.com/news/security/threat-group-uses-bitly-blogspot-pastebin-to-deliver-trojans-rats/;Paolo Passeri					;2019-11-07T14:18:06+00:00;20,249
20;02/10/2019;?;Gorgon Group;Researchers from Prevailion discover MasterMana, a malicious campaign targeting corporations from all over the world, using a combination of pages hosted on Bit.ly, BlogSpot, and Pastebin to deliver Azorult and RevengeRAT malware.;Malware;Not Found;Not Found;>1;https://www.bleepingcomputer.com/news/security/threat-group-uses-bitly-blogspot-pastebin-to-deliver-trojans-rats/;Paolo Passeri					;2019-11-07T14:18:06+00:00;20,249
21;02/10/2019;Silent Starling;Over 500 companies in 14 countries.;In a variation of the business email compromise (BEC) scam dubbed Vendor Email Compromise (VEC), a cyber gang manages to compromise email accounts of more than 700 employees from over 500 companies in 14 countries.;BEC;Not Found;Not Found;>1;https://www.zdnet.com/article/a-huge-android-trojan-malware-campaign-was-discovered-after-the-gang-behind-it-made-basic-security-mistakes/;Paolo Passeri					;2019-11-07T14:18:06+00:00;20,249
22;02/10/2019;?;Italian users;Researchers from Certego discover FTCode, a Powershell ransomware targeting Italian users.;Malware;Not Found;Not Found;IT;https://www.zdnet.com/article/a-huge-android-trojan-malware-campaign-was-discovered-after-the-gang-behind-it-made-basic-security-mistakes/;Paolo Passeri					;2019-11-07T14:18:06+00:00;20,249
23;02/10/2019;?;Single Individuals;Researchers from FireEye reveal that attackers are using hacked web sites that promote fake browser updates to infect targets with banking trojans and ransomware.;Malware;Not Found;Not Found;>1;https://www.zdnet.com/article/a-huge-android-trojan-malware-campaign-was-discovered-after-the-gang-behind-it-made-basic-security-mistakes/;Paolo Passeri					;2019-11-07T14:18:06+00:00;20,249
24;02/10/2019;APT17;Japanese government agencies;Researchers at JPCERT reveal the details of a campaign targeting Japanese government agencies and exploiting a vulnerability in the local Sanshiro spreadsheet application (CVE-2014-0810). ;Targeted Attack;Not Found;Not Found;JP;https://www.zdnet.com/article/a-huge-android-trojan-malware-campaign-was-discovered-after-the-gang-behind-it-made-basic-security-mistakes/;Paolo Passeri					;2019-11-07T14:18:06+00:00;20,249
25;02/10/2019;Bronze Butler;Japanese government agencies;Researchers at JPCERT reveal the details of a campaign targeting Japanese government agencies and exploiting a vulnerability in the local SkySea Client View software (CVE-2016-7836).;Targeted Attack;Not Found;Not Found;JP;https://www.zdnet.com/article/a-huge-android-trojan-malware-campaign-was-discovered-after-the-gang-behind-it-made-basic-security-mistakes/;Paolo Passeri					;2019-11-07T14:18:06+00:00;20,249
26;02/10/2019;?;City of Cornelia;A ransomware attack on City of Cornelia’s billing system results in a day of lost productivity.;Malware;Not Found;Not Found;US;https://www.zdnet.com/article/a-huge-android-trojan-malware-campaign-was-discovered-after-the-gang-behind-it-made-basic-security-mistakes/;Paolo Passeri					;2019-11-07T14:18:06+00:00;20,249
27;02/10/2019;?;Tukwila School District;"The Tukwila School District is the victim of a “phishing scam"".";Account Hijacking;Not Found;Not Found;US;https://www.zdnet.com/article/a-huge-android-trojan-malware-campaign-was-discovered-after-the-gang-behind-it-made-basic-security-mistakes/;Paolo Passeri					;2019-11-07T14:18:06+00:00;20,249
28;03/10/2019;PKPLUG (China);Southeast Asian region since 2013;Researchers from Palo Alto Networks discover PKPLUG, a previously undocumented threat actor of Chinese origin that has run at least six cyber espionage campaigns in the Southeast Asian region since 2013 using the PlugX malware.;Targeted Attack;Not Found;Not Found;>1;https://www.zdnet.com/article/a-huge-android-trojan-malware-campaign-was-discovered-after-the-gang-behind-it-made-basic-security-mistakes/;Paolo Passeri					;2019-11-07T14:18:06+00:00;20,249
29;03/10/2019;Avivore;European industries in the aerospace and defense sector;Researchers from Context reveal the details of Avivore, the threat actor behind the recent attacks to European industries in the aerospace and defense sector.;Targeted Attack;Not Found;Not Found;>1;https://www.zdnet.com/article/a-huge-android-trojan-malware-campaign-was-discovered-after-the-gang-behind-it-made-basic-security-mistakes/;Paolo Passeri					;2019-11-07T14:18:06+00:00;20,249
30;03/10/2019;?;Android users;Researchers from Czech Technical University, UNCUYO University in Argentina, and Avast discover Geost, a giant botnet and banking trojan operation that has infected around 800,000 Android users since at least 2016.;Malware;Not Found;Not Found;>1;https://www.zdnet.com/article/a-huge-android-trojan-malware-campaign-was-discovered-after-the-gang-behind-it-made-basic-security-mistakes/;Paolo Passeri					;2019-11-07T14:18:06+00:00;20,249
31;03/10/2019;Turla;Single Individuals;Researchers from Kaspersky detail attempts by a Russian group, Turla, to fingerprint TLS-encrypted web traffic by modifying Chrome and Firefox using the Redactor module.;Malware;Not Found;Not Found;>1;https://www.wired.it/internet/web/2019/10/08/anonymous-partito-democratico/?refresh_ce=;Paolo Passeri					;2019-11-07T14:18:06+00:00;20,249
32;03/10/2019;?;Financial users in South America;"Researchers from ESET discover Casbaneiro, a banking trojan targeting South America, hiding the C2 server addresses in fake websites and in descriptions for YouTube videos.
";Malware;Not Found;Not Found;>1;https://www.wired.it/internet/web/2019/10/08/anonymous-partito-democratico/?refresh_ce=;Paolo Passeri					;2019-11-07T14:18:06+00:00;20,249
33;03/10/2019;?;Montgomery County Public Schools;Montgomery County Public Schools forces password reset after the Naviance career service is hacked.;Brute Force;Not Found;Not Found;US;https://www.wired.it/internet/web/2019/10/08/anonymous-partito-democratico/?refresh_ce=;Paolo Passeri					;2019-11-07T14:18:06+00:00;20,249
