id;date;author;target;description;attack;target_class;attack_class;country;link;author_report;date_report;views
34;03/10/2019;?;Goshen Health;Goshen Health notifies potentially affected patients that an unauthorized third party may have potentially accessed two employees’ email accounts from approximately August 2, 2018 to August 13, 2018.;Account Hijacking;Not Found;Not Found;US;https://www.wired.it/internet/web/2019/10/08/anonymous-partito-democratico/?refresh_ce=;Paolo Passeri					;2019-11-07T14:18:06+00:00;20,249
35;04/10/2019;Phosphorous, aka APT35, Charming Kitten (linked to Iran);241 email accounts including a US presidential campaign, current and former US officials, journalists and expatriate Iranians;Microsoft reveals that Phosphorous, a  group linked to the Iranian government, attacked 241 email accounts between August and September, including a US presidential campaign, US officials, journalists covering world politics as well as Iran expats.;Targeted Attack;Not Found;Not Found;US;https://www.wired.it/internet/web/2019/10/08/anonymous-partito-democratico/?refresh_ce=;Paolo Passeri					;2019-11-07T14:18:06+00:00;20,249
36;04/10/2019;?;City of Jerez de la Frontera;A hacker takes over the computer system of the southern Spanish city of Jerez de la Frontera and demands a ransom paid in bitcoin to unlock it.;Malware;Not Found;Not Found;ES;https://www.wired.it/internet/web/2019/10/08/anonymous-partito-democratico/?refresh_ce=;Paolo Passeri					;2019-11-07T14:18:06+00:00;20,249
37;04/10/2019;?;US-based server owned by an engineering company that provides services to the oil, gas and chemical industries. ;Researchers from Check Point disclose an ongoing hacking campaign targeting Asterisk FreePBX, one of the world's most popular services for making voice over IP phone calls.;Asterisk FreePBX Vulnerability;Not Found;Not Found;US;https://www.wired.it/internet/web/2019/10/08/anonymous-partito-democratico/?refresh_ce=;Paolo Passeri					;2019-11-07T14:18:06+00:00;20,249
38;04/10/2019;?;University of Alabama at Birmingham (UAB Medical);UAB Medical is hit by a phishing attack occurred on August 7th, 2019, which targeted the payroll department. The attackers gained access to numerous employee emails containing the health information for 19,557 patients.;Account Hijacking;Not Found;Not Found;US;https://www.wired.it/internet/web/2019/10/08/anonymous-partito-democratico/?refresh_ce=;Paolo Passeri					;2019-11-07T14:18:06+00:00;20,249
39;05/10/2019;?;Tū Ora Compass Health;In the wake of a cyber attack occurred in August, Tū Ora Compass Health discovers to have been affected by a cyber attack from 2016 to March 2019, resulting in the potential exposure of sensitive medical information belonging to one million individuals.  ;Unknown;Not Found;Not Found;NZ;https://www.wired.it/internet/web/2019/10/08/anonymous-partito-democratico/?refresh_ce=;Paolo Passeri					;2019-11-07T14:18:06+00:00;20,249
40;06/10/2019;Anonymous Italia;Italian Democratic Party;Anonymous Italia hacks 8 websites of the Italian Democratic Party (PD) and leaks 220 databases containing personal data in clear text.;SQLi;Not Found;Not Found;IT;https://www.wired.it/internet/web/2019/10/08/anonymous-partito-democratico/?refresh_ce=;Paolo Passeri					;2019-11-07T14:18:06+00:00;20,249
41;06/10/2019;?;Bonjour-Santé;Bonjour-Santé, a private Quebec medical-booking service that promises quick appointments, was the victim of a cyber attack.;Malware;Not Found;Not Found;CA;https://www.zdnet.com/article/new-sextortion-campaign-taps-altcoins-to-avoid-detection/;Paolo Passeri					;2019-11-07T14:18:06+00:00;20,249
42;06/10/2019;Nathan;TOMS Shoes;A hacker dubbed Nathan uses the mailing list of retailer TOMS Shoes to tell users it's time to log off.;Unknown;Not Found;Not Found;US;https://www.zdnet.com/article/new-sextortion-campaign-taps-altcoins-to-avoid-detection/;Paolo Passeri					;2019-11-07T14:18:06+00:00;20,249
43;07/10/2019;?;Multiple targets;The NSA warns of multiple state-sponsored cyberespionage groups exploiting enterprise VPN Flaws in Fortinet, Palo Alto Networks and Pulse Secure.;CVE-2019-11510, CVE-2019-11539, CVE-2018-13379;Not Found;Not Found;US;https://www.zdnet.com/article/new-sextortion-campaign-taps-altcoins-to-avoid-detection/;Paolo Passeri					;2019-11-07T14:18:06+00:00;20,249
44;07/10/2019;?;Volusion;Hackers breach the infrastructure of Volusion, a provider of cloud-hosted online stores, and deliver malicious code that records and steals payment card details entered by users in online forms. More than 6,500 stores are impacted,;Malicious Script Injection;Not Found;Not Found;;https://www.zdnet.com/article/new-sextortion-campaign-taps-altcoins-to-avoid-detection/;Paolo Passeri					;2019-11-07T14:18:06+00:00;20,249
45;07/10/2019;?;Beeline;The data of 8.7 million customers from Russian internet service provider Beeline is being sold and shared online. The breach occurred in 2017.;Unknown;Not Found;Not Found;RU;https://www.zdnet.com/article/new-sextortion-campaign-taps-altcoins-to-avoid-detection/;Paolo Passeri					;2019-11-07T14:18:06+00:00;20,249
46;07/10/2019;?;Multiple targets;Researchers from Akamai warn that one year after the official patching, attackers are still actively exploiting Drupalgeddon 2 (CVE-2018-7600).;Drupal vulnerability (CVE-2018-7600);Not Found;Not Found;>1;https://www.zdnet.com/article/new-sextortion-campaign-taps-altcoins-to-avoid-detection/;Paolo Passeri					;2019-11-07T14:18:06+00:00;20,249
47;07/10/2019;?;Targeting service providers and engineering firms;ANSSI, the National Cybersecurity Agency of France (Agence Nationale de la Sécurité des Systèmes d'Information) publishes an alert on cyber-espionage campaigns targeting service providers and engineering firms.;Targeted Attack;Not Found;Not Found;FR;https://www.zdnet.com/article/new-sextortion-campaign-taps-altcoins-to-avoid-detection/;Paolo Passeri					;2019-11-07T14:18:06+00:00;20,249
48;07/10/2019;Tobias Frömel;Muhstik gang;Tobias Frömel, a German researcher hacks the attackers' database, after being victim of the Muhstik ransomware.;Unknown;Not Found;Not Found;N/A;https://www.zdnet.com/article/new-sextortion-campaign-taps-altcoins-to-avoid-detection/;Paolo Passeri					;2019-11-07T14:18:06+00:00;20,249
49;07/10/2019;?;Hibiscus Petroleum;Hibiscus Petroleum reveals that its IT system was “subjected to an attack” the previous week.;Unknown;Not Found;Not Found;MY;https://www.zdnet.com/article/new-sextortion-campaign-taps-altcoins-to-avoid-detection/;Paolo Passeri					;2019-11-07T14:18:06+00:00;20,249
50;08/10/2019;?;Single Individuals;Researchers from Cofense discover a new sextortion campaign switching from the standard ransom demands for Bitcoin (BTC) to alternative coins in an attempt to bypass email protections.  ;Account Hijacking;Not Found;Not Found;>1;https://www.zdnet.com/article/new-sextortion-campaign-taps-altcoins-to-avoid-detection/;Paolo Passeri					;2019-11-07T14:18:06+00:00;20,249
51;09/10/2019;?;TransUnion;The personal information of about 37,000 Canadians is compromised after the fraudulent use of one if TransUnion's legitimate business customer’s login credentials. The breach occurred between June and July.;Account Hijacking;Not Found;Not Found;CA;https://www.theadvocate.com/baton_rouge/news/communities/ascension/article_b6194b7a-eba2-11e9-a388-5b6eedc7c596.html;Paolo Passeri					;2019-11-07T14:18:06+00:00;20,249
52;09/10/2019;?;Immutable;Immutable is hit by a cyber attack after it offered to support a professional gamer banned from his sport for endorsing Hong Kong democracy protests.;DDoS;Not Found;Not Found;AU;https://www.theadvocate.com/baton_rouge/news/communities/ascension/article_b6194b7a-eba2-11e9-a388-5b6eedc7c596.html;Paolo Passeri					;2019-11-07T14:18:06+00:00;20,249
53;09/10/2019;?;Methodist Hospitals;Methodist Hospitals from Gary, Indiana, discloses that sensitive personal and medical information for 68,039 individuals may have been exposed following a successful phishing attack against two of its employees occurred in June 2019.;Account Hijacking;Not Found;Not Found;US;https://www.theadvocate.com/baton_rouge/news/communities/ascension/article_b6194b7a-eba2-11e9-a388-5b6eedc7c596.html;Paolo Passeri					;2019-11-07T14:18:06+00:00;20,249
54;09/10/2019;?;Single Individuals;A new phishing campaign pretends to be an Amazon AWS suspension notice for unpaid bills.;Account Hijacking;Not Found;Not Found;>1;https://www.theadvocate.com/baton_rouge/news/communities/ascension/article_b6194b7a-eba2-11e9-a388-5b6eedc7c596.html;Paolo Passeri					;2019-11-07T14:18:06+00:00;20,249
55;09/10/2019;?;Blue Earth Area High School;Blue Earth Area High School replaces its gymnasium floor in the wake of a Sept. 19 cyberattack at the school that hit the computer that controls the humidity level in the building.;Unknown;Not Found;Not Found;US;https://www.theadvocate.com/baton_rouge/news/communities/ascension/article_b6194b7a-eba2-11e9-a388-5b6eedc7c596.html;Paolo Passeri					;2019-11-07T14:18:06+00:00;20,249
56;10/10/2019;Attor;Diplomatic missions, governmental institutions in Eastern Europe, and Russian-speaking privacy-concerned users;Researchers from ESET discover a new espionage campaign using a GSM plugin with the AT command protocol, and Tor for its network communications. For this reason the campaign is dubbed Attor.;Targeted Attack;Not Found;Not Found;"RU
UA
SK
LI
TR";https://www.theadvocate.com/baton_rouge/news/communities/ascension/article_b6194b7a-eba2-11e9-a388-5b6eedc7c596.html;Paolo Passeri					;2019-11-07T14:18:06+00:00;20,249
57;10/10/2019;FIN7;NCR Corporation;Researchers from FireEye discover new tools from the FIN7 group: a loader, dubbed BOOSTWRITE, that delivers payloads into memory and a module, dubbed RDFSNIFFER, that hooks into the remote administration software of ATM maker NCR Corporation.;Malware;Not Found;Not Found;US;https://www.theadvocate.com/baton_rouge/news/communities/ascension/article_b6194b7a-eba2-11e9-a388-5b6eedc7c596.html;Paolo Passeri					;2019-11-07T14:18:06+00:00;20,249
58;10/10/2019;?;Two prominent Moroccan Human Rights Defenders;Amnesty International uncovers targeted attacks against two prominent Moroccan Human Rights Defenders using NSO Group’s Pegasus spyware. Targeted attacks have been ongoing since at least 2017.;Targeted Attack;Not Found;Not Found;MA;https://www.theadvocate.com/baton_rouge/news/communities/ascension/article_b6194b7a-eba2-11e9-a388-5b6eedc7c596.html;Paolo Passeri					;2019-11-07T14:18:06+00:00;20,249
59;10/10/2019;?;Multiple targets;Researchers from Morphisec reveal that the operators of the BitPaymer ransomware have been spotted using a zero-day in iTunes for Windows as a mechanism to bypass antivirus detection.;Malware;Not Found;Not Found;>1;https://www.theadvocate.com/baton_rouge/news/communities/ascension/article_b6194b7a-eba2-11e9-a388-5b6eedc7c596.html;Paolo Passeri					;2019-11-07T14:18:06+00:00;20,249
60;10/10/2019;?;Magnolia Pediatrics;Magnolia Pediatrics is hit by ransomware. The infection occurred on August 2019.;Malware;Not Found;Not Found;US;https://www.theadvocate.com/baton_rouge/news/communities/ascension/article_b6194b7a-eba2-11e9-a388-5b6eedc7c596.html;Paolo Passeri					;2019-11-07T14:18:06+00:00;20,249
61;10/10/2019;InstaKilla;EscortForumIt[.]xxx and Hookers[.]nl;A Bulgarian hacker known as InstaKilla breaches EscortForumIt[.]xxx and Hookers[.]nl two online escort forums and stole the user information that he is now offering for sale on a hacking forum.;vBulletin vulnerability;Not Found;Not Found;"IT
NL";https://www.databreaches.net/monterey-health-center-in-oregon-central-valley-regional-center-in-california-both-announce-patient-data-breaches/;Paolo Passeri					;2019-11-07T14:18:06+00:00;20,249
62;10/10/2019;?;City of Carrollton;The city of Carrollton, Texas, is the victim of a cyber attack that makes some services unavailable.;Unknown;Not Found;Not Found;US;https://www.databreaches.net/monterey-health-center-in-oregon-central-valley-regional-center-in-california-both-announce-patient-data-breaches/;Paolo Passeri					;2019-11-07T14:18:06+00:00;20,249
63;10/10/2019;?;Fairfield County High School;Attackers target students at a Fairfield County High School in a phishing scheme.;Account Hijacking;Not Found;Not Found;US;https://www.databreaches.net/monterey-health-center-in-oregon-central-valley-regional-center-in-california-both-announce-patient-data-breaches/;Paolo Passeri					;2019-11-07T14:18:06+00:00;20,249
64;10/10/2019;?;Boston University;Over 1,000 Boston University students are forced to change their account passwords after the servers are flooded with spam emails from student accounts. The spam is believed to be a result of a 2018 breach of the educational site Chegg.;Malicious Spam;Not Found;Not Found;US;https://www.databreaches.net/monterey-health-center-in-oregon-central-valley-regional-center-in-california-both-announce-patient-data-breaches/;Paolo Passeri					;2019-11-07T14:18:06+00:00;20,249
65;11/10/2019;?;Mission Health;Mission Health reveals that to have discovered, on September 13, that malicious code has been implanted into its online store websites.;Malicious Script Injection;Not Found;Not Found;US;https://www.databreaches.net/monterey-health-center-in-oregon-central-valley-regional-center-in-california-both-announce-patient-data-breaches/;Paolo Passeri					;2019-11-07T14:18:06+00:00;20,249
66;11/10/2019;?;Single Individuals;Security researcher MalwareHunterTeam discovers an elaborate scheme to distribute a cryptocurrency trading program that installs a backdoor on a victim's Mac or Windows PC.;Malware;Not Found;Not Found;>1;https://www.databreaches.net/monterey-health-center-in-oregon-central-valley-regional-center-in-california-both-announce-patient-data-breaches/;Paolo Passeri					;2019-11-07T14:18:06+00:00;20,249
67;11/10/2019;?;Single Individuals;A new variant of the Nemty ransomware (1.6) is distributed via the RIG exploit kit.;Malware;Not Found;Not Found;>1;https://www.databreaches.net/monterey-health-center-in-oregon-central-valley-regional-center-in-california-both-announce-patient-data-breaches/;Paolo Passeri					;2019-11-07T14:18:06+00:00;20,249
68;11/10/2019;?;Click2Mail;Click2Mail sends out a notice to 200,000 customers to warn them of a hack discovered on October, 4th.;Unknown;Not Found;Not Found;US;https://www.databreaches.net/monterey-health-center-in-oregon-central-valley-regional-center-in-california-both-announce-patient-data-breaches/;Paolo Passeri					;2019-11-07T14:18:06+00:00;20,249
69;11/10/2019;?;Hunt Memorial Hospital District;The Hunt Memorial Hospital District releases an update regarding a cyber attack occurred in May 2018.;Targeted Attack;Not Found;Not Found;US;https://www.databreaches.net/monterey-health-center-in-oregon-central-valley-regional-center-in-california-both-announce-patient-data-breaches/;Paolo Passeri					;2019-11-07T14:18:06+00:00;20,249
70;11/10/2019;?;Monterey Health Center ;Monterey Health Center notifies a ransomware attack occurred on August 2019.;Malware;Not Found;Not Found;US;https://www.databreaches.net/monterey-health-center-in-oregon-central-valley-regional-center-in-california-both-announce-patient-data-breaches/;Paolo Passeri					;2019-11-07T14:18:06+00:00;20,249
71;11/10/2019;?;Central Valley Regional Center;Central Valley Regional Center in California notifies patients of a breach occurred when an employee’s email account was accessed by an unauthorized third party between July 25–August 2, 2019.;Account Hijacking;Not Found;Not Found;US;https://www.italiasera.it/eurobet-it-inaccessibile-i-nostri-sistemi-non-sono-al-momento-disponibili-si-teme-attacco-hacker/;Paolo Passeri					;2019-11-07T14:18:06+00:00;20,249
72;11/10/2019;?;South Knox School Corporation;South Knox School Corporation is hit by a ransomware.;Malware;Not Found;Not Found;US;https://www.italiasera.it/eurobet-it-inaccessibile-i-nostri-sistemi-non-sono-al-momento-disponibili-si-teme-attacco-hacker/;Paolo Passeri					;2019-11-07T14:18:06+00:00;20,249
73;12/10/2019;?;M6 Group (Groupe M6);The M6 Group (Groupe M6), France's largest privately-owned multimedia group, is the victim of ransomware, but none of the company's TV and radio channels suffered any downtime.;Malware;Not Found;Not Found;FR;https://www.italiasera.it/eurobet-it-inaccessibile-i-nostri-sistemi-non-sono-al-momento-disponibili-si-teme-attacco-hacker/;Paolo Passeri					;2019-11-07T14:18:06+00:00;20,249
74;12/10/2019;Attackers from North Korea;Mac owners working at cryptocurrency exchanges;Researchers from Objective-See discover a campaign carried out by North Korean hackers to attack Mac owners who work at cryptocurrency exchanges via a fake cryptocurrency trading app that actually infects users with malware.;Malware;Not Found;Not Found;>1;https://www.italiasera.it/eurobet-it-inaccessibile-i-nostri-sistemi-non-sono-al-momento-disponibili-si-teme-attacco-hacker/;Paolo Passeri					;2019-11-07T14:18:06+00:00;20,249
75;13/10/2019;?;Pilz;Pilz, one of the world's largest producers of automation tools, is hit by a ransomware attack.;Malware;Not Found;Not Found;DE;https://www.italiasera.it/eurobet-it-inaccessibile-i-nostri-sistemi-non-sono-al-momento-disponibili-si-teme-attacco-hacker/;Paolo Passeri					;2019-11-07T14:18:06+00:00;20,249
76;14/10/2019;Turbine Panda (China Ministry of State Security);Multiple targets in the aviation sector;A report from Crowdstrike claims that China systematically targeted companies in the aviation space to acquire intellectual property to narrow its gap in the aviation industry, and help Comac to build its own C919 airplane.;Targeted Attack;Not Found;Not Found;>1;https://www.italiasera.it/eurobet-it-inaccessibile-i-nostri-sistemi-non-sono-al-momento-disponibili-si-teme-attacco-hacker/;Paolo Passeri					;2019-11-07T14:18:06+00:00;20,249
77;14/10/2019;?;Pitney Bowes;Pitney Bowes is hit by a ransomware attack, according to a statement released from the mailing services company.;Malware;Not Found;Not Found;US;https://www.italiasera.it/eurobet-it-inaccessibile-i-nostri-sistemi-non-sono-al-momento-disponibili-si-teme-attacco-hacker/;Paolo Passeri					;2019-11-07T14:18:06+00:00;20,249
78;14/10/2019;Winnti;High-profile Asian mobile hardware and software manufacturer;Researchers from ESET reveal that the Winnti Group hackers have used a new modular Windows backdoor, called PortReuse, to target a high-profile Asian mobile hardware and software manufacturer.;Targeted Attack;Not Found;Not Found;N/A;https://www.italiasera.it/eurobet-it-inaccessibile-i-nostri-sistemi-non-sono-al-momento-disponibili-si-teme-attacco-hacker/;Paolo Passeri					;2019-11-07T14:18:06+00:00;20,249
79;14/10/2019;Pakistan;India;According to Logically AI, Pakistan starts a misinformation campaign against India, dubbed #GobackModi, via Twitter.;Social Networks Bot;Not Found;Not Found;IN;https://www.italiasera.it/eurobet-it-inaccessibile-i-nostri-sistemi-non-sono-al-momento-disponibili-si-teme-attacco-hacker/;Paolo Passeri					;2019-11-07T14:18:06+00:00;20,249
80;14/10/2019;?;Eurobet;Eurobet, the online gambling portal, is taken down by a DDoS attack.;DDoS;Not Found;Not Found;IT;https://www.italiasera.it/eurobet-it-inaccessibile-i-nostri-sistemi-non-sono-al-momento-disponibili-si-teme-attacco-hacker/;Paolo Passeri					;2019-11-07T14:18:06+00:00;20,249
81;14/10/2019;?;Jack Monroe;Jack Monroe says she has lost about £5,000 after her phone number was hijacked and re-activated on another Sim card.;Account Hijacking;Not Found;Not Found;UK;https://www.databreaches.net/sc-ransomware-attack-may-be-affecting-911-emergency-dispatch-in-jasper-co/;Paolo Passeri					;2019-11-07T14:18:06+00:00;20,249
82;15/10/2019;?;TrialWorks;TrialWorks is reportedly hit by a ransomware attack, shutting down its platform for at least four days and locking some lawyers out of their case files.;Malware;Not Found;Not Found;US;https://www.databreaches.net/sc-ransomware-attack-may-be-affecting-911-emergency-dispatch-in-jasper-co/;Paolo Passeri					;2019-11-07T14:18:06+00:00;20,249
83;15/10/2019;?;iOS Users;Researchers from Cisco Talos discover a scam group using the recently developed iOS jailbreak dubbed checkra1n, in a campaign designed to help the crooks earn money via click-fraud.;Malware;Not Found;Not Found;>1;https://www.databreaches.net/sc-ransomware-attack-may-be-affecting-911-emergency-dispatch-in-jasper-co/;Paolo Passeri					;2019-11-07T14:18:06+00:00;20,249
84;15/10/2019;Rocke;Multiple targets;Researchers from Anomali reveal the details of a new campaign from the Chinese Crypto-mining group dubbed Rocke, switching its C2 infrastructure from Pastebin to a self-hosted solution.;Malware;Not Found;Not Found;>1;https://www.databreaches.net/sc-ransomware-attack-may-be-affecting-911-emergency-dispatch-in-jasper-co/;Paolo Passeri					;2019-11-07T14:18:06+00:00;20,249
85;15/10/2019;?;Ingredion Incorporated;Ingredion Incorporated reveals that it recently detected suspicious activity on some data center servers due to malware.;Malware;Not Found;Not Found;US;https://www.databreaches.net/sc-ransomware-attack-may-be-affecting-911-emergency-dispatch-in-jasper-co/;Paolo Passeri					;2019-11-07T14:18:06+00:00;20,249
86;15/10/2019;?;BriansClub;“BriansClub” one of the largest underground stores for buying stolen credit card data, is itself hacked. The data stolen from BriansClub encompasses more than 26 million credit and debit card records.;Unknown;Not Found;Not Found;N/A;https://www.databreaches.net/sc-ransomware-attack-may-be-affecting-911-emergency-dispatch-in-jasper-co/;Paolo Passeri					;2019-11-07T14:18:06+00:00;20,249
87;15/10/2019;?;Jasper County;Jasper County suffers a ransomware attack on their countywide systems, including email and emergency response systems.;Malware;Not Found;Not Found;US;https://www.databreaches.net/sc-ransomware-attack-may-be-affecting-911-emergency-dispatch-in-jasper-co/;Paolo Passeri					;2019-11-07T14:18:06+00:00;20,249
1;01/08/2019;?;Three US companies in the utilities industry;Researchers from Proofpoint discover a new campaign, possibly developed by a nation, targeting three US utilities via a malware called LookBack, The emails purporting came from the National Council of Examiners for Engineering and Surveying (NCEES).;Targeted Attack;Not Found;Not Found;US;https://www.bleepingcomputer.com/news/security/new-lord-exploit-kit-pushes-njrat-and-eris-ransomware/;Paolo Passeri					;2019-09-19T08:55:09+01:00;18,562
2;01/08/2019;Hexane Group;Companies in the Middle East (especially in Kuwait);Researchers from Dragos discover a threat group dubbed Hexane focused on organizations in the oil and gas industry and targeting telco companies to hit its final targets.;Targeted Attack;Not Found;Not Found;>1;https://www.bleepingcomputer.com/news/security/new-lord-exploit-kit-pushes-njrat-and-eris-ransomware/;Paolo Passeri					;2019-09-19T08:55:09+01:00;18,562
3;01/08/2019;?;Individuals in South Korea;One million card details are put up for sale online in South Korea.;Unknown;Not Found;Not Found;KR;https://www.bleepingcomputer.com/news/security/new-lord-exploit-kit-pushes-njrat-and-eris-ransomware/;Paolo Passeri					;2019-09-19T08:55:09+01:00;18,562
4;01/08/2019;"UAE
Egypt";Countries, primarily in the Middle East and in North and East Africa, including Libya, Sudan, Comoros, Qatar, Turkey, Lebanon, Syria, Jordan and Morocco;Facebook removes 259 Facebook accounts, 102 Pages, 5 Groups, 4 Events and 17 Instagram accounts for engaging in coordinated inauthentic behavior that originated in the UAE and Egypt and focused on a number of countries in Middle East and Africa.;Fake Social Network Groups/Pages;Not Found;Not Found;>1;https://www.bleepingcomputer.com/news/security/new-lord-exploit-kit-pushes-njrat-and-eris-ransomware/;Paolo Passeri					;2019-09-19T08:55:09+01:00;18,562
5;01/08/2019;Saudi Arabia;Countries in Middle East and Northern Africa, including Qatar, Saudi Arabia, UAE, Bahrain, Egypt, Morocco, Palestine, Lebanon and Jordan;Facebook removes 217 Facebook accounts, 144 Pages, 5 Groups and 31 Instagram accounts involved in coordinated inauthentic behavior originating from Saudi Arabia that focused primarily on the Middle East and Northern Africa.;Fake Social Network Groups/Pages;Not Found;Not Found;>1;https://www.bleepingcomputer.com/news/security/new-lord-exploit-kit-pushes-njrat-and-eris-ransomware/;Paolo Passeri					;2019-09-19T08:55:09+01:00;18,562
6;01/08/2019;?;StockX;StockX, a popular site for buying and selling sneakers and other apparel, resets customer passwords after it is hacked back in May. More than 6.8 million records were stolen.;Unknown;Not Found;Not Found;US;https://www.bleepingcomputer.com/news/security/new-lord-exploit-kit-pushes-njrat-and-eris-ransomware/;Paolo Passeri					;2019-09-19T08:55:09+01:00;18,562
7;01/08/2019;?;Poshmark;Poshmark, an online marketplace where North American users can buy and sell new or used clothes, shoes, and accessories, discloses a data breach: an unauthorized party gained access to its servers from where it stole personal information.;Unknown;Not Found;Not Found;US;https://www.bleepingcomputer.com/news/security/new-lord-exploit-kit-pushes-njrat-and-eris-ransomware/;Paolo Passeri					;2019-09-19T08:55:09+01:00;18,562
8;01/08/2019;?;Single Individuals;Researchers from enSilo reveal the details of DealPly, an adware able to abuse the Microsoft and McAfee reputation services to avoid detection.;Malware;Not Found;Not Found;>1;https://www.bleepingcomputer.com/news/security/new-lord-exploit-kit-pushes-njrat-and-eris-ransomware/;Paolo Passeri					;2019-09-19T08:55:09+01:00;18,562
