id;date;author;target;description;attack;target_class;attack_class;country;link;author_report;date_report;views
79;30/08/2019;?;Multiple Targets;Researchers at Alert Logic discover a new credential-theft campaign using the DNS to exfiltrate data.;Malware;Not Found;Not Found;N/A;https://www.darkreading.com/attacks-breaches/new-credential-theft-attack-weaponizes-dns/d/d-id/1335702;Paolo Passeri;2019-10-03T14:56:20+01:00;18,356
80;30/08/2019;?;University of Ghana accommodation registration portal;The University of Ghana accommodation registration portal is hacked, redirecting students to a wrong site to register.;Unknown;Not Found;Not Found;GH;https://www.databreaches.net/university-of-ghana-accommodation-registration-portal-hacked-authorities/;Paolo Passeri;2019-10-03T14:56:20+01:00;18,356
81;30/08/2019;?;Oregon Judicial Department;A phishing scheme succeeds in breaking into the email accounts of five Oregon Judicial Department employees, exposing personal information of more than 6,000 people.;Account Hijacking;Not Found;Not Found;US;https://www.databreaches.net/phishing-scheme-gains-entry-to-oregon-judicial-department-emails/;Paolo Passeri;2019-10-03T14:56:20+01:00;18,356
82;30/08/2019;?;Russell Stover Chocolates;Russell Stover Chocolates reveals that a malware infection to its POS systems compromised customer's data between February 9, 2019 and August 7, 2019.;PoS Malware;Not Found;Not Found;US;https://www.databreaches.net/how-sweet-it-isnt-chocolatier-announces-breach/;Paolo Passeri;2019-10-03T14:56:20+01:00;18,356
1;01/08/2019;?;Three US companies in the utilities industry;Researchers from Proofpoint discover a new campaign, possibly developed by a nation, targeting three US utilities via a malware called LookBack, The emails purporting came from the National Council of Examiners for Engineering and Surveying (NCEES).;Targeted Attack;Not Found;Not Found;US;https://arstechnica.com/information-technology/2019/08/new-advanced-malware-possibly-nation-sponsored-is-targeting-us-utilities/;Paolo Passeri;2019-09-19T08:55:09+01:00;18,015
2;01/08/2019;Hexane Group;Companies in the Middle East (especially in Kuwait);Researchers from Dragos discover a threat group dubbed Hexane focused on organizations in the oil and gas industry and targeting telco companies to hit its final targets.;Targeted Attack;Not Found;Not Found;>1;https://www.bleepingcomputer.com/news/security/new-hexane-group-targets-oil-and-gas-telco-providers/;Paolo Passeri;2019-09-19T08:55:09+01:00;18,015
3;01/08/2019;?;Individuals in South Korea;One million card details are put up for sale online in South Korea.;Unknown;Not Found;Not Found;KR;https://www.zdnet.com/article/breach-alert-in-south-korea-after-1m-card-details-were-put-up-for-sale-online/;Paolo Passeri;2019-09-19T08:55:09+01:00;18,015
4;01/08/2019;"UAE
Egypt";Countries, primarily in the Middle East and in North and East Africa, including Libya, Sudan, Comoros, Qatar, Turkey, Lebanon, Syria, Jordan and Morocco;Facebook removes 259 Facebook accounts, 102 Pages, 5 Groups, 4 Events and 17 Instagram accounts for engaging in coordinated inauthentic behavior that originated in the UAE and Egypt and focused on a number of countries in Middle East and Africa.;Fake Social Network Groups/Pages;Not Found;Not Found;>1;https://newsroom.fb.com/news/2019/08/cib-uae-egypt-saudi-arabia/;Paolo Passeri;2019-09-19T08:55:09+01:00;18,015
5;01/08/2019;Saudi Arabia;Countries in Middle East and Northern Africa, including Qatar, Saudi Arabia, UAE, Bahrain, Egypt, Morocco, Palestine, Lebanon and Jordan;Facebook removes 217 Facebook accounts, 144 Pages, 5 Groups and 31 Instagram accounts involved in coordinated inauthentic behavior originating from Saudi Arabia that focused primarily on the Middle East and Northern Africa.;Fake Social Network Groups/Pages;Not Found;Not Found;>1;https://newsroom.fb.com/news/2019/08/cib-uae-egypt-saudi-arabia/;Paolo Passeri;2019-09-19T08:55:09+01:00;18,015
6;01/08/2019;?;StockX;StockX, a popular site for buying and selling sneakers and other apparel, resets customer passwords after it is hacked back in May. More than 6.8 million records were stolen.;Unknown;Not Found;Not Found;US;https://techcrunch.com/2019/08/03/stockx-hacked-millions-records/;Paolo Passeri;2019-09-19T08:55:09+01:00;18,015
7;01/08/2019;?;Poshmark;Poshmark, an online marketplace where North American users can buy and sell new or used clothes, shoes, and accessories, discloses a data breach: an unauthorized party gained access to its servers from where it stole personal information.;Unknown;Not Found;Not Found;US;https://www.zdnet.com/article/poshmark-clothing-marketplace-says-hacker-stole-customer-details/;Paolo Passeri;2019-09-19T08:55:09+01:00;18,015
8;01/08/2019;?;Single Individuals;Researchers from enSilo reveal the details of DealPly, an adware able to abuse the Microsoft and McAfee reputation services to avoid detection.;Malware;Not Found;Not Found;>1;https://www.zdnet.com/article/dealply-adware-abuses-microsoft-mcafee-services-to-evade-detection/;Paolo Passeri;2019-09-19T08:55:09+01:00;18,015
9;01/08/2019;?;Single Individuals;Researchers from Proofpoint reveal the details of SystemBC, a malware able to install a proxy on infected computers.;Malware;Not Found;Not Found;>1;https://www.zdnet.com/article/new-windows-malware-sets-up-proxies-on-your-pc-to-relay-malicious-traffic/;Paolo Passeri;2019-09-19T08:55:09+01:00;18,015
10;01/08/2019;?;Single Individuals;A new Exploit Kit dubbed Lord emerges, able to push the njRAT and ERIS Ransomware.;Malware;Not Found;Not Found;>1;https://www.bleepingcomputer.com/news/security/new-lord-exploit-kit-pushes-njrat-and-eris-ransomware/;Paolo Passeri;2019-09-19T08:55:09+01:00;18,015
11;01/08/2019;?; Librería Porrúa;A bookseller in Mexico named Librería Porrúa leaves a MongoDB exposed on the Internet and has the 2.1 customer records stolen and replaced by a ransom note.;Misconfigurations;Not Found;Not Found;MX;https://www.bleepingcomputer.com/news/security/ransom-note-replaces-21m-customer-records-on-open-mongodb/;Paolo Passeri;2019-09-19T08:55:09+01:00;18,015
12;01/08/2019;?;Banking users in Brazil and Mexico;Researchers from ESET reveal the details of Amavaldo, a banking trojan targeting users in Brazil and Mexico.;Malware;Not Found;Not Found;"BR
MX";https://www.scmagazine.com/home/security-news/cybercrime/fiendish-amavaldo-banking-trojan-strikes-in-mexico-after-targeting-brazilians/;Paolo Passeri;2019-09-19T08:55:09+01:00;18,015
13;01/08/2019;?;Morris Jeff Community School;Morris Jeff Community School is hit by an unspecified security breach.;Unknown;Not Found;Not Found;US;https://www.databreaches.net/morris-jeff-school-becomes-latest-louisiana-school-to-suffer-cybersecurity-breach/;Paolo Passeri;2019-09-19T08:55:09+01:00;18,015
14;01/08/2019;?;Broken Arrow Public Schools;Broken Arrow Public Schools are hit by a ransomware attack.;Malware;Not Found;Not Found;US;https://www.databreaches.net/broken-arrow-schools-victim-of-ransomware-attack/;Paolo Passeri;2019-09-19T08:55:09+01:00;18,015
15;02/08/2019;?;City of Naples, Florida;The City of Naples, Florida, loses $700,000 after a spear phishing attack.;Account Hijacking;Not Found;Not Found;US;https://securityaffairs.co/wordpress/89703/cyber-crime/naples-city-cyberattack.html;Paolo Passeri;2019-09-19T08:55:09+01:00;18,015
16;02/08/2019;Lotsy;Italian and Spanish-speaking users;Group-IB discover some fraudulent campaigns carried out by Lotsy group involving the use of dozens of well-known brands aimed at Italian and Spanish-speaking customers. ;Fraudulent Websites;Not Found;Not Found;"IT
ES";https://securityaffairs.co/wordpress/89287/cyber-crime/lotsy-group-scam-campaigns.html;Paolo Passeri;2019-09-19T08:55:09+01:00;18,015
17;02/08/2019;@j3ws3r;US Mobile Phone Users;Twitter user @j3ws3r, attempts to send text messages to every mobile phone in the United States using a vulnerability in the SMS gateways.;SMS Gateway Vulnerability;Not Found;Not Found;US;https://www.wired.co.uk/article/sms-hack-text-twitter-j3ws3r;Paolo Passeri;2019-09-19T08:55:09+01:00;18,015
18;02/08/2019;?;Fiberhome routers;Researchers from 360 Netlab discover a new botnet targeting Fiberhome routers.;Malware;Not Found;Not Found;>1;https://threatpost.com/gwmndy-botnet-proxy-connections/146963/;Paolo Passeri;2019-09-19T08:55:09+01:00;18,015
19;02/08/2019;?;SuperINN;SuperINN notifies its clients of a hack impacting more than 43,000 consumers.;SQLi;Not Found;Not Found;US;https://www.databreaches.net/superinn-plus-notifying-clients-of-hack-more-than-43000-consumers-impacted/;Paolo Passeri;2019-09-19T08:55:09+01:00;18,015
20;02/08/2019;?;Presbyterian Healthcare Services;Presbyterian Healthcare Services is the victim of a phishing attack impacting around 183,000 patients and health plan members.;Account Hijacking;Not Found;Not Found;US;https://www.databreaches.net/presbyterian-data-breach-affects-some-183000-patients/;Paolo Passeri;2019-09-19T08:55:09+01:00;18,015
1;13/07/2019;Ov1ru$;SyTech;A hacking group under the name 0v1ru$ breaches SyTech, a major FSB contractor, defaces the web site, manages to steal 7.5 terabytes of data, exposing secret FSB project to de-anonymize Tor browsing.;Unknown;Not Found;Not Found;RU;https://www.forbes.com/sites/zakdoffman/2019/07/20/russian-intelligence-has-been-hacked-with-social-media-and-tor-projects-exposed/#42a16ef6b115;Paolo Passeri;2019-09-10T11:20:53+01:00;19,462
2;15/07/2019;?;Foodpanda Singapore;The Foodpanda Singapore Instagram account is hacked.;Account Hijacking;Not Found;Not Found;SG;https://www.ibtimes.sg/foodpanda-singapore-instagram-account-hacked-woman-receives-abusive-messages-31748;Paolo Passeri;2019-09-10T11:20:53+01:00;19,462
3;15/07/2019;?;Telegram Users;Researchers from Symantec discover an unofficial Telegram app, named MobonoGram 2019 (Android.Fakeyouwon) secretly loading malicious sites.;Malware;Not Found;Not Found;>1;https://www.scmagazine.com/home/security-news/cybercrime/an-unofficial-telegram-app-is-secretly-loading-malicious-sites-onto-the-devices-of-unsuspecting-users-and-running-other-malicious-services-in-the-background/;Paolo Passeri;2019-09-10T11:20:53+01:00;19,462
4;16/07/2019;State-sponsored actors;Joshua Wong;Google warns Hong Kong activist Joshua Wong about government-backed hacking attempts.;Account Hijacking;Not Found;Not Found;HK;https://www.databreaches.net/google-warns-hong-kongs-joshua-wong-of-government-backed-hackers/;Paolo Passeri;2019-09-10T11:20:53+01:00;19,462
5;16/07/2019;?;Sprint;"US mobile network operator Sprint says hackers broke into an unknown number of customer accounts via the Samsung.com ""add a line"" website. The breach occurred on June 22.";Account Hijacking;Not Found;Not Found;US;https://www.zdnet.com/article/sprint-says-hackers-breached-customer-accounts-via-samsung-website/;Paolo Passeri;2019-09-10T11:20:53+01:00;19,462
6;16/07/2019;?;iNSYNQ;iNSYNQ, a cloud computing provider of virtual desktop environments is down after its servers are infected with ransomware.;Malware;Not Found;Not Found;US;https://www.zdnet.com/article/cloud-based-virtual-desktop-provider-hit-by-ransomware/;Paolo Passeri;2019-09-10T11:20:53+01:00;19,462
7;16/07/2019;?;American Express users;Researchers from Cofense discover a new evasive phishing campaign targeting corporate and consumer cardholders from American Express.;Account Hijacking;Not Found;Not Found;>1;https://www.bleepingcomputer.com/news/security/american-express-customers-targeted-by-novel-phishing-attack/;Paolo Passeri;2019-09-10T11:20:53+01:00;19,462
8;16/07/2019;?;Ricardo Rosselló;Puerto Rican governor Ricardo Rosselló’s private chat group messages are leaked on Telegram.;Unknown;Not Found;Not Found;PR;https://www.scmagazine.com/home/security-news/rickygate-puerto-rican-governors-private-chat-group-messages-leaked-on-telegram/;Paolo Passeri;2019-09-10T11:20:53+01:00;19,462
9;16/07/2019;?;University of Alabama;The University of Alabama discovers a 2009 computer security incident involving a server for Brewer-Porch Children’s Center. The server was accessed by outside hackers who got hold of 1,400 former clients, employees and medical providers.;Unknown;Not Found;Not Found;US;https://www.databreaches.net/university-of-alabama-warns-of-computer-breach-at-brewer-porch-center/;Paolo Passeri;2019-09-10T11:20:53+01:00;19,462
10;17/07/2019;Holmium and Mercury (Iran), Thallium (North Korea), Yttrium and Strontium (Russia);Multiple Targets;Microsoft said that over the past year it notified nearly 10,000 users that they'd been targeted or compromised by nation-state hacking groups.;Account Hijacking;Not Found;Not Found;>1;https://www.zdnet.com/article/microsoft-notified-10000-victims-of-nation-state-attacks/;Paolo Passeri;2019-09-10T11:20:53+01:00;19,462
11;17/07/2019;?;62 universities;Hackers target the systems of 62 colleges and universities by exploiting a vulnerability in third-party software used by the universities.;Third-Party software vulnerability;Not Found;Not Found;US;https://www.zdnet.com/article/hackers-target-62-us-colleges-by-exploiting-erp-vulnerability/;Paolo Passeri;2019-09-10T11:20:53+01:00;19,462
12;17/07/2019;?;Slack;Slack resets the passwords for 1% of its users after receiving a batch of users credentials related to the 2015 hack.;Account Hijacking;Not Found;Not Found;US;https://www.zdnet.com/article/slack-resets-passwords-for-1-of-its-users-because-of-2015-hack/;Paolo Passeri;2019-09-10T11:20:53+01:00;19,462
13;17/07/2019;?;Bank and financial targets in the UK;Researchers at Mimecast discover a new campaign using come with server-parsed HTML (SHTML) file attachments.;Account Hijacking;Not Found;Not Found;UK;https://www.zdnet.com/article/this-strange-new-phishing-attack-uses-a-surprise-bill-to-trick-you-into-clicking/;Paolo Passeri;2019-09-10T11:20:53+01:00;19,462
14;17/07/2019;?;Users in Russia, Ukraine, and Kazakhstan;Researchers from Flashpoint reveal a new malware framework responsible for over one 1B fraudulent Google AdSense impressions in the past three months alone, and also able to generate fake likes on YouTube videos and watch hidden Twitch sessions.;Malware;Not Found;Not Found;>1;https://www.zdnet.com/article/malware-framework-creates-one-billion-fake-google-adsense-ad-impressions-in-only-a-few-months/;Paolo Passeri;2019-09-10T11:20:53+01:00;19,462
15;17/07/2019;ruri12;Python Users;Researchers from ReversingLabs discover three malicious Python libraries uploaded on the official Python Package Index (PyPI) that contained a hidden backdoor (libpeshnx, libpesh, and libari).;Malware;Not Found;Not Found;>1;https://www.zdnet.com/article/malicious-python-libraries-targeting-linux-servers-removed-from-pypi/;Paolo Passeri;2019-09-10T11:20:53+01:00;19,462
16;17/07/2019;StrongPity;Multiple Targets;Researchers from AT&T Alien Labs discover a new ongoing campaign carried out by the StrongPity malicious actor, using infected versions of WinRAR, Winbox, and Internet Download Manager.;Targeted Attack;Not Found;Not Found;>1;https://www.bleepingcomputer.com/news/security/trojan-riddled-winrar-winbox-idm-spreads-strongpity-spyware/;Paolo Passeri;2019-09-10T11:20:53+01:00;19,462
17;17/07/2019;Gamaredon Group;Linux desktop users;Researchers from Intezer discover EvilGnome, a new Linux malware masquerading as a Gnome shell extension and designed to spy on Linux desktop users.;Targeted Attack;Not Found;Not Found;>1;https://www.bleepingcomputer.com/news/security/new-evilgnome-backdoor-spies-on-linux-users-steals-their-files/;Paolo Passeri;2019-09-10T11:20:53+01:00;19,462
18;17/07/2019;?;Android Users;Researchers from Avast identify eight surveillance app in Google's Play Store, installed 140,000 times.;Malware;Not Found;Not Found;>1;https://www.bleepingcomputer.com/news/security/stalkerware-apps-on-google-play-installed-over-130-000-times/;Paolo Passeri;2019-09-10T11:20:53+01:00;19,462
19;17/07/2019;?;Asian Art Museum in San Francisco;The Asian Art Museum in San Francisco is hit by a ransomware attack. The attack occurred in May.;Malware;Not Found;Not Found;US;https://www.databreaches.net/hackers-demanded-ransom-in-may-attack-on-asian-art-museum-computers/;Paolo Passeri;2019-09-10T11:20:53+01:00;19,462
20;18/07/2019;APT34 AKA OilRig and Greenbug;Financial, energy, and government entities;Researchers from FireEye warn of a malicious phishing campaign, targeting LinkedIn users with bogus invitations to join a professional network and emailed attachments laced with malware.;Targeted Attack;Not Found;Not Found;>1;https://www.forbes.com/sites/zakdoffman/2019/07/22/critical-linkedin-warning-as-irans-hackers-send-fake-invites-laced-with-malware/#75e06f256ac1;Paolo Passeri;2019-09-10T11:20:53+01:00;19,462
21;18/07/2019;Ke3chang AKA APT15;Diplomatic bodies and government institutions in countries across Europe and Central and South America;Researchers at ESET discover a new campaign by the Ke3chang malicious actor, using an updated version of their Ketrican malware, alongside a new backdoor that has been dubbed Okrum.;Targeted Attack;Not Found;Not Found;>1;https://www.zdnet.com/article/this-data-stealing-malware-waits-for-you-to-click-the-mouse-button-three-times-before-going-into-action/;Paolo Passeri;2019-09-10T11:20:53+01:00;19,462
22;18/07/2019;?;Banking Users;A new campaign is discovered, using a fake Office 365 site to distribute the TrickBot password-stealing Trojan disguised as Chrome and Firefox browser updates.;Malware;Not Found;Not Found;>1;https://www.bleepingcomputer.com/news/security/fake-office-365-site-pushes-trickbot-trojan-as-browser-update/;Paolo Passeri;2019-09-10T11:20:53+01:00;19,462
23;18/07/2019;?;Henry County;Henry County is hit by a malware attack.;Malware;Not Found;Not Found;US;https://www.databreaches.net/ga-henry-county-networks-still-offline-five-days-after-malware-attack/;Paolo Passeri;2019-09-10T11:20:53+01:00;19,462
24;18/07/2019;?;Bahamas Ministry of Tourism;The Bahamas Ministry of Tourism is hit by a ransomware attack.;Malware;Not Found;Not Found;BS;https://www.databreaches.net/tourism-ministrys-servers-breached/;Paolo Passeri;2019-09-10T11:20:53+01:00;19,462
25;18/07/2019;?;Town of Collierville;The Town of Collierville’s computer systems are hit by a ransomware attack.;Malware;Not Found;Not Found;US;https://www.databreaches.net/tn-town-of-collierville-computer-systems-attacked-by-ransomware/;Paolo Passeri;2019-09-10T11:20:53+01:00;19,462
26;18/07/2019;?;Edgepark Medical Supplies;Edgepark Medical Supplies notifies 6,572 patients after a “password spray attack” occurred in May 2019.;Password Spray;Not Found;Not Found;US;https://www.databreaches.net/oh-edgepark-medical-supplies-notifying-6572-patients-after-a-password-spray-attack/;Paolo Passeri;2019-09-10T11:20:53+01:00;19,462
27;18/07/2019;?;Wise Health;Wise Health notifies almost 36,000 patients after a phishing attack compromised employees’ email accounts.;Account Hijacking;Not Found;Not Found;US;https://www.databreaches.net/wise-health-notifies-almost-36000-after-phishing-attack-compromised-employees-email-accounts/;Paolo Passeri;2019-09-10T11:20:53+01:00;19,462
28;19/07/2019;?;Metropolitan Police's Twitter account;The Metropolitan Police's Twitter account is hit by hackers who post a series of bizarre messages. The breach is due to the compromise of the MyNewsDesk platform.;Account Hijacking;Not Found;Not Found;UK;https://www.bbc.com/news/uk-england-london-49054332;Paolo Passeri;2019-09-10T11:20:53+01:00;19,462
29;19/07/2019;?;Discord;A group of hackers publish a list of email addresses and passwords they say they phished from users of gaming chat platform Discord. ;Account Hijacking;Not Found;Not Found;US;https://www.vice.com/en_us/article/evye3a/hackers-publish-list-of-discord-email-addresses-passwords-login-credentials;Paolo Passeri;2019-09-10T11:20:53+01:00;19,462
30;19/07/2019;Israeli Elite Force (IEF);Palestinian Ministry of Interior;The Israeli Elite Force claims to have hacked the Palestinian Ministry of Interior.;Unknown;Not Found;Not Found;PS;https://www.jerusalemonline.com/israeli-cyber-agency-hacks-palestinian-ministry-of-interior-database/;Paolo Passeri;2019-09-10T11:20:53+01:00;19,462
31;19/07/2019;?;Lancaster University;Records and ID documents of some Lancaster University students are accessed in the phishing attack and fraudulent invoices are sent to undergraduate applicants. A british citizen is arrested few days after.;Account Hijacking;Not Found;Not Found;UK;https://www.theguardian.com/technology/2019/jul/23/lancaster-university-students-data-stolen-cyber-attack;Paolo Passeri;2019-09-10T11:20:53+01:00;19,462
32;19/07/2019;?;Single Individuals;A new extortion scam pretends to be from a US State Police detective who is willing to delete child porn evidence if the victim sends $2,000 in bitcoins. ;Spam;Not Found;Not Found;>1;https://www.bleepingcomputer.com/news/security/new-us-state-police-extortion-scam-includes-contact-numbers/;Paolo Passeri;2019-09-10T11:20:53+01:00;19,462
33;19/07/2019;?;Midlands Technical College;Cyber criminals hit Midlands Technical College computers with a malware.;Malware;Not Found;Not Found;US;https://www.databreaches.net/sc-hackers-attack-midlands-tech/;Paolo Passeri;2019-09-10T11:20:53+01:00;19,462
34;19/07/2019;?;1111;Taiwan job bank 1111 confirms that the personal data of its online members was hacked and leaked to a foreign-based hacker forum.;Unknown;Not Found;Not Found;TW;https://www.databreaches.net/personal-data-of-users-on-1111-job-bank-leaked-on-overseas-forum/;Paolo Passeri;2019-09-10T11:20:53+01:00;19,462
35;20/07/2019;?;Florien High School;Florien High School is hit by a ransomware attack.;Malware;Not Found;Not Found;US;https://arstechnica.com/tech-policy/2019/07/louisiana-declares-state-emergency-in-response-to-ransomware-attack/;Paolo Passeri;2019-09-10T11:20:53+01:00;19,462
36;20/07/2019;?;Jessica Alba's Twitter Account;Jessica Alba's Twitter Account is hacked and starts to post racial tweets.;Account Hijacking;Not Found;Not Found;US;https://heavy.com/news/2019/07/jessica-alba-twitter-hacked/;Paolo Passeri;2019-09-10T11:20:53+01:00;19,462
37;21/07/2019;?;Butler County Federated Library System;The Butler County Federated Library System is hit by a ransomware attack.;Malware;Not Found;Not Found;US;https://www.databreaches.net/pa-ransomware-attack-hits-local-libraries/;Paolo Passeri;2019-09-10T11:20:53+01:00;19,462
38;22/07/2019;?;Vulnerable Jira and Exim Servers;Researchers from Intezer discover a new variant of the Watchbog Linux Trojan infecting vulnerable Jira (CVE-2019-11581) and Exim CVE-2019-10149) servers to install cryptominers.;Malware;Not Found;Not Found;>1;https://www.bleepingcomputer.com/news/security/hackers-exploit-jira-exim-linux-servers-to-keep-the-internet-safe/;Paolo Passeri;2019-09-10T11:20:53+01:00;19,462
39;22/07/2019;?;Single Individuals;Researchers from Defiant discover an ongoing malvertising campaign targeting an XSS vulnerability in the Coming Soon Page & Maintenance Mode WordPress plugin.;Malvertising;Not Found;Not Found;>1;https://www.bleepingcomputer.com/news/security/hackers-exploit-recent-wordpress-plugin-bugs-for-malvertising/;Paolo Passeri;2019-09-10T11:20:53+01:00;19,462
40;22/07/2019;?;Milton Keynes Council;The planning portal of Milton Keynes Council is crippled by a cyber attack.;Unknown;Not Found;Not Found;UK;https://www.ibtimes.sg/englands-milton-keynes-council-hit-by-cyber-attack-31838;Paolo Passeri;2019-09-10T11:20:53+01:00;19,462
41;23/07/2019;?;Targets in the financial sector;Researchers at Gigamon discover the latest campaign carried out by the FIN8 malicious group via Badhatch, a previously unreported malware.;PoS Malware;Not Found;Not Found;>1;https://www.zdnet.com/article/cybercrime-gang-adds-new-tactics-to-credit-card-data-stealing-campaign/;Paolo Passeri;2019-09-10T11:20:53+01:00;19,462
42;23/07/2019;?;High profile entities from industries such as media and banking;Researchers from Cofense discover a phishing campaign using WeTransfer to avoid detection.;Account Hijacking;Not Found;Not Found;>1;https://www.bleepingcomputer.com/news/security/phishing-campaign-bypasses-email-gateways-via-wetransfer-alerts/;Paolo Passeri;2019-09-10T11:20:53+01:00;19,462
43;23/07/2019;?;Unprotected Elasticsearch servers;Researchers at Trend Micro discover a new malware campaign targeting unprotected Elasticsearch databases. The malware turns them into botnet zombies to carry out distributed-denial-of-service (DDoS) attacks.;Malware;Not Found;Not Found;>1;https://www.hackread.com/malware-attack-turns-elasticsearch-databases-into-ddos-botnet/;Paolo Passeri;2019-09-10T11:20:53+01:00;19,462
44;23/07/2019;?;Tennessee Higher Education Commission;The Tennessee Higher Education Commission investigates a possible data breach of a 3rd party vendor, that potentially has exposed personal information of thousands of students.;Unknown;Not Found;Not Found;US;https://www.databreaches.net/tn-data-breach-of-vendor-puts-personal-info-of-tn-high-school-students-at-risk/;Paolo Passeri;2019-09-10T11:20:53+01:00;19,462
45;23/07/2019;?;University of Hawaii;Personal information for as many as 70,000 public school students may have been compromised after Graduation Alliance, a University of Hawaii vendor, detected “suspicious” unauthorized access to one of its servers.;Unknown;Not Found;Not Found;US;https://www.databreaches.net/personal-information-for-70000-hawaii-students-potentially-compromised/;Paolo Passeri;2019-09-10T11:20:53+01:00;19,462
46;23/07/2019;?;Dr. Carl Bilancione Dentist;Dr. Carl Bilancione Dentist s the latest victim of a ransomware attack.;Malware;Not Found;Not Found;US;https://www.databreaches.net/maitland-dentist-office-threatened-with-20000-ransomware/;Paolo Passeri;2019-09-10T11:20:53+01:00;19,462
