id;date;author;target;description;attack;target_class;attack_class;country;link;author_report;date_report;views
51;25/09/2019;?;Office 365 users;Researchers from Cofense discover a new phishing campaign using Google search query redirects to send potential victims to a phishing landing page designed to collect Microsoft Office 365 credentials via encoded URLs.;Account Hijacking;Not Found;Not Found;>1;https://www.bleepingcomputer.com/news/security/cyber-attacks-hit-defense-contractors-in-europe-and-north-america/;Paolo Passeri					;2019-10-28T12:04:52+00:00;16,811
52;26/09/2019;?;Airbus;A series of cyber attacks on Airbus in the past few months was conducted via the computer systems of its suppliers and security sources suspect a link to China;Targeted Attack;Not Found;Not Found;FR;https://www.bleepingcomputer.com/news/security/cyber-attacks-hit-defense-contractors-in-europe-and-north-america/;Paolo Passeri					;2019-10-28T12:04:52+00:00;16,811
53;26/09/2019;?;Rheinmetall Automotive;A malware infection at German car parts manufacturer Rheinmetall Automotive has caused “significant disruption” to production at company plants in Brazil, Mexico, and the United States, the company disclosed Thursday.;Malware;Not Found;Not Found;"BR
MX
US";https://www.bleepingcomputer.com/news/security/cyber-attacks-hit-defense-contractors-in-europe-and-north-america/;Paolo Passeri					;2019-10-28T12:04:52+00:00;16,811
54;26/09/2019;?;DoorDash;DoorDash announces that the personal data of 4.9 million people on its platform has been compromised in a security breach. The breach occurred on May 4. ;Unknown;Not Found;Not Found;US;https://www.bleepingcomputer.com/news/security/cyber-attacks-hit-defense-contractors-in-europe-and-north-america/;Paolo Passeri					;2019-10-28T12:04:52+00:00;16,811
55;26/09/2019;?;Multiple Targets;"Researchers from Proofpoint reveal the details of WhiteShadow, a ""malware delivery service"" used to spread malware including Remote Access Trojans (RATs) such as Crimson RAT, and Agent Tesla, AZORult, and keyloggers, among others.";Malware;Not Found;Not Found;>1;https://www.bleepingcomputer.com/news/security/cyber-attacks-hit-defense-contractors-in-europe-and-north-america/;Paolo Passeri					;2019-10-28T12:04:52+00:00;16,811
56;26/09/2019;?;iOS and Android users;Researchers from Trend Micro discover hundreds of fake apps in the App Store and Google Play, masqueraded as legitimate apps but in reality designed to pivot users towards downloading gambling services.  ;Malware;Not Found;Not Found;>1;https://www.bleepingcomputer.com/news/security/cyber-attacks-hit-defense-contractors-in-europe-and-north-america/;Paolo Passeri					;2019-10-28T12:04:52+00:00;16,811
57;26/09/2019;?;Single Individuals;Researchers from Microsoft discover Nodersok, a malware that installs a copy of the Node.js framework to convert infected systems into proxies and perform click-fraud. The malware is also dubbed Divergent by Cisco Talos, and Novter by Trend Micro.;Malware;Not Found;Not Found;>1;https://www.bleepingcomputer.com/news/security/cyber-attacks-hit-defense-contractors-in-europe-and-north-america/;Paolo Passeri					;2019-10-28T12:04:52+00:00;16,811
58;26/09/2019;?;Single Individuals;Researchers from Juniper Threats Lab discover Masad Stealer, a new malware stealing files, browser information, and cryptocurrency wallet data, and using Telegram as a communication channel.;Malware;Not Found;Not Found;>1;https://www.bleepingcomputer.com/news/security/cyber-attacks-hit-defense-contractors-in-europe-and-north-america/;Paolo Passeri					;2019-10-28T12:04:52+00:00;16,811
59;26/09/2019;?;Vulnerable vBulletin systems;A botnet is detected utilizing the recently disclosed vBulletin exploit to secure vulnerable servers so that they cannot be used by other attackers.;Malware;Not Found;Not Found;>1;https://www.bleepingcomputer.com/news/security/cyber-attacks-hit-defense-contractors-in-europe-and-north-america/;Paolo Passeri					;2019-10-28T12:04:52+00:00;16,811
60;27/09/2019;?;Defence Construction Canada (DCC);Defence Construction Canada (DCC) is hit by a ransomware attack.;Malware;Not Found;Not Found;CA;https://www.bleepingcomputer.com/news/security/cyber-attacks-hit-defense-contractors-in-europe-and-north-america/;Paolo Passeri					;2019-10-28T12:04:52+00:00;16,811
61;27/09/2019;?;Manufacturing company in Strathroy;An undisclosed manufacturing company in Strathroy is hit by a ransomware attack.;Malware;Not Found;Not Found;CA;https://www.bleepingcomputer.com/news/security/comodo-forums-breached-data-of-over-170-000-users-up-for-grabs/;Paolo Passeri					;2019-10-28T12:04:52+00:00;16,811
62;27/09/2019;?;Listowel Hospital;The Listowel Hospital is hit by a ransomware attack.;Malware;Not Found;Not Found;CA;https://www.bleepingcomputer.com/news/security/comodo-forums-breached-data-of-over-170-000-users-up-for-grabs/;Paolo Passeri					;2019-10-28T12:04:52+00:00;16,811
63;27/09/2019;?;Wingham Hospital;The Wingham Hospital is hit by a ransomware attack.;Malware;Not Found;Not Found;CA;https://www.bleepingcomputer.com/news/security/comodo-forums-breached-data-of-over-170-000-users-up-for-grabs/;Paolo Passeri					;2019-10-28T12:04:52+00:00;16,811
64;27/09/2019;X4Crow;92 million Brazilian citizens;Someone is auctioning on underground forums a database allegedly containing personal information of 92 million Brazilian citizens.;Unknown;Not Found;Not Found;BR;https://www.bleepingcomputer.com/news/security/comodo-forums-breached-data-of-over-170-000-users-up-for-grabs/;Paolo Passeri					;2019-10-28T12:04:52+00:00;16,811
65;27/09/2019;NSO Group?;Android users;Google warns owners of some popular Android devices of an exploit for an unpatched flaw, possibly exploited in the wild by NSO Group.;Targeted Attack;Not Found;Not Found;>1;https://www.bleepingcomputer.com/news/security/comodo-forums-breached-data-of-over-170-000-users-up-for-grabs/;Paolo Passeri					;2019-10-28T12:04:52+00:00;16,811
66;28/09/2019;?;Billboard on Interstate 75;Two individuals play an adult pornography video on a billboard on Interstate 75 near Michigan highway 59.;Unknown;Not Found;Not Found;US;https://www.bleepingcomputer.com/news/security/comodo-forums-breached-data-of-over-170-000-users-up-for-grabs/;Paolo Passeri					;2019-10-28T12:04:52+00:00;16,811
67;29/09/2019;Gnosticplayers;Zynga;Gnosticplayers claims to have stolen more than 218 million records from Words with Friends a popular mobile social game from Zynga Inc.;Unknown;Not Found;Not Found;US;https://www.bleepingcomputer.com/news/security/comodo-forums-breached-data-of-over-170-000-users-up-for-grabs/;Paolo Passeri					;2019-10-28T12:04:52+00:00;16,811
68;29/09/2019;?;ASICS Store in Auckland;Major sportswear brand Asics blames a “cyberattack” after large storefront display screens played pornography to passersby for nine hours. The incident took place at a busy Asics store on a major high street in Auckland.;Unknown;Not Found;Not Found;NZ;https://www.bleepingcomputer.com/news/security/comodo-forums-breached-data-of-over-170-000-users-up-for-grabs/;Paolo Passeri					;2019-10-28T12:04:52+00:00;16,811
69;30/09/2019;?;Demant;Demant, one of the world's largest manufacturers of hearing aids, expects to incur losses of up to $95 million following what appears to be a ransomware infection that hit the company at the start of the month.;Malware;Not Found;Not Found;DK;https://www.bleepingcomputer.com/news/security/comodo-forums-breached-data-of-over-170-000-users-up-for-grabs/;Paolo Passeri					;2019-10-28T12:04:52+00:00;16,811
70;30/09/2019;?;Comodo;Account data belonging to more than half of all Comodo Forums users (170,000 users) has been stolen and is now traded online. The breach was possible by exploiting a vulnerability in the vBulletin software that powers the forum.;vBulletin vulnerability;Not Found;Not Found;US;https://www.bleepingcomputer.com/news/security/comodo-forums-breached-data-of-over-170-000-users-up-for-grabs/;Paolo Passeri					;2019-10-28T12:04:52+00:00;16,811
71;30/09/2019;?;ITarian;ITarian, also owned by Comodo is hit by the same attack (that's probably the origin of the breach).;vBulletin vulnerability;Not Found;Not Found;US;https://www.databreaches.net/in-goshen-health-notifies-patients-potentially-impacted-by-2018-data-security-breach/;Paolo Passeri					;2019-10-28T12:04:52+00:00;16,811
72;30/09/2019;?;Users from the U.S. and multiple European Union countries;Researchers from Confiant reveal a new wave of attacks of to the eGobbler campaign, using a WebKit exploit, hijacking 1.16 billion ad impressions have, to redirect potential victims to malicious payloads, between August 1 and September 23.;Malvertising;Not Found;Not Found;>1;https://www.databreaches.net/in-goshen-health-notifies-patients-potentially-impacted-by-2018-data-security-breach/;Paolo Passeri					;2019-10-28T12:04:52+00:00;16,811
73;30/09/2019;?;English and Arabic-speaking users;Researchers from Cisco Talos discover multiple cybercriminal operations using OpenDocument Text (ODT) files to distribute malware. The campaigns target English and Arabic-speaking users.;Malware;Not Found;Not Found;>1;https://www.databreaches.net/in-goshen-health-notifies-patients-potentially-impacted-by-2018-data-security-breach/;Paolo Passeri					;2019-10-28T12:04:52+00:00;16,811
74;30/09/2019;?;Wood Ranch Medical;Wood Ranch Medical permanently closes its doors, after the provider was unable to recover its patient records encrypted by ransomware back in August.;Malware;Not Found;Not Found;US;https://www.databreaches.net/in-goshen-health-notifies-patients-potentially-impacted-by-2018-data-security-breach/;Paolo Passeri					;2019-10-28T12:04:52+00:00;16,811
75;30/09/2019;?;IoT devices;Security researchers with SecNiche Security Labs discover Gucci, a new IoT botnet that attempts to ensnare Internet of Things (IoT) devices in Europe into a distributed denial-of-service (DDoS)-capable botnet.;Malware;Not Found;Not Found;>1;https://www.databreaches.net/in-goshen-health-notifies-patients-potentially-impacted-by-2018-data-security-breach/;Paolo Passeri					;2019-10-28T12:04:52+00:00;16,811
76;30/09/2019;?;IoT devices;Researchers from MalwareMustDie discover a new IoT malware dubbed Linux/AirDropBot ;Malware;Not Found;Not Found;>1;https://www.databreaches.net/in-goshen-health-notifies-patients-potentially-impacted-by-2018-data-security-breach/;Paolo Passeri					;2019-10-28T12:04:52+00:00;16,811
77;30/09/2019;?;Goshen Health;Goshen Health discloses a security incident that involved the personal information of some of its patients. An unauthorized third party may have  accessed two employees’ email accounts from approximately August 2, 2018 to August 13, 2018.;Account Hijacking;Not Found;Not Found;US;https://www.databreaches.net/in-goshen-health-notifies-patients-potentially-impacted-by-2018-data-security-breach/;Paolo Passeri					;2019-10-28T12:04:52+00:00;16,811
1;31/08/2019;?;CircleCI;Software testing and delivery company CircleCI notifies a security incident involving the company and a third-party analytics vendor. An attacker was able to improperly access some user data in the vendor account.;Unknown;Not Found;Not Found;US;https://www.bleepingcomputer.com/news/security/hacked-sharepoint-sites-used-to-bypass-secure-email-gateways/;Paolo Passeri					;2019-10-17T09:38:41+01:00;18,953
2;31/08/2019;?;Single Individuals;A new campaign distributes the Nemty Ransomware via the RIG Exploit Kit.;Malware;Not Found;Not Found;>1;https://www.bleepingcomputer.com/news/security/hacked-sharepoint-sites-used-to-bypass-secure-email-gateways/;Paolo Passeri					;2019-10-17T09:38:41+01:00;18,953
3;31/08/2019;?;LIHKG;LIHKG, an online forum used by activists behind the ongoing Hong Kong protests suffers a DDoS attack forcing its servers to go offline for a short period of time.;DDoS;Not Found;Not Found;HK;https://www.bleepingcomputer.com/news/security/hacked-sharepoint-sites-used-to-bypass-secure-email-gateways/;Paolo Passeri					;2019-10-17T09:38:41+01:00;18,953
4;01/09/2019;?;XKCD Forums;The forums of the XKCD webcomic are currently offline after being impacted by a data breach which exposed the information of 561,991 users on July 1.;Unknown;Not Found;Not Found;US;https://www.bleepingcomputer.com/news/security/hacked-sharepoint-sites-used-to-bypass-secure-email-gateways/;Paolo Passeri					;2019-10-17T09:38:41+01:00;18,953
5;01/09/2019;?;Souderton Area School District;The Souderton Area School District is hit by a ransomware attack.;Malware;Not Found;Not Found;US;https://www.bleepingcomputer.com/news/security/hacked-sharepoint-sites-used-to-bypass-secure-email-gateways/;Paolo Passeri					;2019-10-17T09:38:41+01:00;18,953
6;02/09/2019;?;BleachBit user;Criminals create a fake BleachBit website to distribute the AZORult information stealer.;Malware;Not Found;Not Found;>1;https://www.bleepingcomputer.com/news/security/hacked-sharepoint-sites-used-to-bypass-secure-email-gateways/;Paolo Passeri					;2019-10-17T09:38:41+01:00;18,953
7;02/09/2019;?;Single Individuals;Researchers from Check Point discover a new malicious campaign actively distributing a new Astaroth variant by abusing the Cloudflare Workers serverless computing platform to evade detection.;Malware;Not Found;Not Found;>1;https://www.bleepingcomputer.com/news/security/hacked-sharepoint-sites-used-to-bypass-secure-email-gateways/;Paolo Passeri					;2019-10-17T09:38:41+01:00;18,953
8;02/09/2019;?;Single Individuals;A new campaign distributes the Sodinokibi Ransomware hacking into WordPress sites and injecting JavaScript that displays a fake Q & A forum with links to the ransomware installer.;Malware;Not Found;Not Found;>1;https://www.bleepingcomputer.com/news/security/hacked-sharepoint-sites-used-to-bypass-secure-email-gateways/;Paolo Passeri					;2019-10-17T09:38:41+01:00;18,953
9;03/09/2019;?;Android users;Security researcher Aleksejs Kuprins from CSIS Security Group discovers a new malware campaign able to infiltrate the official Google Play store to deploy the Joker Trojan to Android devices.;Malware;Not Found;Not Found;>1;https://www.bleepingcomputer.com/news/security/hacked-sharepoint-sites-used-to-bypass-secure-email-gateways/;Paolo Passeri					;2019-10-17T09:38:41+01:00;18,953
10;03/09/2019;?;Targets in the banking sector;Researchers from Cofense discover a new phishing campaign using compromised SharePoint sites and OneNote documents to redirect potential victims from the banking sector to their landing pages and evade email security gateways.;Account Hijacking;Not Found;Not Found;>1;https://www.bleepingcomputer.com/news/security/hacked-sharepoint-sites-used-to-bypass-secure-email-gateways/;Paolo Passeri					;2019-10-17T09:38:41+01:00;18,953
11;03/09/2019;?;Single Individuals;Researchers from Malwarebytes discover a new social engineering toolkit called Domen that uses fake browser and program update alerts on compromised sites to infect users with malware and remote access software.;Social Engineering Toolkit;Not Found;Not Found;>1;https://www.zdnet.com/article/a-chinese-apt-is-now-going-after-pulse-secure-and-fortinet-vpn-servers/;Paolo Passeri					;2019-10-17T09:38:41+01:00;18,953
12;03/09/2019;?;Monroe-Woodbury Central School District;New York's Monroe-Woodbury Central School District delays the first day of school due to a ransomware attack.;Malware;Not Found;Not Found;US;https://www.zdnet.com/article/a-chinese-apt-is-now-going-after-pulse-secure-and-fortinet-vpn-servers/;Paolo Passeri					;2019-10-17T09:38:41+01:00;18,953
13;03/09/2019;?;Temple University Health System;Temple University Health System is back online after an unconfirmed ransomware attack.;Malware;Not Found;Not Found;US;https://www.zdnet.com/article/a-chinese-apt-is-now-going-after-pulse-secure-and-fortinet-vpn-servers/;Paolo Passeri					;2019-10-17T09:38:41+01:00;18,953
14;04/09/2019;?;City of New Bedford;A ransomware gang tried to extract a ransom of $5.3 million from the city of New Bedford, but the city chose to restore from backups after hackers rejected a counter-offer of $400,000. The incident, due to the Ryuk ransomware, happened in early July.;Malware;Not Found;Not Found;US;https://www.zdnet.com/article/a-chinese-apt-is-now-going-after-pulse-secure-and-fortinet-vpn-servers/;Paolo Passeri					;2019-10-17T09:38:41+01:00;18,953
15;04/09/2019;?;Wolcott School District;For the second time in four months, the Wolcott school district is the victim of a ransomware attack.;Malware;Not Found;Not Found;US;https://www.zdnet.com/article/a-chinese-apt-is-now-going-after-pulse-secure-and-fortinet-vpn-servers/;Paolo Passeri					;2019-10-17T09:38:41+01:00;18,953
16;04/09/2019;?;Single Individuals;Researchers from Trend Micro discover a new variant of the Glupteba malware dropper, using the Bitcoin blockchain to fetch command and control (C2) server domains.;Malware;Not Found;Not Found;>1;https://www.zdnet.com/article/a-chinese-apt-is-now-going-after-pulse-secure-and-fortinet-vpn-servers/;Paolo Passeri					;2019-10-17T09:38:41+01:00;18,953
17;04/09/2019;?;Android users in Japan;Researchers from Fortinet discover an Android malware dubbed “FunkyBot”, operated by the same attackers responsible for the FakeSpy malware.;Malware;Not Found;Not Found;JP;https://www.zdnet.com/article/a-chinese-apt-is-now-going-after-pulse-secure-and-fortinet-vpn-servers/;Paolo Passeri					;2019-10-17T09:38:41+01:00;18,953
18;04/09/2019;?;UC Health;UC Health discloses that it is investigating a recent email phishing incident that may have involved patient information. Some e-mail accounts were accessed between July 6, 2019 and July 12, 2019.;Account Hijacking;Not Found;Not Found;US;https://www.zdnet.com/article/a-chinese-apt-is-now-going-after-pulse-secure-and-fortinet-vpn-servers/;Paolo Passeri					;2019-10-17T09:38:41+01:00;18,953
19;04/09/2019;?;Sherman School;State Police are investigating the discovery of ransomware on Sherman School computer servers on August 16.;Malware;Not Found;Not Found;US;https://www.zdnet.com/article/a-chinese-apt-is-now-going-after-pulse-secure-and-fortinet-vpn-servers/;Paolo Passeri					;2019-10-17T09:38:41+01:00;18,953
20;05/09/2019;APT5;Multiple Targets;A group of Chinese state-sponsored hackers (APT5) is targeting enterprise VPN servers from Fortinet and Pulse Secure after details about security flaws in both products (CVE-2018-13379 and CVE-2019-11510) became public knowledge last month.;CVE-2018-13379 and CVE-2019-11510 vulnerabilities;Not Found;Not Found;>1;https://www.zdnet.com/article/a-chinese-apt-is-now-going-after-pulse-secure-and-fortinet-vpn-servers/;Paolo Passeri					;2019-10-17T09:38:41+01:00;18,953
21;05/09/2019;?;City of Unalaska;The City of Unalaska recovers more than $2.3 million dollars, after wiring  $2,985,406.10 to a fraudulent bank account as a result of a phishing email scam between May 15 and July 9.;BEC;Not Found;Not Found;US;https://techcrunch.com/2019/09/07/wikipedia-blames-malicious-ddos-attack-after-site-goes-down-across-europe-middle-east/;Paolo Passeri					;2019-10-17T09:38:41+01:00;18,953
22;05/09/2019;?;Flagstaff Unified School District;The Flagstaff Unified School District is closed by a ransomware attack.;Malware;Not Found;Not Found;US;https://techcrunch.com/2019/09/07/wikipedia-blames-malicious-ddos-attack-after-site-goes-down-across-europe-middle-east/;Paolo Passeri					;2019-10-17T09:38:41+01:00;18,953
23;05/09/2019;?;Meridian Community College;Meridian Community College notifies a phishing incident occurred in January.;Account Hijacking;Not Found;Not Found;US;https://techcrunch.com/2019/09/07/wikipedia-blames-malicious-ddos-attack-after-site-goes-down-across-europe-middle-east/;Paolo Passeri					;2019-10-17T09:38:41+01:00;18,953
24;06/09/2019;?;Toyota Boshoku Corporation;Toyota Boshoku Corporation announces that one of its European subsidiaries lost more than $37 million due to a business email compromise (BEC) attack. ;BEC;Not Found;Not Found;N/A;https://techcrunch.com/2019/09/07/wikipedia-blames-malicious-ddos-attack-after-site-goes-down-across-europe-middle-east/;Paolo Passeri					;2019-10-17T09:38:41+01:00;18,953
25;06/09/2019;?;Facebook users;A huge cache (220 million records) of Facebook users' phone numbers and user IDs is found for sale online at the price of $1,000. The list allegedly comes from an unsecured database unearthed two days before.;Misconfiguration;Not Found;Not Found;>1;https://techcrunch.com/2019/09/07/wikipedia-blames-malicious-ddos-attack-after-site-goes-down-across-europe-middle-east/;Paolo Passeri					;2019-10-17T09:38:41+01:00;18,953
26;06/09/2019;?;Robert Downey Jr. Instagram account;The Instagram account of Robert Downey Jr. is hacked. The attackers post fake giveaways for Apple products.;Account Hijacking;Not Found;Not Found;US;https://techcrunch.com/2019/09/07/wikipedia-blames-malicious-ddos-attack-after-site-goes-down-across-europe-middle-east/;Paolo Passeri					;2019-10-17T09:38:41+01:00;18,953
27;06/09/2019;?;Oklahoma Law Enforcement Retirement System (OLERS) Agency;Oklahoma Law Enforcement Retirement System (OLERS) Agency reveals that cyber-thieves made off with $4.2 million. The theft occurred on August 26, 2019, when the perpetrators managed to hack into the email account of an investment manager.;BEC;Not Found;Not Found;US;https://techcrunch.com/2019/09/07/wikipedia-blames-malicious-ddos-attack-after-site-goes-down-across-europe-middle-east/;Paolo Passeri					;2019-10-17T09:38:41+01:00;18,953
28;06/09/2019;?;Hong Kong Exchanges and Clearing Limited (HKEX);The Hong Kong Exchanges and Clearing Limited (HKEX) is hit by a DDoS attack.;DDoS;Not Found;Not Found;HK;https://techcrunch.com/2019/09/07/wikipedia-blames-malicious-ddos-attack-after-site-goes-down-across-europe-middle-east/;Paolo Passeri					;2019-10-17T09:38:41+01:00;18,953
29;06/09/2019;?;Single Individuals;Researchers from Proofpoint discover a new variant of PsiXBot, malware configured for the theft of information and cryptocurrency, abusing Google's DNS over HTTPS service. ;Malware;Not Found;Not Found;>1;https://techcrunch.com/2019/09/07/wikipedia-blames-malicious-ddos-attack-after-site-goes-down-across-europe-middle-east/;Paolo Passeri					;2019-10-17T09:38:41+01:00;18,953
30;06/09/2019;UkDrillas;Wikipedia;Wikipedia is forced offline in several countries after a cyber attack hits the global encyclopedia.;DDoS;Not Found;Not Found;US;https://techcrunch.com/2019/09/07/wikipedia-blames-malicious-ddos-attack-after-site-goes-down-across-europe-middle-east/;Paolo Passeri					;2019-10-17T09:38:41+01:00;18,953
31;06/09/2019;UkDrillas;World of Warcraft Classic;World of Warcraft Classic is also hit by a DDoS attack.;DDoS;Not Found;Not Found;US;https://securityaffairs.co/wordpress/91150/malware/lokibot-spam-campaign.html;Paolo Passeri					;2019-10-17T09:38:41+01:00;18,953
32;06/09/2019;?;Linux Servers;Thousands of web servers are infected and have their files encrypted by a new strain of ransomware named Lilocked (or Lilu).;Malware;Not Found;Not Found;>1;https://securityaffairs.co/wordpress/91150/malware/lokibot-spam-campaign.html;Paolo Passeri					;2019-10-17T09:38:41+01:00;18,953
33;06/09/2019;?;Rockford Public Schools Dist. 205;Rockford Public Schools is hit by a ransomware attack.;Malware;Not Found;Not Found;US;https://securityaffairs.co/wordpress/91150/malware/lokibot-spam-campaign.html;Paolo Passeri					;2019-10-17T09:38:41+01:00;18,953
34;06/09/2019;?;Metro Mobility;Metro Mobility notifies 15,000 customers of a data breach when an employee’s e-mail account was hacked by an unauthorized person, compromising personal ride information between June 13 and Aug. 14.;Account Hijacking;Not Found;Not Found;US;https://securityaffairs.co/wordpress/91150/malware/lokibot-spam-campaign.html;Paolo Passeri					;2019-10-17T09:38:41+01:00;18,953
35;07/09/2019;?;Entercom Communications;Entercom Communications, one of the largest radio station owners in the U.S. is allegedly hit by a ransomware, affecting all offices the company has across the country.;Malware;Not Found;Not Found;US;https://securityaffairs.co/wordpress/91150/malware/lokibot-spam-campaign.html;Paolo Passeri					;2019-10-17T09:38:41+01:00;18,953
36;08/09/2019;?;Single Individuals;Four different malvertising campaigns, distributing Ramnit, Amadey, Nemty, and a clipboard hijacker, have been redirecting users to exploit kits that install password stealing Trojans, ransomware, and clipboard hijackers.;Malvertising;Not Found;Not Found;>1;https://securityaffairs.co/wordpress/91150/malware/lokibot-spam-campaign.html;Paolo Passeri					;2019-10-17T09:38:41+01:00;18,953
37;08/09/2019;?;Single Individuals;A fake PayPal site actively spreads the Nemty ransomware.;Malware;Not Found;Not Found;>1;https://securityaffairs.co/wordpress/91150/malware/lokibot-spam-campaign.html;Paolo Passeri					;2019-10-17T09:38:41+01:00;18,953
38;09/09/2019;?;Targets in the US;"The Cybersecurity and Infrastructure Security Agency (CISA) and Federal Bureau of Investigation (FBI) issue an alert on malicious activity from North Korea (Hidden Cobra). Attackers have recently been using ""ELECTRICFISH"" and ""BADCALL"" malware variants.";Targeted Attack;Not Found;Not Found;US;https://securityaffairs.co/wordpress/91150/malware/lokibot-spam-campaign.html;Paolo Passeri					;2019-10-17T09:38:41+01:00;18,953
39;09/09/2019;?;Miracle Systems;The U.S. Secret Service investigates a breach at Miracle Systems, a government technology contractor that saw access to several of its systems put up for sale in the cybercrime underground.;Unknown;Not Found;Not Found;US;https://securityaffairs.co/wordpress/91150/malware/lokibot-spam-campaign.html;Paolo Passeri					;2019-10-17T09:38:41+01:00;18,953
