id;date;author;target;description;attack;target_class;attack_class;country;link;author_report;date_report;views
5;16/04/2019;?;Remotely Accessible Samba Servers;A new ransomware family called NamPoHyu Virus or MegaLocker Virus is targeting victims, running locally on a victim's computer, and remotely encrypt accessible Samba servers.;Malware;Not Found;Not Found;>1;https://www.bleepingcomputer.com/news/security/nampohyu-virus-ransomware-targets-remote-samba-servers/;Paolo Passeri;2019-05-16T11:26:57+01:00;22,579
6;16/04/2019;?;Users of the popular Electrum Bitcoin wallet;Researchers from Malwarebytes reveal that since at least late December 2018, users of the popular Electrum Bitcoin wallet have fallen victim to phishing attacks, estimated to net crooks over 771 Bitcoins, approximately $4 million at current exchange rate.;Account Hijacking;Not Found;Not Found;>1;https://blog.malwarebytes.com/cybercrime/2019/04/electrum-bitcoin-wallets-under-siege/;Paolo Passeri;2019-05-16T11:26:57+01:00;22,579
7;16/04/2019;?;Single Individuals;Researchers from ZeroFOX discover multiple campaigns exploiting the tragic fire of Notre Dame for fake donation pages and new phishing campaigns.;Account Hijacking;Not Found;Not Found;>1;https://www.infosecurity-magazine.com/news/fraudsters-expolit-sympaties-notre/;Paolo Passeri;2019-05-16T11:26:57+01:00;22,579
8;16/04/2019;?;Centrelake Medical Group;Centrelake Medical Group notifies almost 198,000 patients after a virus investigation reveals earlier intrusion and suspicious activity.;Malware;Not Found;Not Found;US;https://www.databreaches.net/centrelake-medical-group-notifies-patients-after-ransomware-investigation-reveals-earlier-intrusion-and-suspicious-activity/;Paolo Passeri;2019-05-16T11:26:57+01:00;22,579
9;17/04/2019;?;Organizations in the Middle East and North Africa (ministries, military organizations, intelligence agencies, energy companies).;Researchers from Cisco Talos reveal the details of Sea Turtle, a state-sponsored attack manipulating DNS systems, targeting primarily national security organizations in the Middle East and North Africa.;DNS Hijacking;Not Found;Not Found;>1;https://blog.talosintelligence.com/2019/04/seaturtle.html;Paolo Passeri;2019-05-16T11:26:57+01:00;22,579
10;17/04/2019;?;Verint;The Israel offices of US cyber-security firm Verint are hit by ransomware.;Malware;Not Found;Not Found;IL;https://www.zdnet.com/article/cyber-security-firm-verint-hit-by-ransomware/;Paolo Passeri;2019-05-16T11:26:57+01:00;22,579
11;17/04/2019;?;Multiple Targets;Researchers from Trend Micro discover a potential targeted attack, making use of legitimate script engine AutoHotkey, in combination with malicious script files. ;Targeted Attack;Not Found;Not Found;>1;https://www.bleepingcomputer.com/news/security/malicious-autohotkey-scripts-used-to-steal-info-remotely-access-systems/;Paolo Passeri;2019-05-16T11:26:57+01:00;22,579
12;17/04/2019;?;Chipotle;Some Chipotle customers claim their accounts have been hacked and report fraudulent orders charged to their credit cards. The company states credential stuffing is to blame.;Credential Stuffing;Not Found;Not Found;US;https://techcrunch.com/2019/04/17/chipotle-accounts-hacked/;Paolo Passeri;2019-05-16T11:26:57+01:00;22,579
13;18/04/2019;Lab Dookhtegan;OilRig, AKA APT34, AKA HelixKitten;A collective dubbed Lab Dookhtegan reveal details about the inner workings of the cyber-espionage group known as OilRig, APT34, and HelixKitten, linked to the Iranian government. The source code of their tools is leaked on Telegram.;Unknown;Not Found;Not Found;IR;https://www.bleepingcomputer.com/news/security/hacker-group-exposes-iranian-apt-operations-and-members/;Paolo Passeri;2019-05-16T11:26:57+01:00;22,579
14;18/04/2019;?;The Weather Channel;"The Weather Channel is hit by a ransomware attack.
";Malware;Not Found;Not Found;US;https://www.engadget.com/2019/04/18/the-weather-channel-ransomware/;Paolo Passeri;2019-05-16T11:26:57+01:00;22,579
15;18/04/2019;?;Entities from North America, Europe, Asia, and the Middle East;"Researchers from Palo Alto Networks reveal the details of ""Aggah"", a malicious campaign targeting entities from North America, Europe, Asia, and the Middle East using a combination of pages hosted on Bit.ly, BlogSpot, and Pastebin to evade detection.";Targeted Attack;Not Found;Not Found;>1;https://www.bleepingcomputer.com/news/security/revengerat-distributed-via-bitly-blogspot-and-pastebin-c2-infrastructure/;Paolo Passeri;2019-05-16T11:26:57+01:00;22,579
16;18/04/2019;?;Single Individuals;A new variant of the CryptoMix ransomware emerges, appending the .DLL extension to encrypted files and is said to be installed through hacked remote desktop services.;Malware;Not Found;Not Found;>1;https://www.bleepingcomputer.com/news/security/dll-cryptomix-ransomware-variant-installed-via-remote-desktop/;Paolo Passeri;2019-05-16T11:26:57+01:00;22,579
17;18/04/2019;?;City of Augusta;The City of Augusta municipal services are hit by a ransomware attack.;Malware;Not Found;Not Found;US;https://www.sunjournal.com/2019/04/18/city-of-augusta-hit-by-computer-virus-city-center-closed/;Paolo Passeri;2019-05-16T11:26:57+01:00;22,579
18;18/04/2019;TA505;Financial entities in the United States and worldwide;Researchers at Cyberint uncover a new campaign of the russian actor TA505 against financial entities in the United States and worldwide.;Targeted Attack;Not Found;Not Found;>1;https://securityaffairs.co/wordpress/84072/hacking/russian-ta505-financial-attacks.html;Paolo Passeri;2019-05-16T11:26:57+01:00;22,579
19;18/04/2019;?;Multiple Targets;The attackers responsible for launching phishing campaigns against Wipro, India’s third-largest IT outsourcing firm, also appear to have targeted a number of other competing providers, including Infosys and Cognizant.;Account Hijacking;Not Found;Not Found;>1;https://krebsonsecurity.com/2019/04/wipro-intruders-targeted-other-major-it-firms/;Paolo Passeri;2019-05-16T11:26:57+01:00;22,579
20;19/04/2019;?;Ad Agencies;Researchers from Check Point uncover a series of applications conducting fraudulent activities against Ad Agencies, carried out via a mobile malware dubbed ‘PreAMo’. The malware totaled over 90 million installs from Google Play across 6 applications.;Malware;Not Found;Not Found;>1;https://research.checkpoint.com/preamo-a-clicker-campaign-found-on-google-play/;Paolo Passeri;2019-05-16T11:26:57+01:00;22,579
21;19/04/2019;?;Partners for Quality;Partners for Quality notifies 3,673 clients after some employees' email accounts are compromised.;Account Hijacking;Not Found;Not Found;US;https://www.databreaches.net/pa-partners-for-quality-notifies-3673-clients-after-employee-email-accounts-compromised/;Paolo Passeri;2019-05-16T11:26:57+01:00;22,579
22;20/04/2019;?;Atlanta Hawks;The online shop for the Atlanta Hawks professional NBA basketball team has malicious code injected into (Magecart Infection).;Malicious Script Injection;Not Found;Not Found;US;https://www.bleepingcomputer.com/news/security/atlanta-hawks-online-shop-hit-with-credit-card-stealing-attack/;Paolo Passeri;2019-05-16T11:26:57+01:00;22,579
23;20/04/2019;?;EmCare Inc.;EmCare Inc. discloses that an unauthorized party obtained access to a number of employees’ email accounts that contained the personal information of as many as 60,000 individuals, 31,000 of which are patients.;Account Hijacking;Not Found;Not Found;US;https://www.bloomberg.com/news/articles/2019-04-20/kkr-s-emcare-says-patient-employee-personal-data-was-accessed-jupwipt7;Paolo Passeri;2019-05-16T11:26:57+01:00;22,579
24;22/04/2019;?;Bodybuilding.com;Bodybuilding.com notifies its customers of a security breach detected during February 2019 which was the direct result of a phishing email received back in July 2018. Potentially 18M users are impacted.;Account Hijacking;Not Found;Not Found;US;https://www.bleepingcomputer.com/news/security/bodybuildingcom-security-breach-all-customer-passwords-reset/;Paolo Passeri;2019-05-16T11:26:57+01:00;22,579
25;22/04/2019;?;Vulnerable WordPress Sites;Researchers from Palo Alto Networks discover an additional campaign exploiting the CVE-2019-9978 vulnerability of the Social Warfare Wordpress plugin.;Vulnerability (CVE-2019-9978);Not Found;Not Found;>1;https://securityaffairs.co/wordpress/84487/hacking/social-warfare-zero-day.html;Paolo Passeri;2019-05-16T11:26:57+01:00;22,579
26;22/04/2019;?;Embassy officials from at least seven countries (Italy, Kenya, Bermuda, Nepal, Guyana, Lebanon, and Liberia);Researchers from Check Point reveal the details of FINTEAM, a cyber espionage campaign leveraging a weaponized version of TeamViewer to target embassy officials from at least seven countries (Italy, Kenya, Bermuda, Nepal, Guyana, Lebanon, and Liberia).;Targeted Attack;Not Found;Not Found;>1;https://securityaffairs.co/wordpress/84367/hacking/trojanized-teamviewer-hit-embassies.html;Paolo Passeri;2019-05-16T11:26:57+01:00;22,579
27;23/04/2019;?;Aebi Schmidt;Aebi Schmidt, a Swiss manufacturing giant with operations in the U.S., is hit by a ransomware attack.;Malware;Not Found;Not Found;CH;https://techcrunch.com/2019/04/23/aebi-schmidt-ransomware/;Paolo Passeri;2019-05-16T11:26:57+01:00;22,579
28;23/04/2019;?;Multiple Targets;Researchers from Netskope discover a malware hosted on Google Sites. The threat is a dropper for an information stealer that sends data to a MySQL server controlled by the attacker.;Malware;Not Found;Not Found;>1;https://www.netskope.com/blog/malicious-google-sites;Paolo Passeri;2019-05-16T11:26:57+01:00;22,579
29;23/04/2019;State-sponsored actor;Multiple Targets;Researchers from Kaspersky discover six more companies hit by the ShadowHammer Operation: Electronics Extreme, Innovative Extremist, Zepetto, and three additional companies in South Korea (video gaming, conglomerate holding and pharmaceutical).;Targeted Attack;Not Found;Not Found;>1;https://www.bleepingcomputer.com/news/security/shadowhammer-targets-multiple-companies-asus-just-one-of-them/;Paolo Passeri;2019-05-16T11:26:57+01:00;22,579
30;23/04/2019;?;Companies in Lebanon and the United Arab Emirates (UAE);Researchers from Cisco Talos reveal the details of the Karkoff malware, the new weapon used by the threat actor behind the DNSpionage campaign, and a possible link with the Oilrig APT.;Targeted Attack;Not Found;Not Found;"UAE
LB";https://blog.talosintelligence.com/2019/04/dnspionage-brings-out-karkoff.html;Paolo Passeri;2019-05-16T11:26:57+01:00;22,579
31;23/04/2019;?;A2 Hosting;A ransomware infection takes down the operations of A2 Hosting, a US-based web hosting provider.;Malware;Not Found;Not Found;US;https://www.zdnet.com/article/windows-server-hosting-provider-still-down-a-week-after-ransomware-attack/;Paolo Passeri;2019-05-16T11:26:57+01:00;22,579
32;23/04/2019;?;Android Users;Researchers from Avast discover 50 apps relating to lifestyle services which masquerade as legitimate software but are actually adware (Android:Agent-SEB [PUP]), downloaded a total of 30 million times.;Malware;Not Found;Not Found;>1;https://www.zdnet.com/article/30-million-android-users-have-installed-malicious-lifestyle-apps/;Paolo Passeri;2019-05-16T11:26:57+01:00;22,579
33;23/04/2019;?;Ethereum Blockchain;Researchers at Independent Security Evaluators (ISE) discover that someone, exploiting accidentally generated weak keys, was able to steal the equivalent of $54 million of Ethereum.;Protocol Weakness;Not Found;Not Found;N/A;https://nakedsecurity.sophos.com/2019/04/25/blochainbandit-stole-54-million-of-ethereum-by-guessing-weak-keys/;Paolo Passeri;2019-05-16T11:26:57+01:00;22,579
34;23/04/2019;?;Lime;Eight e-scooters from Lime, a Brisbane-based manufacturer, have their audio files swapped during a test in the streets of Brisbane.;Unknown;Not Found;Not Found;AU;https://www.hackread.com/watch-hackers-send-explicit-messages-hacked-e-scooter-riders/;Paolo Passeri;2019-05-16T11:26:57+01:00;22,579
35;24/04/2019;LulzSec Italia;archivi-sias.it (National Archives from the Italian Ministry of Cultural Heritage and Activities);Hackers from LulzSec Italia dump more than 5,000 credentials from the National Archives of the Italian Ministry of Cultural Heritage and Activities.;SQLi;Not Found;Not Found;IT;https://www.lastampa.it/2019/04/24/tecnologia/hacker-attaccano-gli-archivi-di-stato-pi-di-mila-password-rubate-7s2AZBVmrtzrrZO0t2OSxM/pagina.html;Paolo Passeri;2019-05-16T11:26:57+01:00;22,579
36;24/04/2019;?;French Users of Microsoft Games and Services;French users of Microsoft games and services are the victim of malicious ads that redirect them to scam surveys, polls, or other unwanted promotions.;Account Hijacking;Not Found;Not Found;FR;https://www.bleepingcomputer.com/news/microsoft/french-users-of-microsoft-games-and-sites-hit-with-scam-ads/;Paolo Passeri;2019-05-16T11:26:57+01:00;22,579
37;24/04/2019;?;Single Individuals;Researchers from Proofpoint discover a phishing campaign served from GitHub.;Account Hijacking;Not Found;Not Found;>1;https://www.bleepingcomputer.com/news/security/github-service-abused-by-attackers-to-host-phishing-kits/;Paolo Passeri;2019-05-16T11:26:57+01:00;22,579
38;24/04/2019;?;Banking Customers;Researchers from Jask uncover a phishing campaign dropping the Qbot banking Trojan with the help of delivery emails camouflaging as replies to previous conversations.;Account Hijacking;Not Found;Not Found;>1;https://www.bleepingcomputer.com/news/security/qbot-malware-dropped-via-context-aware-phishing-campaign/;Paolo Passeri;2019-05-16T11:26:57+01:00;22,579
39;24/04/2019;Gamareddon;Ukraine Ministry Of Defense;Security researchers at Yoroi-Cybaze ZLab uncover a new campaign carried out by the Russian state-actor dubbed Gamaredon targeting Military personnel in Ukraine.;Targeted Attack;Not Found;Not Found;UA;https://securityaffairs.co/wordpress/84430/apt/gamaredon-ukrainian-mod-campaign.html;Paolo Passeri;2019-05-16T11:26:57+01:00;22,579
40;24/04/2019;?;Scott County Schools;Scott County Schools announce that the district was the victim of a $3.7 million online scam, when an undisclosed vendor told the district it never was paid for an invoice.;Account Hijacking;Not Found;Not Found;US;https://www.databreaches.net/ky-scott-county-schools-victim-of-3-7-million-scam/;Paolo Passeri;2019-05-16T11:26:57+01:00;22,579
41;24/04/2019;?;Doctors’ Management Services (DMS);Doctors’ Management Services (DMS) reveals to have been struck with GandCrab ransomware on Christmas Eve last year, possibly exposing the PII of its clients’ patients.;Malware;Not Found;Not Found;US;https://www.scmagazine.com/home/security-news/ransomware/gandcrab-ransomware-strikes-doctors-management-services/;Paolo Passeri;2019-05-16T11:26:57+01:00;22,579
42;24/04/2019;?;Delta Dental;Delta Dental discloses a security incident affecting an unspecified number of their insured members and dependents. An employee had fallen prey to a phishing attack between December 21 and December 28 last year. ;Account Hijacking;Not Found;Not Found;US;https://www.databreaches.net/illinois-dental-insurer-notifies-members-after-phishing-attack/;Paolo Passeri;2019-05-16T11:26:57+01:00;22,579
43;25/04/2019;China?;Hong Kong branch of Amnesty International ;The Hong Kong branch of human rights group Amnesty International reveal it was targeted by state-sponsored hackers in a cyberattack “consistent with those carried out by hostile groups linked to the Chinese government”.;Targeted Attack;Not Found;Not Found;HK;https://www.scmp.com/news/hong-kong/law-and-crime/article/3007736/london-based-human-rights-group-amnesty-international;Paolo Passeri;2019-05-16T11:26:57+01:00;22,579
44;25/04/2019;?;Docker;An unauthorized person gain access to a Docker Hub database that exposed sensitive information for approximately 190,000 users. This information included some usernames and hashed passwords, as well as tokens for GitHub and Bitbucket repositories.;Unknown;Not Found;Not Found;US;https://www.bleepingcomputer.com/news/security/docker-hub-database-hack-exposes-sensitive-data-of-190k-users/;Paolo Passeri;2019-05-16T11:26:57+01:00;22,579
45;25/04/2019;?;Users in Germany and Italy;Researchers from Cisco Talos reveal the details of a campaign distributing the GootKit (aka talalpek or Xswkit) banking Trojan with the help of a multi-stage malware loader dubbed JasperLoader.;Malware;Not Found;Not Found;>1;https://www.bleepingcomputer.com/news/security/europeans-hit-with-multi-stage-malware-loader-via-signed-malspam/;Paolo Passeri;2019-05-16T11:26:57+01:00;22,579
46;25/04/2019;?;Chase Bank Customers;A new phishing scam targeting Chase bank customers is discovered that not only asks for personal information, but also requests that the victim uploads a selfie of himself holding his ID or driver license.;Account Hijacking;Not Found;Not Found;US;https://www.bleepingcomputer.com/news/security/devious-chase-bank-phishing-scam-asks-for-selfies/;Paolo Passeri;2019-05-16T11:26:57+01:00;22,579
47;25/04/2019;?;Bank Customers;Researchers from Trend Micro discover a new Emotet Trojan variant, with the added capabilities of using compromised connected devices as proxy command-and-control servers and of employing random URI directory paths to evade network-based detection rules.;Malware;Not Found;Not Found;>1;https://www.bleepingcomputer.com/news/security/emotet-uses-compromised-devices-as-proxy-command-servers/;Paolo Passeri;2019-05-16T11:26:57+01:00;22,579
48;25/04/2019;TA505;Undisclosed Financial Institution;Researchers from Cybereason discover a spear phishing campaign targeting a financial institution, and installing a sophisticated backdoor called ServHelper to take over the network.;Account Hijacking;Not Found;Not Found;N/A;https://www.bleepingcomputer.com/news/security/ta505-spear-phishing-campaign-uses-lolbins-to-avoid-detection/;Paolo Passeri;2019-05-16T11:26:57+01:00;22,579
49;25/04/2019;Two Unnamed Brazilian Hackers;Cartoon Network;Cartoon Network websites in at least 16 countries/regions are hacked to play videos of Arabic memes and a Brazilian male stripper, among other things.;Platform Vulnerability;Not Found;Not Found;US;https://www.zdnet.com/article/cartoon-network-websites-hacked-to-show-arabic-memes-and-brazilian-male-stripper/;Paolo Passeri;2019-05-16T11:26:57+01:00;22,579
50;25/04/2019;?;Single Individuals;Researchers from Palo Alto Networks reveal to have taken down more than 15,000 GoDaddy subdomains that were being used as part of a spam operation that lured users on web pages selling fake products.;Malspam;Not Found;Not Found;>1;https://www.zdnet.com/article/godaddy-takes-down-15000-subdomains-used-for-online-scams/;Paolo Passeri;2019-05-16T11:26:57+01:00;22,579
51;25/04/2019;?;Vulnerable WordPress Sites;"Researchers from Sucuri discover a new campaign targeting two vulnerable WordPress Plugins: Download WP Inventory Manager, and 
Woocommerce User Email Verification.";Vulnerable WordPress Plugins;Not Found;Not Found;>1;https://blog.sucuri.net/2019/04/plugins-added-to-malicious-campaign.html;Paolo Passeri;2019-05-16T11:26:57+01:00;22,579
52;26/04/2019;?;University of Alaska;The University of Alaska notifies potentially affected students and individuals after an investigation into a data privacy incident involving potential unauthorized access to certain UA email accounts, occurred in February 2018.;Account Hijacking;Not Found;Not Found;US;https://www.prnewswire.com/news-releases/university-of-alaska---notice-of-data-breach-300839171.html;Paolo Passeri;2019-05-16T11:26:57+01:00;22,579
53;26/04/2019;?;Vulnerable Magento Sites;Researchers from Malwarebytes discover a mew Magecart campaign targeting over 200 e-commerce sites, and hosting the skimmer on GitHub.;Malicious Script Injection;Not Found;Not Found;>1;https://blog.malwarebytes.com/cybercrime/2019/04/github-hosted-magecart-skimmer-used-against-hundreds-of-e-commerce-sites/;Paolo Passeri;2019-05-16T11:26:57+01:00;22,579
54;26/04/2019;?;Single Individuals;Researchers discover a web site pushing a PC cleaner tool for Windows, dubbed G-Cleaner, which in reality is just a front for the Azorult password and information stealing Trojan.;Malware;Not Found;Not Found;>1;https://www.bleepingcomputer.com/news/security/fake-windows-pc-cleaner-drops-azorult-info-stealing-trojan/;Paolo Passeri;2019-05-16T11:26:57+01:00;22,579
55;26/04/2019;?;Vulnerable Atlassian Confluence Servers;Researchers from Trend Micro reveal that an Atlassian Confluence Server (CVE-2019-3396) vulnerability is being exploited to compromise both Linux and Windows servers, allowing to drop GandCrab ransomware and the Dofloo (aka AES.DDoS, Mr. Black) Trojan.;Atlassian Confluence Vulnerability (CVE-2019-3396);Not Found;Not Found;>1;https://www.bleepingcomputer.com/news/security/vulnerable-confluence-servers-get-infected-with-ransomware-trojans/;Paolo Passeri;2019-05-16T11:26:57+01:00;22,579
56;26/04/2019;?;Woodruff Arts Center;The Woodruff Arts Center says it is investigating a security breach after a massive network outage, allegedly caused by ransomware.;Malware;Not Found;Not Found;US;https://www.databreaches.net/security-breach-shuts-down-network-for-woodruff-arts-center-high-museum/;Paolo Passeri;2019-05-16T11:26:57+01:00;22,579
57;26/04/2019;?;Sugar-Salem School District 322;A ransomware attack takes down servers at Sugar-Salem School District 322.;Malware;Not Found;Not Found;US;https://www.databreaches.net/id-ransomware-takes-down-servers-at-sugar-salem-school-district-322/;Paolo Passeri;2019-05-16T11:26:57+01:00;22,579
58;27/04/2019;?;Johnson Newspaper Corp.;A Ryuk cyber attack takes down the data infrastructure of Johnson Newspaper Corp.;Malware;Not Found;Not Found;US;https://www.databreaches.net/ny-north-country-newspaper-group-faces-ryuk-attack-but-is-it-second-attack-or-just-more-of-the-first/;Paolo Passeri;2019-05-16T11:26:57+01:00;22,579
59;28/04/2019;?;Cleveland Hopkins International Airport;Cleveland Hopkins International Airport reveals to have been hit by a ransomware attack.;Malware;Not Found;Not Found;US;https://www.forbes.com/sites/leemathews/2019/04/28/ransomware-hits-yet-another-u-s-airport/#4d88a87e461c;Paolo Passeri;2019-05-16T11:26:57+01:00;22,579
60;29/04/2019;?;McDonald's Canada;Users of a McDonald's app in Canada are having their accounts hijacked by hackers who are using the accounts to order food for themselves, racking up bills in excess of CAD $2,000.;Account Hijacking;Not Found;Not Found;CA;https://www.businessinsider.com/mcdonalds-mymcds-app-users-swindled-thousands-canada-2019-4?IR=T;Paolo Passeri;2019-05-16T11:26:57+01:00;22,579
61;29/04/2019;?;Saint Ambrose Catholic Parish;Hackers steal $1.75 million from the Saint Ambrose Catholic Parish following a successful BEC attack which was discovered on April 17 after payments related to the church's Vision 2020 project were not received by a contractor.;Account Hijacking;Not Found;Not Found;US;https://www.bleepingcomputer.com/news/security/175-million-stolen-by-crooks-in-church-bec-attack/;Paolo Passeri;2019-05-16T11:26:57+01:00;22,579
62;29/04/2019;?;Users of the popular Electrum Bitcoin wallet;Researchers from Malwarebytes reveal that the attackers behind the campaigns against Electrum Bitcoin wallet users are now launching DDoS attacks in response to Electrum efforts to protect the infrastructure, utilizing the ElectrumDoSMiner malware.;DDoS;Not Found;Not Found;>1;https://blog.malwarebytes.com/cybercrime/2019/04/electrum-ddos-botnet-reaches-152000-infected-hosts/;Paolo Passeri;2019-05-16T11:26:57+01:00;22,579
63;29/04/2019;?;Puma Australia;Puma Australia is the latest victim of a Magecart attack.;Malicious Script Injection;Not Found;Not Found;AU;https://www.cnet.com/news/puma-australia-shoppers-hit-with-credit-card-hack-researcher-says/;Paolo Passeri;2019-05-16T11:26:57+01:00;22,579
64;29/04/2019;?;SkyMed;A detailed list or 137,000 SkyMed members accounts is found, on March 27th, into an unsecured Elasticsearch database. The leak also shows evidence of ransomware inside the network.;Malware;Not Found;Not Found;US;https://securitydiscovery.com/skymed/;Paolo Passeri;2019-05-16T11:26:57+01:00;22,579
65;30/04/2019;?;Citycomp GMBH;Citycomp GMBH is hacked. The attackers claim to have stolen 312,570 files (over 516GBb of information). Targets include Ericsson, Leica, Toshiba, UniCredit, British Telecom, Hugo Boss, NH Hotel Group, Oracle, Airbus, Porsche, and Volkswagen.;Unknown;Not Found;Not Found;DE;https://www.vice.com/en_us/article/d3np4y/hackers-steal-ransom-citycomp-airbus-volkswagen-oracle-valuable-companies;Paolo Passeri;2019-05-16T11:26:57+01:00;22,579
66;30/04/2019;OilRig;98 Organizations worldwide;The leak of the Iran-linked OilRig Threat Actor reveals that the group stole 13,000 passwords from 98,000 organizations worldwide.;Targeted Attack;Not Found;Not Found;>1;https://www.forbes.com/sites/thomasbrewster/2019/04/30/leak-reveals-irans-wildest-hacker-crew-stole-13000-passwords-from-across-98-organizations/#6592e1e57c41;Paolo Passeri;2019-05-16T11:26:57+01:00;22,579
67;30/04/2019;?;Grid operations in parts of the western United States;A report posted by the Department of Energy indicates that a DoS attack interrupted grid operations in parts of the western United States on March 5.;DoS;Not Found;Not Found;US;https://www.eenews.net/stories/1060242741/;Paolo Passeri;2019-05-16T11:26:57+01:00;22,579
68;30/04/2019;?;Vulnerable Oracle WebLogic servers;Researchers from Cisco Talos reveal that a recently disclosed vulnerability in Oracle WebLogic (CVE-2019-2725) is being exploited to install the Sodinokibi ransomware.;Malware;Not Found;Not Found;>1;https://blog.talosintelligence.com/2019/04/sodinokibi-ransomware-exploits-weblogic.html;Paolo Passeri;2019-05-16T11:26:57+01:00;22,579
