id;date;author;target;description;attack;target_class;attack_class;country;link;author_report;date_report;views
68;12/12/2019;?;countries including Kuwait, Thailand, India, Bangladesh, the United Arab Emirates, Brazil, and Pakistan.;Researchers from Trend Micro reveal the details of a monero crypto mining campaign against targets across countries including Kuwait, Thailand, India, Bangladesh, the United Arab Emirates, Brazil, and Pakistan, using a dropper leveraging process hollowing to go undetected.;Malware;X Individual;CC;>1;https://www.zdnet.com/article/monero-miners-can-lurk-undetected-through-new-process-hollowing-technique/;Paolo Passeri;2020-01-07T14:37:15+00:00;23,629
69;12/12/2019;?;GoSport et Courir;GoSport et Courir is hit by a ransomware attack. 2 out of 84 shops are closed as a consequence of the attack.;Malware;G Wholesale and retail trade;CC;FR;https://www.zataz.com/gosport-et-courir-sous-les-coups-dun-ransomware/;Paolo Passeri;2020-01-07T14:37:15+00:00;23,629
70;12/12/2019;?;Vulnerable IoT devices;A new version of the Echobot botnet is discovered, exploiting 77 RCE flaws.;Multiple Vulnerabilities;Y Multiple Industries;CC;>1;https://www.bleepingcomputer.com/news/security/new-echobot-variant-exploits-77-remote-code-execution-flaws/;Paolo Passeri;2020-01-07T14:37:15+00:00;23,629
71;12/12/2019;?;Telegram Users in Russia;Researchers from Group-IB reveal that in recent weeks, more than a dozen Russian entrepreneurs have seen their Telegram accounts hacked, in attacks that may have ramifications for anyone using the messaging app.;Account Hijacking;X Individual;CE;RU;https://www.forbes.com/sites/thomasbrewster/2019/12/12/mystery-russian-telegram-hacks-intercept-secret-codes-to-spy-on-messages/?ss=cybersecurity#3a3789242c7c;Paolo Passeri;2020-01-07T14:37:15+00:00;23,629
72;12/12/2019;?;Baton Rouge Community College;Baton Rouge Community College servers and computers are shut down following a ransomware attack.;Malware;P Education;CC;US;https://www.infosecurity-magazine.com/news/louisiana-college-struck-by/;Paolo Passeri;2020-01-07T14:37:15+00:00;23,629
73;12/12/2019;?;City of Sugarland;The City of Sugarland joins the list of the victims of the Click2Gov breach.;Malicious Script Injection;O Public administration and defence, compulsory social security;CC;US;https://www.databreaches.net/another-click2gov-victim-is-revealed-in-texas/;Paolo Passeri;2020-01-07T14:37:15+00:00;23,629
74;12/12/2019;?;City of Odessa;The city of Odessa notifies residents of the Click2Gov breach.;Malware;O Public administration and defence, compulsory social security;CC;US;https://www.databreaches.net/tx-city-of-odessa-notifies-residents-of-click2gov-breach/;Paolo Passeri;2020-01-07T14:37:15+00:00;23,629
75;13/12/2019;?;City of New Orleans;The city of New Orleans is hit with a ransomware attack. All employees are immediately alerted to power down computers, unplug devices & disconnect from the city's WiFi.;Malware;O Public administration and defence, compulsory social security;CC;US;https://www.zdnet.com/article/new-orleans-hit-by-ransomware-city-employees-told-to-turn-off-computers/;Paolo Passeri;2020-01-07T14:37:15+00:00;23,629
76;13/12/2019;?;Love Bonito;Love Bonito reports a data breach, with personal and credit card information potentially accessed. The company discovered a malicious code being added to their e-commerce site on 10 Dec.;Malicious Script Injection;G Wholesale and retail trade;CC;SG;https://mustsharenews.com/love-bonito-data-breach/;Paolo Passeri;2020-01-07T14:37:15+00:00;23,629
77;13/12/2019;?;Keybase;Keybase announces the closure of its free Lumens (XLM) cryptocurrency drop scheme due to an influx of spam accounts.;Spam accounts;V Fintech;CC;US;https://www.zdnet.com/article/spammers-force-keybase-to-stop-stellar-space-drop-cryptocurrency-handouts/;Paolo Passeri;2020-01-07T14:37:15+00:00;23,629
78;13/12/2019;?;Single Individuals;Researchers from Cofense discover a new Emotet campaign uses Christmas-themed emails to entice users to open the malicious attachment.;Malware;K Financial and insurance activities;CC;>1;https://www.bleepingcomputer.com/news/security/emotet-trojan-is-inviting-you-to-a-malicious-christmas-party/;Paolo Passeri;2020-01-07T14:37:15+00:00;23,629
79;11/12/2019;?;Rooster Teeth Productions;Rooster Teeth Productions notifies to have suffered a data breach that allowed attackers to steal credit card and other payment information from shoppers on the company's online store. The breach was discovered on December 2nd.;Malicious Script Injection;R Arts entertainment and recreation;CC;US;https://www.bleepingcomputer.com/news/security/attackers-steal-credit-cards-in-rooster-teeth-data-breach/;Paolo Passeri;2020-01-07T14:37:15+00:00;23,629
80;13/12/2019;?;Vimly Benefit Solutions;Vimly Benefit Solutions says that it is mailing letters to some of its customers whose information may have been compromised as part of a phishing attempt.;Account Hijacking;M Professional scientific and technical activities;CC;US;https://www.govtech.com/security/Data-Breach-May-Have-Compromised-Police-Firefighter-Info.html;Paolo Passeri;2020-01-07T14:37:15+00:00;23,629
81;14/12/2019;FIN8;Gas stations and gas pumps in North America;Payments processor VISA says North American merchants who operate gas stations and gas pumps are facing a rash of attacks from cybercrime groups wanting to deploy point-of-sale (POS) malware on their networks.;PoS Malware;G Wholesale and retail trade;CC;US;https://www.zdnet.com/article/visa-warns-of-pos-malware-incidents-at-gas-pumps-across-north-america/;Paolo Passeri;2020-01-07T14:37:15+00:00;23,629
82;15/12/2019;APT27;Iran;Iran telecommunications minister announces that for the second time in a week, the country has foiled a cyber attack against its infrastructure allegedly carried out by APT27.;Targeted attack;O Public administration and defence, compulsory social security;CE;IR;https://securityaffairs.co/wordpress/95169/apt/iran-foiled-2-attack.html;Paolo Passeri;2020-01-07T14:37:15+00:00;23,629
83;15/12/2019;?;Hackensack Meridian Health;The largest hospital in New Jersey, the Hackensack Meridian Health, reveals it was the victim of a ransomware attack that disrupted its network, and also that the IT staff decided to pay the ransom to restore the files. ;Malware;Q Human health and social work activities;CC;US;https://securityaffairs.co/wordpress/95152/cyber-crime/new-jersey-hospital-ransomware-attack.html;Paolo Passeri;2020-01-07T14:37:15+00:00;23,629
1;27/10/2019;?;National Veterinary Associates (NVA);National Veterinary Associates (NVA), a California company that owns more than 700 animal care facilities around the globe, is hit by a ransomware attack.;Malware;M Professional scientific and technical activities;CC;US;https://krebsonsecurity.com/2019/11/ransomware-bites-400-veterinary-hospitals/;Paolo Passeri;2019-12-16T12:52:52+00:00;23,760
2;11/11/2019;?;Sag Harbor’s Pierson High School;Sag Harbor’s Pierson High School is hit by a ransomware attack.;Malware;P Education;CC;US;https://www.databreaches.net/sag-harbor-school-computers-impacted-by-ransomware-attack/;Paolo Passeri;2019-12-16T12:52:52+00:00;23,760
3;15/11/2019;?;Single individuals;A new Trojan, SectopRAT, appears in the wild and it's able to launch a hidden secondary desktop to control browser sessions on infected machines.  ;Malware;X Individual;CC;>1;https://www.zdnet.com/article/new-sectoprat-malware-creates-hidden-second-desktop-to-control-browser-sessions/;Paolo Passeri;2019-12-16T12:52:52+00:00;23,760
4;17/11/2019;?;Liver Wellness;Liver Wellness, writes to customers to inform them that the company's email account had been hacked.;Account hijacking;Q Human health and social work activities;CC;IE;https://www.databreaches.net/ie-liver-patients-exposed-in-data-breach/;Paolo Passeri;2019-12-16T12:52:52+00:00;23,760
5;18/11/2019;?;Louisiana State Government;A ransomware infection takes down 79 IT systems and websites managed by the Louisiana state government. Targets include: the Office of the Governor, Louisiana State Legislature, Office of Motor Vehicles, Department of Corrections, the Louisiana Division of Administration, the Department of Transportation & Development, and more.;Malware;O Public administration and defence, compulsory social security;CC;US;https://www.zdnet.com/article/ransomware-hits-louisiana-state-government-systems/;Paolo Passeri;2019-12-16T12:52:52+00:00;23,760
6;18/11/2019;Phineas Fisher;Cayman National Bank (Isle of Man) Limited;The Cayman National Bank (Isle of Man) Limited confirms to have been hacked by Phineas Fisher back in 2016;Unknown;K Financial and insurance activities;H;IM;https://www.vice.com/en_ca/article/ne8p9b/offshore-bank-targeted-phineas-fisher-confirms-hack-cayman-national-bank;Paolo Passeri;2019-12-16T12:52:52+00:00;23,760
7;18/11/2019;?;CHU de Rouen;The University Hospital Centre (CHU) in Rouen is forced to abandon PCs after a ransomware attack.;Malware;Q Human health and social work activities;CC;FR;https://www.bbc.com/news/technology-50503841;Paolo Passeri;2019-12-16T12:52:52+00:00;23,760
8;18/11/2019;?;Monero users;The official website of the Monero cryptocurrency is compromised to deliver a malware-infected file that steals funds from account owners.;Malware;V Fintech;CC;N/A;https://www.zdnet.com/article/official-monero-website-compromised-with-malware-that-steals-funds/;Paolo Passeri;2019-12-16T12:52:52+00:00;23,760
9;18/11/2019;?;Windows and Linux systems;Researchers from Intezer discover ACBackdoor, a new multi-platform backdoor that infects Windows and Linux systems allowing the attackers to run malicious code and binaries on the compromised machines.;Malware;Y Multiple Industries;CC;>1;https://www.bleepingcomputer.com/news/security/linux-windows-users-targeted-with-new-acbackdoor-malware/;Paolo Passeri;2019-12-16T12:52:52+00:00;23,760
10;18/11/2019;?;Single individuals;New email campaigns are underway that pretend to be Thanksgiving Day greeting cards and office closing notices with last minute invoices, but in reality distributing malware.;Malicious Spam;X Individual;CC;US;https://www.bleepingcomputer.com/news/security/beware-of-thanksgiving-ecard-emails-distributing-malware/;Paolo Passeri;2019-12-16T12:52:52+00:00;23,760
11;18/11/2019;?;Single individuals;A new spam campaign is spotted distributing the Buran Ransomware through IQY file.;Malicious Spam;X Individual;CC;>1;https://www.bleepingcomputer.com/news/security/buran-ransomware-infects-pcs-via-microsoft-excel-web-queries/;Paolo Passeri;2019-12-16T12:52:52+00:00;23,760
12;19/11/2019;?;US automotive industry;The FBI warns private industry partners of incoming cyberattacks against the US automotive industry targeting sensitive corporate and enterprise data.;Targeted Attack;C Manufacturing;CC;US;https://edition.cnn.com/2019/11/20/politics/fbi-us-auto-industry-hackers/index.html;Paolo Passeri;2019-12-16T12:52:52+00:00;23,760
13;19/11/2019;?;Twitter account of Arron Banks, the founder of the pro-Brexit campaign Leave.EU;The Twitter account of Arron Banks, the founder of the pro-Brexit campaign Leave.EU, is hacked. The attackers leak thousands of his private messages.;Account hijacking;X Individual;CC;UK;https://www.bbc.com/news/technology-50474626;Paolo Passeri;2019-12-16T12:52:52+00:00;23,760
14;19/11/2019;?;Single individuals;Researchers from Trustwave discover a flawed campaign distributing the Cyborg ransomware from GitHub.;Malware;X Individual;CC;>1;https://www.darkreading.com/threat-intelligence/attacker-mistake-botches-cyborg-ransomware-campaign/d/d-id/1336410;Paolo Passeri;2019-12-16T12:52:52+00:00;23,760
15;19/11/2019;?;EpicBot;A leak containing data for about 800,000 accounts on RuneScape bot provider EpicBot, is dumped online.;Unknown;R Arts entertainment and recreation;CC;N/A;https://arstechnica.com/information-technology/2019/11/password-data-dumped-online-for-2-2-million-users-of-currency-and-gaming-sites/;Paolo Passeri;2019-12-16T12:52:52+00:00;23,760
16;20/11/2019;APT33;Manufacturers, suppliers, or maintainers of industrial control system;Researchers from Microsoft reveal a new campaign by APT33 targeting the physical control systems used in electric utilities, manufacturing, and oil refineries.;Malware;C Manufacturing;CE;>1;https://www.wired.com/story/iran-apt33-industrial-control-systems/;Paolo Passeri;2019-12-16T12:52:52+00:00;23,760
17;20/11/2019;?;Vulnerable Webmin servers;Researchers from Qihoo 360 reveal the details of Roboto, a P2P botnet targeting Linux servers running vulnerable Webmin apps.;Webmin vulnerability;Y Multiple Industries;CC;>1;https://www.zdnet.com/article/new-roboto-botnet-emerges-targeting-linux-servers-running-webmin/;Paolo Passeri;2019-12-16T12:52:52+00:00;23,760
18;20/11/2019;?;Single individuals;Researchers from Cybereason reveal that a new keylogger called Phoenix is now linked to more than 10,000 infections.;Malware;X Individual;CC;>1;https://www.zdnet.com/article/new-phoenix-keylogger-tries-to-stop-over-80-security-products-to-avoid-detection/;Paolo Passeri;2019-12-16T12:52:52+00:00;23,760
19;20/11/2019;?;Victims in Latin America;Researchers from ESET discover Mispadu, a new banking Trojan distributed via malvertising and malspam campaigns using fake McDonald’s coupons as lures.;Malware;K Financial and insurance activities;CC;>1;https://www.bleepingcomputer.com/news/security/new-banking-trojan-infects-victims-via-mcdonald-s-malvertising/;Paolo Passeri;2019-12-16T12:52:52+00:00;23,760
20;20/11/2019;?;Chicopee Public Schools;Chicopee Public Schools computers are hit by a Ryuk ransomware attack.;Malware;P Education;CC;US;https://www.databreaches.net/ma-chicopee-school-computers-servers-hit-by-ransomware/;Paolo Passeri;2019-12-16T12:52:52+00:00;23,760
21;21/11/2019;Belgium;ISIS;According to the Belgian Police, a cyberattack takes down 26,000 accounts tied to the Islamic State, on social networks, websites and communication channels.;Unknown;U Activities of extraterritorial organizations and bodies;CW;N/A;https://www.brusselstimes.com/all-news/belgium-all-news/80427/major-belgian-cyberattack-eliminates-islamic-states-presence-on-the-internet/;Paolo Passeri;2019-12-16T12:52:52+00:00;23,760
22;21/11/2019;Lambert AKA Longhorn;A private company,  in Central Europe, and dozens of computers in the Middle East.;"Researchers from ESET discover DePriMon a malware downloader using the novel ""Port Monitor"" methods that have not been detected before in active campaigns, to drop the ColoredLambert malware.";Targeted Attack;Y Multiple Industries;CE;>1;https://www.zdnet.com/article/deprimon-downloader-uses-novel-ways-to-infect-your-pc-with-coloredlambert-malware/;Paolo Passeri;2019-12-16T12:52:52+00:00;23,760
23;21/11/2019;?;Edenred;Payment solutions giant Edenred reveals in a statement that a malware incident affected an undisclosed number of its computing systems.;Malware;K Financial and insurance activities;CC;FR;https://www.bleepingcomputer.com/news/security/edenred-payment-solutions-giant-announces-malware-incident/;Paolo Passeri;2019-12-16T12:52:52+00:00;23,760
24;21/11/2019;?;Allied Universal;Allied Universal is hit by the Maze ransomware and has some of the stolen data leaked.;Malware;M Professional scientific and technical activities;CC;US;https://www.bleepingcomputer.com/news/security/allied-universal-breached-by-maze-ransomware-stolen-data-leaked/;Paolo Passeri;2019-12-16T12:52:52+00:00;23,760
25;21/11/2019;?;Single individuals;Researchers from Malwarebytes reveal a new malicious campaign stealing credit card data via rogue payment service platform.;Account hijacking;X Individual;CC;>1;https://www.bleepingcomputer.com/news/security/card-skimmer-group-replaces-checkout-page-to-steal-payment-info/;Paolo Passeri;2019-12-16T12:52:52+00:00;23,760
26;21/11/2019;?;The City of Dothan;The City of Dothan is another victim of the Click2Gov breach.;Malicious Script Injection;O Public administration and defence, compulsory social security;CC;US;https://www.databreaches.net/yet-another-city-reports-a-click2gov-breach/;Paolo Passeri;2019-12-16T12:52:52+00:00;23,760
27;21/11/2019;?;Southern First Nations Network of Care;Southern First Nations Network of Care is hit by a ransomware attack.;Malware;P Education;CC;CA;https://www.databreaches.net/ca-ransomwares-latest-victim-a-child-welfare-authority/;Paolo Passeri;2019-12-16T12:52:52+00:00;23,760
28;21/11/2019;?;Ferguson Medical Group (FMG) ;Ferguson Medical Group (FMG) reveals to have been hit with a ransomware attack on September 20th.;Malware;Q Human health and social work activities;CC;US;https://www.databreaches.net/mo-saint-francis-healthcare-announces-ransomware-incident-involving-ferguson-medical-group-not-all-records-recovered/;Paolo Passeri;2019-12-16T12:52:52+00:00;23,760
29;22/11/2019;Golden Falcon (AKA APT-C-34);Kazakhstan;Researchers from Qihoo 360 publish a report exposing an extensive operation targeting the country of Kazakhstan, and directed against government agencies, military personnel, researchers, journalists, private companies, the educational sector, religious figures, government dissidents, and foreign diplomats alike.;Targeted Attack;O Public administration and defence, compulsory social security;CE;KZ;https://www.zdnet.com/article/extensive-hacking-operation-discovered-in-kazakhstan/;Paolo Passeri;2019-12-16T12:52:52+00:00;23,760
30;22/11/2019;?;T-Mobile;The US branch of telecommunications giant T-Mobile discloses a security breach that impacted a small number of customers of its prepaid service. The company said its cybersecurity team discovered and shut down malicious, unauthorized access to some information related to T-Mobile prepaid wireless accounts.;Unknown;J Information and communication;CC;US;https://www.zdnet.com/article/t-mobile-discloses-security-breach-impacting-prepaid-customers/;Paolo Passeri;2019-12-16T12:52:52+00:00;23,760
31;22/11/2019;?;OnePlus;OnePlus discloses a security breach that impacted users of its online store. The breach, caused by an undisclosed vulnerability, occurred last week and saw attackers gaining access to past customer orders.;Undisclosed vulnerability;C Manufacturing;CC;CN;https://www.zdnet.com/article/smartphone-maker-oneplus-discloses-data-breach/;Paolo Passeri;2019-12-16T12:52:52+00:00;23,760
32;22/11/2019;?;Livingston School District;Livingston School District is hit by ransomware.;Malware;P Education;CC;US;https://www.usnews.com/news/best-states/new-jersey/articles/2019-11-25/new-jersey-school-district-hit-with-ransomware-attack;Paolo Passeri;2019-12-16T12:52:52+00:00;23,760
33;22/11/2019;?;Single individuals;A new version of the Clop CryptoMix Ransomware is discovered, attempting to disable Windows Defender as well as remove the Microsoft Security Essentials and Malwarebytes' standalone Anti-Ransomware programs.;Malware;X Individual;CC;>1;https://www.bleepingcomputer.com/news/security/clop-ransomware-tries-to-disable-windows-defender-malwarebytes/;Paolo Passeri;2019-12-16T12:52:52+00:00;23,760
34;22/11/2019;?;Church’s Chicken;Church’s Chicken investigates a possible data breach involving credit and debit card information at some of its company owned locations in the U.S.;PoS Malware;I Accommodation and food service activities;CC;US;https://www.databreaches.net/churchs-chicken-probes-data-security-breach-at-company-owned-sites/;Paolo Passeri;2019-12-16T12:52:52+00:00;23,760
35;23/11/2019;China;Belgium;"Belgium’s trade mission to China suffers a ""massive cyber-attack."" China State Security is indicated as the possible culprit.  ";Unknown;O Public administration and defence, compulsory social security;CE;BE;https://www.vrt.be/vrtnws/en/2019/11/23/belgian-trade-mission-suffers-massive-attack-in-china/;Paolo Passeri;2019-12-16T12:52:52+00:00;23,760
36;23/11/2019;?;Virtual Care Provider Inc. (VCPI);Virtual Care Provider Inc., providing  technology services to more than 100 nursing homes, is hold hostage of a ransomware after the company couldn't afford a $14 million ransom demand.;Malware;M Professional scientific and technical activities;CC;US;https://eu.jsonline.com/story/news/local/2019/11/23/milwaukee-firm-falls-victim-hackers-100-plus-nursing-homes-affected/4285213002/;Paolo Passeri;2019-12-16T12:52:52+00:00;23,760
37;23/11/2019;?;Catch Hospitality Group;Catch Hospitality Group discloses that PoS systems at Catch NYC, Catch Rooftop, and Catch Steak were infected with malware that allowed attackers to steal credit card information from customers.;PoS Malware;I Accommodation and food service activities;CC;US;https://www.bleepingcomputer.com/news/security/catch-restaurants-disclose-credit-card-stealing-malware-incident/;Paolo Passeri;2019-12-16T12:52:52+00:00;23,760
38;23/11/2019;?;Banking users;A new version of the Trickbot banking trojan is discovered, and it's able to steal OpenSSH private keys and OpenVPN passwords and configuration files.;Malware;K Financial and insurance activities;CC;>1;https://www.bleepingcomputer.com/news/security/trickbot-trojan-getting-ready-to-steal-openssh-and-openvpn-keys/;Paolo Passeri;2019-12-16T12:52:52+00:00;23,760
39;24/11/2019;?;Exposed Docker platforms;Researching from Bad Packets reveal that a hacking group is currently mass-scanning the internet looking for Docker platforms that have API endpoints exposed online.;Docker misconfiguration;Y Multiple Industries;CC;>1;https://www.zdnet.com/article/a-hacking-group-is-hijacking-docker-systems-with-exposed-api-endpoints/;Paolo Passeri;2019-12-16T12:52:52+00:00;23,760
40;24/11/2019;?;New York City Police Department;The New York Post reveals that the New York City Police Department’s fingerprint database was hit with ransomware in October 2018.;Malware;O Public administration and defence, compulsory social security;CC;US;https://www.scmagazine.com/home/security-news/ransomware/nypd-fingerprint-database-touched-by-ransomware/;Paolo Passeri;2019-12-16T12:52:52+00:00;23,760
41;24/11/2019;?;Waterloo Catholic District School Board;The Waterloo Catholic District School Board is hit by a ransomware attack.;Malware;P Education;CC;CA;https://www.databreaches.net/significant-malware-attack-hits-waterloo-catholic-district-school-board-social-sharing/;Paolo Passeri;2019-12-16T12:52:52+00:00;23,760
42;25/11/2019;?;Great Plains Health;Great Plains Health medical center is hit by a ransomware and forces switching to pen and paper to maintain activity.;Malware;Q Human health and social work activities;CC;US;https://www.bleepingcomputer.com/news/security/ransomware-locks-medical-records-at-great-plains-health/;Paolo Passeri;2019-12-16T12:52:52+00:00;23,760
43;25/11/2019;?;Android users;A new strain of an Android mobile banking trojan called Ginp is discovered, shifting its focus on stealing credit card details.;Malware;X Individual;CC;>1;https://www.bleepingcomputer.com/news/security/ginp-android-banker-sets-as-default-sms-app-steals-all-text/;Paolo Passeri;2019-12-16T12:52:52+00:00;23,760
44;25/11/2019;?;Single individuals;Researchers from Cofense discover a new campaign distributing the Raccoon malware and using Dropbox to evade detection.;Malware;X Individual;CC;>1;https://securityaffairs.co/wordpress/94339/malware/raccoon-stealer-evasion-technique.html;Paolo Passeri;2019-12-16T12:52:52+00:00;23,760
45;26/11/2019;Multiple threat actors;Users in 149 countries;Google reveals to have sent more than 12,000 security warnings to users in 149 countries about email attacks coming from a government-backed hacking groups.;Targeted Attack;Y Multiple Industries;CE;>1;https://www.zdnet.com/article/in-just-three-months-google-sent-12k-warnings-about-government-backed-attacks/;Paolo Passeri;2019-12-16T12:52:52+00:00;23,760
46;26/11/2019;?;Multiple targets;Researchers from Microsoft detail a new malware strain that has been infecting Windows computers since October 2018 to hijack their resources to mine cryptocurrency. Named Dexphot, the malware reached its peak in mid-June this year, when its botnet reached almost 80,000 infected computers.;Malware;Y Multiple Industries;CC;>1;https://www.zdnet.com/article/microsoft-says-new-dexphot-malware-infected-more-than-80000-computers/;Paolo Passeri;2019-12-16T12:52:52+00:00;23,760
47;26/11/2019;?;Single individuals;A new ransomware called DeathRansom emerges in the landscape.;Malware;X Individual;CC;>1;https://www.bleepingcomputer.com/news/security/new-deathransom-ransomware-begins-to-make-a-name-for-itself/;Paolo Passeri;2019-12-16T12:52:52+00:00;23,760
48;26/11/2019;?;On the Border;On the Border, a border-style Mexican food chain notifies a data breach in a payment-processing system serving restaurants in 28 states. Some customer credit card information could have been compromised on visits between April 10 and August 10, 2019.;PoS Malware;I Accommodation and food service activities;CC;US;https://www.darkreading.com/attacks-breaches/on-the-border-warns-of-data-breach/d/d-id/1336467;Paolo Passeri;2019-12-16T12:52:52+00:00;23,760
49;26/11/2019;FIN7;DiBella’s Old Fashioned Submarine;DiBella’s Old Fashioned Submarines reveals that its stores in Connecticut, Indiana, Michigan, Ohio, New York and Pennsylvania may have had the information on as many as 305,000 payment cards compromised between March 22, 2018 and December 28, 2018.;PoS Malware;I Accommodation and food service activities;CC;US;https://www.scmagazine.com/home/security-news/data-breach/fin7-behind-dibellas-data-breach-affecting-305000-cards/;Paolo Passeri;2019-12-16T12:52:52+00:00;23,760
50;26/11/2019;?;Victims in Russia, Ukraine, Belarus and Kazakhstan;Researchers from ESET discover a new variant of the Stantinko botnet, adding a Monero cryptomining module to its arsenal.;Malware;X Individual;CC;>1;https://www.scmagazine.com/home/security-news/cybercrime/stantinko-botnets-monetization-strategy-shifts-to-cryptomining/;Paolo Passeri;2019-12-16T12:52:52+00:00;23,760
