id;date;author;target;description;attack;target_class;attack_class;country;link;author_report;date_report;views
1;15/02/2020;?;EMCOR Group;EMCOR Group, a Fortune 500 company specialized in engineering and industrial construction services, discloses a Ryuk ransomware incident that took down some of its IT systems.;Malware;C Manufacturing;CC;US;https://www.zdnet.com/article/ryuk-ransomware-hits-fortune-500-company-emcor/;Paolo Passeri;2020-03-30T10:48:31+01:00;3,361
2;21/02/2020;?;Coinhako;Coinhako is hit by a sophisticated attack.;Unknown;V Fintech;CC;SG;https://twitter.com/coinhako/status/1233025365334822912;Paolo Passeri;2020-03-30T10:48:31+01:00;3,361
3;27/02/2020;?;Okex and Bitfinex;Okex and Bitfinex suffered simultaneous distributed denial of service (DDoS);DDoS;V Fintech;CC;"US
 HK";https://cointelegraph.com/news/crypto-exchanges-okex-and-bitfinex-suffer-simultaneous-ddos-attacks;Paolo Passeri;2020-03-30T10:48:31+01:00;3,361
4;27/02/2020;Kimsuky;South Korean officials;Researchers from IssueMakersLab reveal that a group of North Korean hackers embedded malware inside documents detailing South Korea's response to the COVID-19 epidemic. The embedded malware is BabyShark a backdoor previously utilized by a North Korean hacker group known as Kimsuky.;Targeted Attack;O Public administration and defence, compulsory social security;CE;KR;https://www.zdnet.com/article/state-sponsored-hackers-are-now-using-coronavirus-lures-to-infect-their-targets/;Paolo Passeri;2020-03-30T10:48:31+01:00;3,361
5;29/02/2020;Digileaker;Digitex;A hacker dubbed Digileaker claims to have stolen the data related to 8,000 Digitex users.;Unknown;V Fintech;CC;SC;https://cointelegraph.com/news/digileaker-claims-to-have-stolen-kyc-documents-for-8-000-digitex-users;Paolo Passeri;2020-03-30T10:48:31+01:00;3,361
6;01/03/2020;?;Visser Precision;Visser Precision, parts maker for space and defense contractors confirms a DoppelPaymer ransomware attack.;Malware;C Manufacturing;CC;US;https://techcrunch.com/2020/03/01/visser-breach/;Paolo Passeri;2020-03-30T10:48:31+01:00;3,361
7;01/03/2020;?;Community Development Bank;Community Development Bank becomes the latest victim of the Maze ransomware team.;Malware;K Financial and insurance activities;CC;US;https://www.databreaches.net/texas-bank-attacked-with-doppelpaymer-ransomware-attackers-report/;Paolo Passeri;2020-03-30T10:48:31+01:00;3,361
8;02/03/2020;?;City of Novi Sad;The City of Novi Sad in Serbia is hit by the PwndLocker ransomware.;Malware;O Public administration and defence, compulsory social security;CC;RS;https://www.bleepingcomputer.com/news/security/new-pwndlocker-ransomware-targeting-us-cities-enterprises/;Paolo Passeri;2020-03-30T10:48:31+01:00;3,361
9;02/03/2020;?;Spartanburg School District One;Spartanburg School District One is hit with a ransomware attack.;Malware;P Education;CC;US;https://www.msn.com/en-us/news/crime/spartanburg-county-school-district-one-computer-network-issues-due-to-ransomware/ar-BB10DUEB;Paolo Passeri;2020-03-30T10:48:31+01:00;3,361
10;02/03/2020;APT34;Lebanon Government;Researchers from Cybaze-Yoroi ZLab discover a new campaign targeting the Lebanon government via the Karkoff implant.;Targeted Attack;O Public administration and defence, compulsory social security;CE;LB;https://securityaffairs.co/wordpress/98802/apt/karkoff-malware-lebanon.html;Paolo Passeri;2020-03-30T10:48:31+01:00;3,361
11;02/03/2020;?;Large number of French critical infrastructure firms;A large number of French critical infrastructure firms appear to have been hacked as part of an extended malware campaign.;Malware;D Electricity gas steam and air conditioning supply;CC;FR;https://krebsonsecurity.com/2020/03/french-firms-rocked-by-kasbah-hacker/;Paolo Passeri;2020-03-30T10:48:31+01:00;3,361
12;02/03/2020;"Egypt?
 India?";"Saudi Arabia
 UAE";"Facebook removes hundreds of accounts and pages used in ""Operation Red Card"", a deceptive campaign that appears to be from Egyptian and Indian marketing firms, to post anti-Saudi and anti-Emirati content.";Fake Social Network Groups/Pages;O Public administration and defence, compulsory social security;CW;"SA
 AE";https://www.cnet.com/news/facebook-pulls-down-hundreds-of-fake-accounts-tied-to-marketing-firms-in-india-and-egypt/;Paolo Passeri;2020-03-30T10:48:31+01:00;3,361
13;02/03/2020;?;Tesco;Tesco issues new cards to 600,000 Clubcard account holders after a credential stuffing attack.;Credential Stuffing;G Wholesale and retail trade;CC;UK;https://www.bbc.com/news/technology-51710687;Paolo Passeri;2020-03-30T10:48:31+01:00;3,361
14;02/03/2020;?;Android users;Google addresses a high-severity flaw in MediaTek’s Command Queue driver that developers said affects millions of devices, and which has an exploit already circulating in the wild.;Android Vulnerability (CVE-2020-0032);X Individual;CC;>1;https://threatpost.com/mediatek-bug-actively-exploited-android/153408/;Paolo Passeri;2020-03-30T10:48:31+01:00;3,361
15;03/03/2020;CIA?;Chinese companies and government agencies;The Chinese company Qihoo 360 publishes a report accusing the CIA of hacking Chinese companies and government agencies for more than 11 years (from 2008 to 1019).;Targeted Attack;O Public administration and defence, compulsory social security;CE;CN;https://www.zdnet.com/article/chinese-security-firm-says-cia-hacked-chinese-targets-for-the-past-11-years/;Paolo Passeri;2020-03-30T10:48:31+01:00;3,361
16;03/03/2020;Molerats (AKA Gaza Hackers Team and Gaza Cybergang);Eight organizations in six different countries in the government, telecommunications, insurance and retail industries;Researchers from Palo Alto Unit 42 observe multiple instances of phishing attacks likely related to the threat group Molerats targeting eight organizations in six different countries in the government, telecommunications, insurance and retail industries;Targeted Attack;Y Multiple Industries;CE;>1;https://unit42.paloaltonetworks.com/molerats-delivers-spark-backdoor/;Paolo Passeri;2020-03-30T10:48:31+01:00;3,361
17;03/03/2020;?;J.Crew;"Clothing giant J.Crew says an unknown number of customers had their online accounts accessed “by an unauthorized party"" in or around April 2019.";Credential Stuffing;G Wholesale and retail trade;CC;US;https://techcrunch.com/2020/03/04/jcrew-unauthorized-accounts/;Paolo Passeri;2020-03-30T10:48:31+01:00;3,361
18;03/03/2020;Kimsuky;South Korea;Researchers from Cybaze-Yoroi ZLab discover a new campaign by the North Korea-linked APT group, Kimsuky, targeting South Korea.;Targeted Attack;O Public administration and defence, compulsory social security;CE;KR;https://securityaffairs.co/wordpress/98878/malware/kimsuky-apt-south-korea.html;Paolo Passeri;2020-03-30T10:48:31+01:00;3,361
19;03/03/2020;?;Four Queens Hotel and Casino and Binion’s Casino;Four Queens Hotel and Casino and Binion’s Casino are hit with a ransomware attack.;Malware;R Arts entertainment and recreation;CC;US;https://www.databreaches.net/casinos-in-las-vegas-hit-by-suspected-ransomware-attack/;Paolo Passeri;2020-03-30T10:48:31+01:00;3,361
20;04/03/2020;?;T-Mobile;"US telecommunications giant T-Mobile discloses a security breach that impacted both its employees and customers alike. The attackers gained access to ""certain T-Mobile employee email accounts, some of which contained account information for T-Mobile customers and employees.""";Account Hijacking;J Information and communication;CC;US;https://www.zdnet.com/article/t-mobile-says-hacker-gained-access-to-employee-email-accounts-user-data/;Paolo Passeri;2020-03-30T10:48:31+01:00;3,361
21;04/03/2020;?;Australian Defence;The Australian Signals Directorate (ASD reveals that a vulnerability in Citrix, could have been used by malicious actors to access a database of Australian Defence recruitment details.;Citrix Vulnerability (CVE-2019-19781);O Public administration and defence, compulsory social security;CE;AU;https://www.zdnet.com/article/citrix-vulnerability-used-for-potential-defence-recruitment-database-access/;Paolo Passeri;2020-03-30T10:48:31+01:00;3,361
22;04/03/2020;?;Boots;Boots suspends payments using loyalty points in shops and online after attempts to break into customers' accounts using stolen passwords.;Password-spray;G Wholesale and retail trade;CC;UK;https://www.bbc.co.uk/news/technology-51742079;Paolo Passeri;2020-03-30T10:48:31+01:00;3,361
23;04/03/2020;?;Single Individuals;Researchers from Fortinet discover a new campaign delivering the Lokibot malware and exploiting the COVID-19 fear.;Malware;X Individual;CC;>1;https://www.fortinet.com/blog/threat-research/attackers-taking-advantage-of-the-coronavirus-covid-19-media-frenzy.html;Paolo Passeri;2020-03-30T10:48:31+01:00;3,361
24;04/03/2020;?;Single Individuals;Researchers from Cofense discover an additional phishing campaign pushing fake messages from The Centers for Disease Control (CDC) stating that the coronavirus has “officially become airborne” and there “have been confirmed cases of the disease in your location.”;Account Hijacking;X Individual;CC;>1;https://threatpost.com/coronavirus-themed-cyberattacks-persists/153493/;Paolo Passeri;2020-03-30T10:48:31+01:00;3,361
25;04/03/2020;?;SIngle Individuals;Researchers from Cofense discover a phishing campaign, leveraging OneNote to bypass detection tools and download malware onto victims’ systems.;Account Hijacking;X Individual;CC;>1;https://threatpost.com/microsoft-onenote-sidestep-phishing-detection/153436/;Paolo Passeri;2020-03-30T10:48:31+01:00;3,361
26;05/03/2020;?;Carnival Corp.;Carnival Corp. announces that two of its most popular lines, Holland America and Princess Cruises, were hit by a phishing attack between April 11 and July 23, 2019.;Account Hijacking;R Arts entertainment and recreation;CC;US;https://www.cnbc.com/2020/03/05/how-to-protect-yourself-from-princess-cruise-and-holland-america-data-hack.html;Paolo Passeri;2020-03-30T10:48:31+01:00;3,361
27;05/03/2020;?;Communications & Power Industries (CPI);Communications & Power Industries (CPI) is still down after a ransomware attack suffered in January.;Malware;C Manufacturing;CC;US;https://techcrunch.com/2020/03/05/cpi-ransomware-defense-contractor/;Paolo Passeri;2020-03-30T10:48:31+01:00;3,361
28;05/03/2020;?;EVRAZ;EVRAZ, one of the world's largest steel manufacturers and mining operations, has its North American activities taken down by a Ryuk ransomware attack.;Malware;C Manufacturing;CC;US;https://www.zdnet.com/article/one-of-roman-abramovichs-companies-got-hit-by-ransomware/;Paolo Passeri;2020-03-30T10:48:31+01:00;3,361
29;05/03/2020;?;Banking users in Italy;Researchers from Sophos discover a new campaign distributing the Trickbot malware in Italy and exploiting the COVID-19 outbreak.;Malware;K Financial and insurance activities;CC;IT;https://nakedsecurity.sophos.com/2020/03/05/coronavirus-warning-spreads-computer-virus/;Paolo Passeri;2020-03-30T10:48:31+01:00;3,361
30;05/03/2020;?;Multiple targets;Researchers from Kaspersky discover a new campaign inviting victims to install malware in disguise of an expired certificate.;Malware;Y Multiple Industries;CC;>1;https://www.zdnet.com/article/backdoor-malware-is-being-spread-through-fake-security-certificate-alerts/;Paolo Passeri;2020-03-30T10:48:31+01:00;3,361
31;05/03/2020;Tonto Team;Multiple targets in Russia, Japan, and South Korea;Researchers from Cisco Talos reveal the detail of a new cyber espionage campaign carried out by the Tonto Team via the Bisonal RAT.;Targeted Attack;Y Multiple Industries;CE;>1;https://www.zdnet.com/article/chinese-hackers-use-decade-old-bisonal-trojan-to-strike-russian-targets/;Paolo Passeri;2020-03-30T10:48:31+01:00;3,361
32;05/03/2020;?;Chrome Users;Researchers at MyCrypto discover a malicious Chrome extension able to steal Ledger wallet recovery seeds.;Malicious Browser Extension;V Fintech;CC;>1;https://www.zdnet.com/article/malicious-chrome-extension-caught-stealing-ledger-wallet-recovery-seeds/;Paolo Passeri;2020-03-30T10:48:31+01:00;3,361
33;06/03/2020;?;The City of Durham and Durham County;The City of Durham and Durham County are hit by a Ryuk ransomware attack.;Malware;O Public administration and defence, compulsory social security;CC;US;https://www.forbes.com/sites/daveywinder/2020/03/10/two-russian-ransomware-attacks-take-down-north-carolina-city-and-county-government-systems/#55c26e4e588f;Paolo Passeri;2020-03-30T10:48:31+01:00;3,361
34;06/03/2020;?;Trident Crypto Fund;The usernames and passwords of more than a quarter of a million Trident Crypto Fund customers have been stolen and published online.;Unknown;V Fintech;CC;MA;https://cointelegraph.com/news/trident-crypto-fund-data-breach-266-000-passwords-stolen;Paolo Passeri;2020-03-30T10:48:31+01:00;3,361
35;06/03/2020;?;Entercom;US radio giant Entercom reports a data breach that took place in August 2019 after an unauthorized party was able to access database backup files stored in a third-party cloud hosting service and containing Radio.com user credentials.;Unknown;J Information and communication;CC;US;https://www.bleepingcomputer.com/news/security/entercom-radio-giant-says-data-breach-exposed-user-credentials/;Paolo Passeri;2020-03-30T10:48:31+01:00;3,361
36;06/03/2020;?;Koodo Mobile;Telus-owned Koodo Mobile suffers a data breach after their systems were hacked on February 13, 2020, and customer data from August and September 2017 was stolen by the attackers.;Account Hijacking;J Information and communication;CC;CA;https://www.bleepingcomputer.com/news/security/telus-owned-koodo-mobile-announces-data-breach-stolen-info-for-sale/;Paolo Passeri;2020-03-30T10:48:31+01:00;3,361
37;06/03/2020;?;Multiple targets;The US Federal Bureau of Investigation (FBI) warns private industry partners of threat actors abusing Microsoft Office 365 and Google G Suite as part of Business Email Compromise (BEC) attacks.;Business Email Compromise;Y Multiple Industries;CC;US;https://www.bleepingcomputer.com/news/security/fbi-warns-of-bec-attacks-abusing-microsoft-office-365-google-g-suite/;Paolo Passeri;2020-03-30T10:48:31+01:00;3,361
38;07/03/2020;?;SIngle Individuals;Researchers from MalwareHunterTeam discover another email campaign pretending to be Coronavirus (COVID-19) information from the World Health Organization (WHO), and in reality distributing a malware downloader that installs the FormBook information-stealing Trojan.;Malicious Spam;X Individual;CC;>1;https://www.bleepingcomputer.com/news/security/data-stealing-formbook-malware-preys-on-coronavirus-fears/;Paolo Passeri;2020-03-30T10:48:31+01:00;3,361
39;07/03/2020;?;Six Southeast Asian countries, including Malaysia and Singapore;Researchers from Technisanct discover hundreds of thousands of credit card details from at least six Southeast Asian countries, leaked online.;Unknown;K Financial and insurance activities;CC;>1;https://www.databreaches.net/singapore-malaysia-credit-card-details-dumped-online-in-massive-data-breach/;Paolo Passeri;2020-03-30T10:48:31+01:00;3,361
40;08/03/2020;?;Multiple targets;Researchers from Volexity reveal that state-sponsored hacking groups are using a recently disclosed Microsoft Exchange vulnerability (CVE-2020-0688) to attack targets. The same warning is sent also by the NSA.;Microsoft Vulnerability (CVE-2020-0688);Y Multiple Industries;CC;>1;https://www.forbes.com/sites/zakdoffman/2020/03/09/critical-microsoft-security-warning-hackers-now-attacking-targets-heres-what-you-do/#583360618814;Paolo Passeri;2020-03-30T10:48:31+01:00;3,361
41;08/03/2020;?;University of Kentucky and UK HealthCare;The University of Kentucky and UK HealthCare discovers that is suffered a malware attack aimed to install cryptominers.;Malware;P Education;CC;US;https://www.databreaches.net/computer-systems-at-university-of-kentucky-and-uk-healthcare-hobbled-by-massive-month-long-cyber-attack/;Paolo Passeri;2020-03-30T10:48:31+01:00;3,361
42;09/03/2020;?;ENTSO-E;The European Network of Transmission System Operators for Electricity (ENTSO-E), says that its IT network had been compromised in a “cyber intrusion.”;Unknown;D Electricity gas steam and air conditioning supply;N/A;EU;https://www.cyberscoop.com/european-entso-breach-fingrid/;Paolo Passeri;2020-03-30T10:48:31+01:00;3,361
43;09/03/2020;?;Russian users;"Researchers from MalwareHunterTeam discover a new phishing scam targeting Russian victims, and utilizing a ""customer service"" chatbot.";Account Hijacking;X Individual;CC;RU;https://www.bleepingcomputer.com/news/security/intricate-phishing-scam-uses-support-chatbot-to-assist-victims/;Paolo Passeri;2020-03-30T10:48:31+01:00;3,361
44;09/03/2020;?;Single Individuals;Researchers from IBM X-Force Threat Intelligence discover a new sextortion campaign, luring victims with emails promising to give access to the nude extortion pics of a friend's girlfriend, and delivering the Raccoon malware.;Malicious Spam;X Individual;CC;>1;https://www.bleepingcomputer.com/news/security/malware-spread-as-nude-extortion-pics-of-friends-girlfriend/;Paolo Passeri;2020-03-30T10:48:31+01:00;3,361
45;09/03/2020;?;TrueFire;The popular online guitar tutoring website TrueFire suffers a ‘Magecart‘ attack that might have exposed customers’ personal information and payment card data.;Malicious Script Injection;S Other service activities;CC;US;https://securityaffairs.co/wordpress/99875/hacking/truefire-magecart-attack.html;Paolo Passeri;2020-03-30T10:48:31+01:00;3,361
46;09/03/2020;?;Single Individuals;Researchers from security firm Reason discover a fake Coronavirus map, delivering the AZORult trojan.;Malware;X Individual;CC;>1;https://www.forbes.com/sites/zakdoffman/2020/03/11/warning-you-must-not-download-this-dangerous-coronavirus-map/#49a4f9263253;Paolo Passeri;2020-03-30T10:48:31+01:00;3,361
47;09/03/2020;?;Fort Worth Independent School District;The Fort Worth Independent School District is hit with a ransomware attack,;Malware;P Education;CC;US;https://www.databreaches.net/fort-worth-isd-hacked-joining-other-texas-schools-towns-hit-by-ransomware-attacks/;Paolo Passeri;2020-03-30T10:48:31+01:00;3,361
48;10/03/2020;Mustang Panda;Targets in Vietnam;Vietnamese cyber-security firm VinCSS detects a Chinese state-sponsored group (codenamed Mustang Panda) spreading emails with a RAR file attachment purporting to carry a message about the coronavirus outbreak from the Vietnamese Prime Minister.;Targeted Attack;Y Multiple Industries;CE;VN;https://www.zdnet.com/article/state-sponsored-hackers-are-now-using-coronavirus-lures-to-infect-their-targets/;Paolo Passeri;2020-03-30T10:48:31+01:00;3,361
49;10/03/2020;?;Multiple targets;Researchers from Cybereason discover a campaign where attackers are trojanizing multiple hacking tools with njRat, a well known RAT.;Malware;Y Multiple Industries;CC;>1;https://techcrunch.com/2020/03/09/hacking-the-hackers/;Paolo Passeri;2020-03-30T10:48:31+01:00;3,361
50;10/03/2020;?;Undisclosed organization in Asia;Researchers from Lastline discover a new campaign spreading the Paradise ransomware via IQY files.;Malware;Z Unknown;CC;N/A;https://www.zdnet.com/article/this-ransomware-campaign-has-just-returned-with-a-new-trick/;Paolo Passeri;2020-03-30T10:48:31+01:00;3,361
51;10/03/2020;?;Undisclosed target;Researchers from Cofense discover a phishing campaigns using YouTube redirects to evade security controls.;Account Hijacking;Z Unknown;CC;N/A;https://www.tripwire.com/state-of-security/featured/phishing-attacks-exploit-youtube-redirects/;Paolo Passeri;2020-03-30T10:48:31+01:00;3,361
52;10/03/2020;?;Multiple targets;Attackers start to exploit a recently discovered vulnerability on ManageEngine Desktop Central.;CVE-2020-10189 vulnerability;Y Multiple Industries;CC;>1;https://www.helpnetsecurity.com/2020/03/10/cve-2020-10189/;Paolo Passeri;2020-03-30T10:48:31+01:00;3,361
53;10/03/2020;?;Wichita State University;Wichita State University notifies 1,762 individuals whose personal information was accessed by hackers between December 3, 2019 and December 5, 2019.;Unknown;P Education;CC;US;https://www.databreaches.net/wichita-state-university-notifying-1762-iowans-whose-personal-info-was-accessed-by-hacker/;Paolo Passeri;2020-03-30T10:48:31+01:00;3,361
54;10/03/2020;?;Undisclosed company;A global company with an office in Perth is attacked by criminals who demand a $30 million ransom to unlock its computer system in Australia.;Malware;Z Unknown;CC;AU;https://www.databreaches.net/cyber-hackers-demand-30m-from-major-international-company-with-office-in-perth/;Paolo Passeri;2020-03-30T10:48:31+01:00;3,361
55;11/03/2020;?;Champaign-Urbana Public Health District;In the midst of a coronavirus pandemic, the Champaign-Urbana Public Health District is hit with a NetWalker ransomware attack.;Malware;Q Human health and social work activities;CC;US;https://www.news-gazette.com/news/local/health-care/c-u-public-health-district-s-website-held-hostage-by/article_2dadedcd-aadb-5cb1-8740-8bd9e8800e27.html;Paolo Passeri;2020-03-30T10:48:31+01:00;3,361
56;11/03/2020;?;Global insurance, healthcare, and pharmaceutical organizations;Researchers from Proofpoint discover a new phishing campaign impersonating Vanderbilt University Medical Center and sending out fake HIV test result emails.;Malicious Spam;Y Multiple Industries;CC;>1;https://www.bleepingcomputer.com/news/security/nasty-phishing-scam-pretends-to-be-your-hiv-test-results/;Paolo Passeri;2020-03-30T10:48:31+01:00;3,361
57;11/03/2020;?;Northeast Radiology;Northeast Radiology announces that on January 11, 2020, unauthorized individuals gained access to Northeast Radiology’s picture archiving and communication system (“PACS”),;Unknown;Q Human health and social work activities;CC;US;https://www.databreaches.net/northeast-radiology-notifies-patients-of-pacs-data-security-incident/;Paolo Passeri;2020-03-30T10:48:31+01:00;3,361
58;12/03/2020;?;Facebook Users;Facebook, Twitter and Instagram remove multiple accounts and pages for a coordinated inauthentic behavior on behalf in Ghana and Nigeria on behalf of individuals in Russia, targeting primarily the United States.;Fake Social Network Groups/Pages;X Individual;CW;US;https://www.forbes.com/sites/emmawoollacott/2020/03/13/russian-trolls-outsource-disinformation-campaigns-to-to-africa/#7a8c39b21a26;Paolo Passeri;2020-03-30T10:48:31+01:00;3,361
59;12/03/2020;?;Multiple targets;Researchers from MalwareHunterTeam discover a new campaign distributing a malware cocktail consisting of the Coronavirus Ransomware and the Kpot information-stealing Trojan.;Malware;Y Multiple Industries;CC;>1;https://www.bleepingcomputer.com/news/security/new-coronavirus-ransomware-acts-as-cover-for-kpot-infostealer/;Paolo Passeri;2020-03-30T10:48:31+01:00;3,361
60;12/03/2020;Vicious Panda;Public sector entity of Mongolia;Researchers from Check Point discover a campaign, dubbed Vicious Panda, carried out by a Chinese APT group on a public sector entity of Mongolia, leveraging the coronavirus pandemic.;Targeted Attack;O Public administration and defence, compulsory social security;CE;MN;https://www.forbes.com/sites/zakdoffman/2020/03/12/chinese-hackers-weaponized-coronavirus-data-to-launch-this-new-cyber-attack/#4b61c4cf3861;Paolo Passeri;2020-03-30T10:48:31+01:00;3,361
61;12/03/2020;?;Open Exchange Rates;Open Exchange Rates announces a data breach that exposed the personal information and salted and hashed passwords for customers of its API service. The breach occurred between February 9th, 2020, and March 2nd, 2020.;Unknown;M Professional scientific and technical activities;CC;US;https://www.bleepingcomputer.com/news/security/open-exchange-rates-data-breach-affects-users-of-well-known-orgs/;Paolo Passeri;2020-03-30T10:48:31+01:00;3,361
62;12/03/2020;Turla;Several high-profile Armenian websites;Researchers from ESET discover a watering hole operation targeting several high-profile Armenian websites via a fake Adobe Flash update, delivering two previously undocumented pieces of malware dubbed NetFlash and PyFlash.;Targeted Attack;O Public administration and defence, compulsory social security;CE;AM;https://www.bleepingcomputer.com/news/security/advanced-russian-hackers-use-new-malware-in-watering-hole-operation/;Paolo Passeri;2020-03-30T10:48:31+01:00;3,361
63;12/03/2020;?;Multiple targets;Researchers from IBM X-Force discover a new malware strain dubbed PXJ (AKA XVFXGW).;Malware;Y Multiple Industries;CC;>1;https://securityaffairs.co/wordpress/99696/malware/pxj-ransomware.html;Paolo Passeri;2020-03-30T10:48:31+01:00;3,361
64;13/03/2020;?;The National;The National, a Scottish newspaper, is hit by a DDoS attack.;DDoS;J Information and communication;CC;UK;https://www.thescottishsun.co.uk/news/5385146/newspaper-independence-china-cyber-attack/;Paolo Passeri;2020-03-30T10:48:31+01:00;3,361
65;13/03/2020;?;Brno University Hospital;The Brno University Hospital, a COVID-19 testing center, is hit by a cyberattack right in the middle of a COVID-19 outbreak.;Malware;Q Human health and social work activities;CC;CZ;https://www.zdnet.com/article/czech-hospital-hit-by-cyber-attack-while-in-the-midst-of-a-covid-19-outbreak/;Paolo Passeri;2020-03-30T10:48:31+01:00;3,361
66;13/03/2020;?;Android users;Researchers from Domaintools reveal the details of Covidlock, a ransomware encrypting data on Android devices.;Malware;X Individual;CC;>1;https://www.techrepublic.com/article/covidlock-ransomware-exploits-coronavirus-with-malicious-android-app/;Paolo Passeri;2020-03-30T10:48:31+01:00;3,361
67;13/03/2020;Ancient Tortoise;Multiple targets;Researchers from Agari reveal that the Ancient Tortoise Group is now starting using coronavirus-themed scam emails that take advantage of the COVID-19 global outbreak to convince potential victims to send payments to attacker-controlled accounts.;Business Email Compromise;Y Multiple Industries;CC;>1;https://www.bleepingcomputer.com/news/security/ancient-tortoise-bec-scammers-launch-coronavirus-themed-attack/;Paolo Passeri;2020-03-30T10:48:31+01:00;3,361
