id;date;author;target;description;attack;target_class;attack_class;country;link;author_report;date_report;views
1;16/03/2020;?;Avalon Health Care Management ;Avalon Health Care Management notifies 14,500 patients of a phishing incident occurred on March 16, 2020.;Account Hijacking;Q Human health and social work activities;CC;US;https://www.bleepingcomputer.com/news/security/hacker-group-backdoors-thousands-of-microsoft-sql-servers-daily/;Paolo Passeri					;2020-04-30T10:28:28+01:00;1,159
2;26/03/2020;Bassterlord;Indian State Tax Office;A hacker having the handle “Bassterlord”, claims to have Admin access to an Indian State Tax office’s network on a Russian hacking forum, ;Unknown;O Public administration and defence, compulsory social security;CC;IN;https://www.bleepingcomputer.com/news/security/hacker-group-backdoors-thousands-of-microsoft-sql-servers-daily/;Paolo Passeri					;2020-04-30T10:28:28+01:00;1,159
3;26/03/2020;?;Meadville Medical Center;Meadville Medical Center is hit with a malware attack.;Malware;Q Human health and social work activities;CC;US;https://www.bleepingcomputer.com/news/security/hacker-group-backdoors-thousands-of-microsoft-sql-servers-daily/;Paolo Passeri					;2020-04-30T10:28:28+01:00;1,159
4;27/03/2020;?;SBTech;SBTech is hit with a ransomware infection;Malware;R Arts entertainment and recreation;CC;MA;https://www.bleepingcomputer.com/news/security/hacker-group-backdoors-thousands-of-microsoft-sql-servers-daily/;Paolo Passeri					;2020-04-30T10:28:28+01:00;1,159
5;27/03/2020;?;Brandywine Urology Consultants;Brandywine Urology Consultants notify about a ransomware attack. The attack occurred on January 25, and the practice became aware of it on January 27.;Malware;Q Human health and social work activities;CC;US;https://www.bleepingcomputer.com/news/security/hacker-group-backdoors-thousands-of-microsoft-sql-servers-daily/;Paolo Passeri					;2020-04-30T10:28:28+01:00;1,159
6;30/03/2020;Maze;BetUS;Online gambling operator BetUS is the latest target of the Maze ransomware gang.;Malware;R Arts entertainment and recreation;CC;CW;https://www.bleepingcomputer.com/news/security/hacker-group-backdoors-thousands-of-microsoft-sql-servers-daily/;Paolo Passeri					;2020-04-30T10:28:28+01:00;1,159
7;31/03/2020;Nefilim;Cosan;The Nefilim Ransomware operators leak the data of Cosan, a Brazilian conglomerate producer of bioethanol, sugar and energy.;Malware;C Manufacturing;CC;BR;https://www.bleepingcomputer.com/news/security/hacker-group-backdoors-thousands-of-microsoft-sql-servers-daily/;Paolo Passeri					;2020-04-30T10:28:28+01:00;1,159
8;31/03/2020;?;Android users;Researchers from Bitdefender discover versions of the Android Zoom video-conferencing application repackaged with malware.;Malware;X Individual;CC;>1;https://www.bleepingcomputer.com/news/security/hacker-group-backdoors-thousands-of-microsoft-sql-servers-daily/;Paolo Passeri					;2020-04-30T10:28:28+01:00;1,159
9;01/04/2020;?;Several dozens hospitals;Microsoft issues a targeted warning to several dozen hospitals, alerting them to vulnerabilities in their VPN appliances after spotting a ransomware gang targeting them. ;Malware;Q Human health and social work activities;CC;US;https://www.bleepingcomputer.com/news/security/hacker-group-backdoors-thousands-of-microsoft-sql-servers-daily/;Paolo Passeri					;2020-04-30T10:28:28+01:00;1,159
10;01/04/2020;?;Multiple MS-SQL servers;Researchers from Guardicore lab reveal the details of Vollgar, a long-running attack campaign aiming to infect Windows machines running MS-SQL servers, and bruteforcing them to install cryptominers and RATs.;Brute-Force;Y Multiple Industries;CC;>1;https://www.bleepingcomputer.com/news/security/hacker-group-backdoors-thousands-of-microsoft-sql-servers-daily/;Paolo Passeri					;2020-04-30T10:28:28+01:00;1,159
11;01/04/2020;?;U.S. healthcare and higher education organizations;Researchers from Proofpoint discover a phishing campaign claiming that the Trump administration is considering sending most American adults a check to help stimulate the economy.;Account Hijacking;Q Human health and social work activities;CC;US;https://www.bleepingcomputer.com/news/security/microsoft-emotet-took-down-a-network-by-overheating-all-computers/;Paolo Passeri					;2020-04-30T10:28:28+01:00;1,159
12;01/04/2020;?;Single Individuals in Australia;Researchers from Proofpoint discover a new phishing campaign claiming to be sent by a major Australian newspaper and promoting tax benefits.;Account Hijacking;X Individual;CC;AU;https://www.bleepingcomputer.com/news/security/microsoft-emotet-took-down-a-network-by-overheating-all-computers/;Paolo Passeri					;2020-04-30T10:28:28+01:00;1,159
13;01/04/2020;?;Technology and IT organizations;Researchers from Proofpoint discover a new phishing campaign claiming to come from the World Health Organization (WHO) and the International Monetary Fund (IMF).;Account Hijacking;M Professional scientific and technical activities;CC;>1;https://www.bleepingcomputer.com/news/security/microsoft-emotet-took-down-a-network-by-overheating-all-computers/;Paolo Passeri					;2020-04-30T10:28:28+01:00;1,159
14;01/04/2020;?;Information security and technology organizations;Researchers from Proofpoint discover a new campaign attempting to steal user IDs, passwords, and credit card numbers via a fake COVID-19 cash claim.;Account Hijacking;M Professional scientific and technical activities;CC;US;https://www.bleepingcomputer.com/news/security/microsoft-emotet-took-down-a-network-by-overheating-all-computers/;Paolo Passeri					;2020-04-30T10:28:28+01:00;1,159
15;01/04/2020;?;Multiple organizations;"Another campaign discovered by Proofpoint, claims to provide ""COVID-19 reliefs measures"" from a major UK bank,";Account Hijacking;Y Multiple Industries;CC;SG;https://www.bleepingcomputer.com/news/security/microsoft-emotet-took-down-a-network-by-overheating-all-computers/;Paolo Passeri					;2020-04-30T10:28:28+01:00;1,159
16;01/04/2020;Maze;Berkine;The Maze ransomware group posts data from Berkine, a joint venture between Sonatrach, the state-owned oil company of Algeria, and the US firm formerly known as Anadarko Petroleum Corporation.;Malware;D Electricity gas steam and air conditioning supply;CC;DZ;https://www.bleepingcomputer.com/news/security/microsoft-emotet-took-down-a-network-by-overheating-all-computers/;Paolo Passeri					;2020-04-30T10:28:28+01:00;1,159
17;01/04/2020;Sodinokibi (AKA REvil) ;10x Genomics;10x Genomics notifies about a Sodinokibi ransomware attack.;Malware;Q Human health and social work activities;CC;US;https://www.bleepingcomputer.com/news/security/microsoft-emotet-took-down-a-network-by-overheating-all-computers/;Paolo Passeri					;2020-04-30T10:28:28+01:00;1,159
18;02/04/2020;?;Twitter Users;Twitter deletes 20,000 fake accounts linked to the governments of Serbia, Saudi Arabia, Egypt, Honduras and Indonesia, saying they violated company policy and were a “targeted attempt to undermine the public conversation”.;Fake Social Network Groups/Pages;X Individual;CW;>1;https://www.bleepingcomputer.com/news/security/microsoft-emotet-took-down-a-network-by-overheating-all-computers/;Paolo Passeri					;2020-04-30T10:28:28+01:00;1,159
19;02/04/2020;?;Individuals in the US;The Internal Revenue Service (IRS) issues a warning about a surge in coronavirus-related scams over email, phone calls, or social media requesting personal information.;Account Hijacking;X Individual;CC;US;https://www.bleepingcomputer.com/news/security/microsoft-emotet-took-down-a-network-by-overheating-all-computers/;Paolo Passeri					;2020-04-30T10:28:28+01:00;1,159
20;02/04/2020;?;Undisclosed target;Microsoft says that an Emotet infection was able to take down an organization's entire network by maxing out CPUs on Windows devices and bringing its Internet connection down to after one employee was tricked to open a phishing email attachment.;Malware;Z Unknown;CC;N/A;https://www.bleepingcomputer.com/news/security/microsoft-emotet-took-down-a-network-by-overheating-all-computers/;Paolo Passeri					;2020-04-30T10:28:28+01:00;1,159
21;02/04/2020;?;Single Individuals;Researchers from Inky discover a phishing campaign using reversed text to avoid detection.;Account Hijacking;Y Multiple Industries;CC;>1;https://www.bleepingcomputer.com/news/security/mozilla-patches-two-actively-exploited-firefox-zero-days/;Paolo Passeri					;2020-04-30T10:28:28+01:00;1,159
22;02/04/2020;?;Android Australian users;Researchers from Bitdefender uncover Mandrake, a new Android spying operation specifically targeting Australian users, active for at least four years.;Targeted Attack;X Individual;CE;AU;https://www.bleepingcomputer.com/news/security/mozilla-patches-two-actively-exploited-firefox-zero-days/;Paolo Passeri					;2020-04-30T10:28:28+01:00;1,159
23;02/04/2020;?;Single Individuals;Researchers from Fortinet discover a new Coronavirus-themed campaign using alleged messages from the World Health Organization (WHO) to deliver the LokiBot trojan.;Malicious Spam;X Individual;CC;>1;https://www.bleepingcomputer.com/news/security/mozilla-patches-two-actively-exploited-firefox-zero-days/;Paolo Passeri					;2020-04-30T10:28:28+01:00;1,159
24;02/04/2020;Magecart Group 7;19 e-commerce websites;Researchers from RiskIQ discover a new Magecart campaign able to compromise 19 e-commerce websites via a new MakeFrame skimmer.;Malicious Script Injection;G Wholesale and retail trade;CC;>1;https://www.bleepingcomputer.com/news/security/mozilla-patches-two-actively-exploited-firefox-zero-days/;Paolo Passeri					;2020-04-30T10:28:28+01:00;1,159
25;02/04/2020;?;Targets in China and Japan;Researchers at the JPCERT discover a campaign against targets in China and Japan exploiting CVE-2019-17026.;Targeted Attack;Y Multiple Industries;CE;"CN
JP";https://www.bleepingcomputer.com/news/security/mozilla-patches-two-actively-exploited-firefox-zero-days/;Paolo Passeri					;2020-04-30T10:28:28+01:00;1,159
26;02/04/2020;?;Facebook users;Facebook removes more than 300 fake accounts, pages and groups tied to France and Egypt, including some that posed as news outlets and shared content about various topics including the novel coronavirus.;Fake Social Network Groups/Pages;X Individual;CW;>1;https://www.bleepingcomputer.com/news/security/mozilla-patches-two-actively-exploited-firefox-zero-days/;Paolo Passeri					;2020-04-30T10:28:28+01:00;1,159
27;03/04/2020;?;Vulnerable Docker servers;Researchers from Aqua Security reveal that for the past few months, a malware operation has been scanning the internet for Docker servers running API ports exposed on the internet without a password, to install a new crypto-mining malware strain named Kinsing.;Misconfiguration;Y Multiple Industries;CC;>1;https://www.bleepingcomputer.com/news/security/mozilla-patches-two-actively-exploited-firefox-zero-days/;Paolo Passeri					;2020-04-30T10:28:28+01:00;1,159
28;03/04/2020;?;Elasticsearch servers;For the past two weeks, a hacker has been breaking into Elasticsearch servers that have been left open on the internet without a password and attempting to wipe their content.;Misconfiguration;Y Multiple Industries;CC;>1;https://www.bleepingcomputer.com/news/security/mozilla-patches-two-actively-exploited-firefox-zero-days/;Paolo Passeri					;2020-04-30T10:28:28+01:00;1,159
29;03/04/2020;?;Single Individuals;Researchers from Trend Micro discover a Zoom installer bundled with a cryptominer (Trojan.Win32.MOOZ.THCCABO).;Malware;X Individual;CC;>1;https://www.bleepingcomputer.com/news/security/mozilla-patches-two-actively-exploited-firefox-zero-days/;Paolo Passeri					;2020-04-30T10:28:28+01:00;1,159
30;03/04/2020;?;Unnamed targets;Mozilla patches two Firefox vulnerabilities (CVE-2020-6819 and  CVE-2020-6820) exploited in the wild for targeted attacks.;Targeted Attack;Y Multiple Industries;CC;>1;https://www.bleepingcomputer.com/news/security/mozilla-patches-two-actively-exploited-firefox-zero-days/;Paolo Passeri					;2020-04-30T10:28:28+01:00;1,159
31;03/04/2020;?;Discord users;Researchers from MalwareHunterTeam discover a new version of the AnarchyGrabber embedded with the Discord chat client.;Malware;X Individual;CC;>1;https://www.bleepingcomputer.com/news/security/nasa-under-significantly-increasing-hacking-phishing-attacks/;Paolo Passeri					;2020-04-30T10:28:28+01:00;1,159
32;03/04/2020;?;US Government;Criminals disrupt a Zoom meeting held at the highest levels of the US government, despite warnings against using the software.;Zoom bombing;O Public administration and defence, compulsory social security;CC;US;https://www.bleepingcomputer.com/news/security/nasa-under-significantly-increasing-hacking-phishing-attacks/;Paolo Passeri					;2020-04-30T10:28:28+01:00;1,159
33;03/04/2020;?;OGUsers;OGUsers, one of the most popular hacking forums on the internet, discloses  a security breach, the second such incident in the past year.;Unknown;U Activities of extraterritorial organizations and bodies;CC;N/A;https://www.bleepingcomputer.com/news/security/nasa-under-significantly-increasing-hacking-phishing-attacks/;Paolo Passeri					;2020-04-30T10:28:28+01:00;1,159
34;03/04/2020;?;Wolfe & Associates;Wolfe & Associates, Property Services discloses that an online database was compromised by cyber-criminals in a data breach that may have occurred as many as six months ago. ;Unknown;L Real estate activities;CC;US;https://www.bleepingcomputer.com/news/security/nasa-under-significantly-increasing-hacking-phishing-attacks/;Paolo Passeri					;2020-04-30T10:28:28+01:00;1,159
35;04/04/2020;?;Hospitals engaged in the COVID-19 response;INTERPOL cautions that it has detected a significant increase in ransomware cyber-attacks against hospitals around the world engaged in the COVID-19 response.;Malware;Q Human health and social work activities;CC;>1;https://www.bleepingcomputer.com/news/security/nasa-under-significantly-increasing-hacking-phishing-attacks/;Paolo Passeri					;2020-04-30T10:28:28+01:00;1,159
36;04/04/2020;?;Android users;A team of researchers exposes a secret group of at least 27 app developers, with 101 malicious apps in total for a combined 69 million installs.;Malware;X Individual;CC;>1;https://www.bleepingcomputer.com/news/security/nasa-under-significantly-increasing-hacking-phishing-attacks/;Paolo Passeri					;2020-04-30T10:28:28+01:00;1,159
37;05/04/2020;?;More than 200 of the world's largest CDNs;Traffic for more than 200 of the world's largest CDNs and cloud hosting providers is suspiciously redirected through Rostelecom, Russia's state-owned telecommunications provider. The incident affects more than 8,800 internet traffic routes from 200+ networks. Impacted companies include names such as Google, Amazon, Facebook, Akamai, Cloudflare, GoDaddy, Digital Ocean, Joyent, LeaseWeb, Hetzner, and Linode.;BGP Hijacking;Y Multiple Industries;CC;>1;https://www.bleepingcomputer.com/news/security/nasa-under-significantly-increasing-hacking-phishing-attacks/;Paolo Passeri					;2020-04-30T10:28:28+01:00;1,159
38;05/04/2020;NN Hacking Group;Email.it;The data of more than 600,000 Email.it users is currently being sold on the dark web. The breach allegedly occurred two years ago.;Unknown;J Information and communication;CC;IT;https://www.bleepingcomputer.com/news/security/nasa-under-significantly-increasing-hacking-phishing-attacks/;Paolo Passeri					;2020-04-30T10:28:28+01:00;1,159
39;05/04/2020;?;MNP;MNP, an accounting firm in Canada is hit by a ransomware attack.;Malware;K Financial and insurance activities;CC;CA;https://www.bleepingcomputer.com/news/security/nasa-under-significantly-increasing-hacking-phishing-attacks/;Paolo Passeri					;2020-04-30T10:28:28+01:00;1,159
40;06/04/2020;?;NASA;"NASA reveal to have seen  ""significantly increasing"" malicious activity from both nation-state hackers and cybercriminals targeting the US space agency's systems and personnel working from home during the COVID-19 pandemic.";>1;O Public administration and defence, compulsory social security;CE;US;https://www.bleepingcomputer.com/news/security/nasa-under-significantly-increasing-hacking-phishing-attacks/;Paolo Passeri					;2020-04-30T10:28:28+01:00;1,159
41;06/04/2020;?;Multiple targets;FBI's Internet Crime Complaint Center (IC3) issues a public service announcement warning of cybercriminals abusing popular cloud-based email services as part of Business Email Compromise (BEC) attacks.;Business Email Compromise;Y Multiple Industries;CC;US;https://www.databreaches.net/stockdale-radiologys-notification-may-confuse-readers/;Paolo Passeri					;2020-04-30T10:28:28+01:00;1,159
42;06/04/2020;DarkHotel;Chinese government agencies;Researchers from Qihoo 360 reveal that Foreign state-sponsored hackers have launched a massive hacking operation aimed at Chinese government agencies and their employees, exploiting a zero-day vulnerability in Sangfor SSL VPN servers.;Targeted Attack;O Public administration and defence, compulsory social security;CE;CN;https://www.databreaches.net/stockdale-radiologys-notification-may-confuse-readers/;Paolo Passeri					;2020-04-30T10:28:28+01:00;1,159
43;06/04/2020;?;Brazilian WhatsApp users;Researchers from Kaspersky reveal a 124% increase in phishing attacks as a result of WhatsApp messages with content relating to the pandemic.;Account Hijacking;X Individual;CC;BR;https://www.databreaches.net/stockdale-radiologys-notification-may-confuse-readers/;Paolo Passeri					;2020-04-30T10:28:28+01:00;1,159
44;06/04/2020;Ghost Squad;Governments of Australia, India, Pakistan, Thailand, and Zimbabwe;Hackers from Ghost Squad deface some official sites belonging to the governments of Australia, India, Pakistan, Thailand, and Zimbabwe.;Defacement;O Public administration and defence, compulsory social security;H;>1;https://www.databreaches.net/stockdale-radiologys-notification-may-confuse-readers/;Paolo Passeri					;2020-04-30T10:28:28+01:00;1,159
45;07/04/2020;?;Five APT groups;Researchers from BlackBerry discover that advanced hackers working in the interests of China have been attacking Linux targets with a lot of success and little to no detection in the past decade.;Targeted Attack;Y Multiple Industries;CE;>1;https://www.databreaches.net/stockdale-radiologys-notification-may-confuse-readers/;Paolo Passeri					;2020-04-30T10:28:28+01:00;1,159
46;07/04/2020;Energetic Bear (aka DragonFly, Crouching Yeti).;San Francisco International Airport;San Francisco International Airport (SFO) discloses a data breach after two of its websites, SFOConnect.com and SFOConstruction.com, were hacked during March 2020.;Malicious Script Injection;H Transportation and storage;CE;US;https://www.databreaches.net/stockdale-radiologys-notification-may-confuse-readers/;Paolo Passeri					;2020-04-30T10:28:28+01:00;1,159
47;07/04/2020;?;Individuals in the US;Researchers from Abnormal Security discover a malicious campaign where fraudsters are impersonating financial institutions to steal from Americans expecting stimulus checks from the US federal government. ;Account Hijacking;K Financial and insurance activities;CC;US;https://www.databreaches.net/stockdale-radiologys-notification-may-confuse-readers/;Paolo Passeri					;2020-04-30T10:28:28+01:00;1,159
48;07/04/2020;?;Single Individuals;"Researchers from Malwarebytes discover that malicious actors created a fake webpage that impersonates cybersecurity company and were using it as a gateway in a malvertising campaign designed to infect victims with the Raccoon information stealer.
";Malvertising;X Individual;CC;>1;https://www.databreaches.net/stockdale-radiologys-notification-may-confuse-readers/;Paolo Passeri					;2020-04-30T10:28:28+01:00;1,159
49;07/04/2020;FIN6 and the operators of the TrickBot;Multiple targets;Researchers from IBM X-Force reveal that two cybercriminal groups, FIN6 and the operators of the TrickBot malware, have paired up together to target several organizations with TrickBot’s malware framework called “Anchor.”;Malware;Y Multiple Industries;CC;>1;https://www.databreaches.net/stockdale-radiologys-notification-may-confuse-readers/;Paolo Passeri					;2020-04-30T10:28:28+01:00;1,159
50;07/04/2020;Maze;Stockdale Radiology;Stockdale Radiology confirms to have been hit by the Maze ransomware.;Malware;Q Human health and social work activities;CC;US;https://www.databreaches.net/stockdale-radiologys-notification-may-confuse-readers/;Paolo Passeri					;2020-04-30T10:28:28+01:00;1,159
51;07/04/2020;?;EVERSANA;EVERSANA, a global commercial services provider to healthcare entities, discloses a phishing attack that occurred between April 1 and July 3, 2019.;Account Hijacking;M Professional scientific and technical activities;CC;US;https://www.forbes.com/sites/zakdoffman/2020/04/09/why-android-users-must-now-dodge-this-simple-15-minute-coronavirus-malware-threat/#1762c0b74c1d;Paolo Passeri					;2020-04-30T10:28:28+01:00;1,159
52;08/04/2020;?;Multiple targets;A joint alert by the U.K. National Cyber Security Centre (NCSC) and the Department of Homeland Security (DHS) U.K. warns about COVID-19 scams, revealing a list of 2,500 coronavirus-themed threats.;>1;Y Multiple Industries;CC;>1;https://www.forbes.com/sites/zakdoffman/2020/04/09/why-android-users-must-now-dodge-this-simple-15-minute-coronavirus-malware-threat/#1762c0b74c1d;Paolo Passeri					;2020-04-30T10:28:28+01:00;1,159
53;08/04/2020;?;Multiple servers;Researchers from Netlab 360 reveal the details of the last version of DDG, a Monero-mining botnet P2P-based.;Malware;Y Multiple Industries;CC;>1;https://www.forbes.com/sites/zakdoffman/2020/04/09/why-android-users-must-now-dodge-this-simple-15-minute-coronavirus-malware-threat/#1762c0b74c1d;Paolo Passeri					;2020-04-30T10:28:28+01:00;1,159
54;08/04/2020;?;Vianet;Hackers manage to access the database of Vianet and steal the details of more than 160,000 current and former users;Unknown;J Information and communication;CC;NP;https://www.forbes.com/sites/zakdoffman/2020/04/09/why-android-users-must-now-dodge-this-simple-15-minute-coronavirus-malware-threat/#1762c0b74c1d;Paolo Passeri					;2020-04-30T10:28:28+01:00;1,159
55;08/04/2020;?;Vulnerable IoT devices;Researchers from Bitdefender discover Dark_Nexus, a destructive new botnet that compromises vulnerable IoT devices to carry out DDoS attacks.;Multiple Vulnerabilities;Y Multiple Industries;CC;>1;https://www.forbes.com/sites/zakdoffman/2020/04/09/why-android-users-must-now-dodge-this-simple-15-minute-coronavirus-malware-threat/#1762c0b74c1d;Paolo Passeri					;2020-04-30T10:28:28+01:00;1,159
56;08/04/2020;?;Bisq;Cryptocurrency exchange Bisq halts trading following a cyberattack leading to the theft of $250,000 worth of virtual currency from users. ;Vulnerability;V Fintech;CC;N/A;https://www.forbes.com/sites/zakdoffman/2020/04/09/why-android-users-must-now-dodge-this-simple-15-minute-coronavirus-malware-threat/#1762c0b74c1d;Paolo Passeri					;2020-04-30T10:28:28+01:00;1,159
57;08/04/2020;?;Cisco Webex users;Researchers from Cofense discover a new phishing campaign using a fake Cisco “critical security advisory” in a new phishing campaign aimed at stealing victims’ Webex credentials.;Account Hijacking;X Individual;CC;>1;https://www.forbes.com/sites/zakdoffman/2020/04/09/why-android-users-must-now-dodge-this-simple-15-minute-coronavirus-malware-threat/#1762c0b74c1d;Paolo Passeri					;2020-04-30T10:28:28+01:00;1,159
58;08/04/2020;?;Multiple targets;Microsoft warns that cyber-criminals are preying on people’s vulnerable psychological states during the COVID-19 pandemic to attack businesses via phishing attacks.;Account Hijacking;Y Multiple Industries;CC;>1;https://www.forbes.com/sites/zakdoffman/2020/04/09/why-android-users-must-now-dodge-this-simple-15-minute-coronavirus-malware-threat/#1762c0b74c1d;Paolo Passeri					;2020-04-30T10:28:28+01:00;1,159
59;09/04/2020;?;Government of North Rhine-Westphalia;The government of North Rhine-Westphalia, a province in western Germany, is believed to have lost tens of millions of euros through a phishing operation mimicking a website built to distribute COVID-19 aid.;Account Hijacking;O Public administration and defence, compulsory social security;CC;DE;https://www.forbes.com/sites/zakdoffman/2020/04/09/why-android-users-must-now-dodge-this-simple-15-minute-coronavirus-malware-threat/#1762c0b74c1d;Paolo Passeri					;2020-04-30T10:28:28+01:00;1,159
60;09/04/2020;?;Android users;Check Point’s researchers discover 16 different malicious apps masquerading as legitimate coronavirus apps, which contain a range of malware aimed at stealing users’ sensitive information or generating fraudulent revenues.;Malware;X Individual;CC;>1;https://www.forbes.com/sites/zakdoffman/2020/04/09/why-android-users-must-now-dodge-this-simple-15-minute-coronavirus-malware-threat/#1762c0b74c1d;Paolo Passeri					;2020-04-30T10:28:28+01:00;1,159
61;09/04/2020;?;E-Commerce sites powered by WordPress;Researchers from Sucuri discover a dedicated Javascript skimmer targeting WordPress e-commerce sites powered by WooCommerce.;Malicious Script Injection;Y Multiple Industries;CC;>1;https://www.scmagazine.com/home/security-news/cybercrime/compromised-email-account-leads-to-saint-francis-ministries-data-breach/;Paolo Passeri					;2020-04-30T10:28:28+01:00;1,159
62;09/04/2020;?;Single Individuals;A large email extortion campaign is underway telling recipients that their computer was hacked and that a video was taken through the hacked computer's webcam.;Malicious Spam;X Individual;CC;>1;https://www.scmagazine.com/home/security-news/cybercrime/compromised-email-account-leads-to-saint-francis-ministries-data-breach/;Paolo Passeri					;2020-04-30T10:28:28+01:00;1,159
