id;date;author;target;description;attack;target_class;attack_class;country;link;author_report;date_report;views
45;09/05/2019;Lab Dookhtegam;"MuddyWater
Rana Institute";Two new leaks exposing Iranian cyber-espionage operations are published via Telegram, the Dark Web and the Internet. One claims to contain data from the MuddyWater group, while the second leak exposes a new group identified as the Rana Institute.;Unknown;Not Found;Not Found;IR;https://www.databreaches.net/ny-episcopal-health-services-notice-of-data-privacy-event/;Paolo Passeri					;2019-05-28T14:15:25+01:00;25,968
46;09/05/2019;?;WIRED;Condé Nast notifies about 1,100 WIRED subscribers of a breach involving their payment information, when an unauthorized party accessed a third-party vendor’s systems between April 14 and April 17, 2019.;Unknown;Not Found;Not Found;US;https://www.databreaches.net/ny-episcopal-health-services-notice-of-data-privacy-event/;Paolo Passeri					;2019-05-28T14:15:25+01:00;25,968
47;10/05/2019;?;Single Individuals;Researchers discover an adware bundles installing a fake VPN software called Pirate Chick, which then connects to a remote server to download and install malicious payloads such the AZORult password-stealing Trojan.;Malware;Not Found;Not Found;>1;https://www.databreaches.net/ny-episcopal-health-services-notice-of-data-privacy-event/;Paolo Passeri					;2019-05-28T14:15:25+01:00;25,968
48;10/05/2019;?;Pacers Sports & Entertainment (PSE);Pacers Sports & Entertainment (PSE), the legal entity behind the Indiana Pacers and the Indiana Fever NBA and WNBA basketball teams, announces a security breach during which hackers gained access to sensitive user information via a phishing attack.;Account Hijacking;Not Found;Not Found;US;https://www.databreaches.net/ny-episcopal-health-services-notice-of-data-privacy-event/;Paolo Passeri					;2019-05-28T14:15:25+01:00;25,968
49;10/05/2019;?;The Southeastern Council on Alcoholism and Drug Dependence, Inc. (“SCADD”);The Southeastern Council on Alcoholism and Drug Dependence, Inc. (“SCADD”) provides notice of a ransomware attack affecting 25,148 patients.;Malware;Not Found;Not Found;US;https://www.databreaches.net/ny-episcopal-health-services-notice-of-data-privacy-event/;Paolo Passeri					;2019-05-28T14:15:25+01:00;25,968
50;10/05/2019;?;Episcopal Health Services;Episcopal Health Services warn of a data breach due to a suspicious activity in employee email accounts between August 28, 2018 and October 5, 2018. ;Account Hijacking;Not Found;Not Found;US;https://www.databreaches.net/ny-episcopal-health-services-notice-of-data-privacy-event/;Paolo Passeri					;2019-05-28T14:15:25+01:00;25,968
51;10/05/2019;?;American Medical Collection Agency;A data breach involving a medical collection agency affects more than 200,000 patients who had used the firm’s online payment portal between September, 2018 and the beginning of March, 2019. The data is found on the dark web.;Unknown;Not Found;Not Found;US;https://www.scmagazine.com/home/security-news/data-breach/boost-mobile-was-hit-with-a-breach-which-affected-an-unknown-number-of-customer-accounts/;Paolo Passeri					;2019-05-28T14:15:25+01:00;25,968
52;11/05/2019;?;Multiple Targets;Multiple reports by different security organizations (including AT&T Alien Labs and the Saudi and Canadian Cyber Security Centers)  indicate an active exploitation of the CVE-2019-0604 vulnerability in Microsoft Sharepoint.;Targeted Attack;Not Found;Not Found;>1;https://www.scmagazine.com/home/security-news/data-breach/boost-mobile-was-hit-with-a-breach-which-affected-an-unknown-number-of-customer-accounts/;Paolo Passeri					;2019-05-28T14:15:25+01:00;25,968
53;11/05/2019;?;FirstBank;FirstBank cancels debit cards because of what the bank described as a “possible external security” incident that affected the bank. ;Unknown;Not Found;Not Found;VI;https://www.scmagazine.com/home/security-news/data-breach/boost-mobile-was-hit-with-a-breach-which-affected-an-unknown-number-of-customer-accounts/;Paolo Passeri					;2019-05-28T14:15:25+01:00;25,968
54;12/05/2019;?;Picreel;Hackers breach the analytics service Picreel and embed malicious code on over 1,200 websites.;Malicious Script Injection;Not Found;Not Found;US;https://www.scmagazine.com/home/security-news/data-breach/boost-mobile-was-hit-with-a-breach-which-affected-an-unknown-number-of-customer-accounts/;Paolo Passeri					;2019-05-28T14:15:25+01:00;25,968
55;12/05/2019;?;Alpaca Forms;Hackers breach the Cloud CMS managed CDN and modify one of the Alpaca Form scripts to inject malicious code in over 3,400 sites.;Malicious Script Injection;Not Found;Not Found;US;https://www.scmagazine.com/home/security-news/data-breach/boost-mobile-was-hit-with-a-breach-which-affected-an-unknown-number-of-customer-accounts/;Paolo Passeri					;2019-05-28T14:15:25+01:00;25,968
56;13/05/2019;?;UNIQLO Japan and GU Japan;Fast Retailing, the company behind multiple Japanese retail brands, announces that the UNIQLO Japan and GU Japan online stores have been hacked and third parties accessed 461,091 accounts following a credential stuffing attack between April 23 and May 10.;Credential Stuffing;Not Found;Not Found;JP;https://www.scmagazine.com/home/security-news/data-breach/boost-mobile-was-hit-with-a-breach-which-affected-an-unknown-number-of-customer-accounts/;Paolo Passeri					;2019-05-28T14:15:25+01:00;25,968
57;13/05/2019;?;Government, defense, military, and media organizations in South Korea.;Researchers from Kaspersky reveal the latest details of a new campaign carried out from the North Korean state-sponsored actor ScarCruft (aka APT37 and Group123). The malware is able to harvest Bluetooth data.;Targeted Attack;Not Found;Not Found;KR;https://www.scmagazine.com/home/security-news/data-breach/boost-mobile-was-hit-with-a-breach-which-affected-an-unknown-number-of-customer-accounts/;Paolo Passeri					;2019-05-28T14:15:25+01:00;25,968
58;13/05/2019;?;Oregon Health Authority;Oregon Health Authority provides early notification to Oregon State Hospital patients of a phishing incident occurred on May 6 and targeting an email account containing OSG data.;Account Hijacking;Not Found;Not Found;US;https://www.scmagazine.com/home/security-news/data-breach/boost-mobile-was-hit-with-a-breach-which-affected-an-unknown-number-of-customer-accounts/;Paolo Passeri					;2019-05-28T14:15:25+01:00;25,968
59;14/05/2019;?;"A ""select number"" of users";Hackers were able to remotely install surveillance software on phones and other devices using a major vulnerability (CVE-2019-3568) in messaging app WhatsApp. According to reports, the surveillance software involved was developed by Israeli firm NSO Group;Targeted Attack;Not Found;Not Found;N/A;https://www.scmagazine.com/home/security-news/data-breach/boost-mobile-was-hit-with-a-breach-which-affected-an-unknown-number-of-customer-accounts/;Paolo Passeri					;2019-05-28T14:15:25+01:00;25,968
60;14/05/2019;?;Best of the Web;Sanguine Security researcher Willem de Groot discovers that hackers compromised the script used by Best of the Web to display their trust seal on their customers' websites and to add two key logging scripts designed to sniff keystrokes from visitors.;Malicious Script Injection;Not Found;Not Found;US;https://www.scmagazine.com/home/security-news/data-breach/boost-mobile-was-hit-with-a-breach-which-affected-an-unknown-number-of-customer-accounts/;Paolo Passeri					;2019-05-28T14:15:25+01:00;25,968
61;14/05/2019;BlackTech;Targets in Taiwan;ESET researchers reveal that attackers have been distributing the Plead malware via compromised routers and man-in-the-middle attacks against the legitimate ASUS WebStorage software.;ASUS Router Vulnerability;Not Found;Not Found;TW;https://www.scmagazine.com/home/security-news/data-breach/boost-mobile-was-hit-with-a-breach-which-affected-an-unknown-number-of-customer-accounts/;Paolo Passeri					;2019-05-28T14:15:25+01:00;25,968
62;14/05/2019;Russia;Two Florida voter databases;Governor Ron DeSantis reveals that Russian hackers hit two Florida voter databases during the 2016 US presidential election.;Unknown;Not Found;Not Found;US;https://www.scmagazine.com/home/security-news/data-breach/boost-mobile-was-hit-with-a-breach-which-affected-an-unknown-number-of-customer-accounts/;Paolo Passeri					;2019-05-28T14:15:25+01:00;25,968
63;14/05/2019;Hamas;KAN;Israel’s webcast of the Eurovision Song Contest semi-final is hacked with animated images of explosions. KAN, the national TV broadcaster in Israel, blames Hamas for the attack. ;Unknown;Not Found;Not Found;IL;https://www.scmagazine.com/home/security-news/data-breach/boost-mobile-was-hit-with-a-breach-which-affected-an-unknown-number-of-customer-accounts/;Paolo Passeri					;2019-05-28T14:15:25+01:00;25,968
64;14/05/2019;?;Undisclosed Targets;"Microsoft patches for an elevation-of-privileges vulnerability (CVE-2019-0863)  which is being exploited in the wild ""in limited attacks against specific targets"".";Targeted Attack;Not Found;Not Found;N/A;https://www.scmagazine.com/home/security-news/data-breach/boost-mobile-was-hit-with-a-breach-which-affected-an-unknown-number-of-customer-accounts/;Paolo Passeri					;2019-05-28T14:15:25+01:00;25,968
65;14/05/2019;?;Oklahoma City Public Schools;Oklahoma City Public Schools confirm they are addressing a recent ransomware attack, compromising the district’s network.;Malware;Not Found;Not Found;US;https://www.scmagazine.com/home/security-news/data-breach/boost-mobile-was-hit-with-a-breach-which-affected-an-unknown-number-of-customer-accounts/;Paolo Passeri					;2019-05-28T14:15:25+01:00;25,968
66;14/05/2019;?;Equitas Health;Equitas Health notifies 569 members after discovering two employee email accounts had been compromised.;Account Hijacking;Not Found;Not Found;US;https://www.scmagazine.com/home/security-news/data-breach/boost-mobile-was-hit-with-a-breach-which-affected-an-unknown-number-of-customer-accounts/;Paolo Passeri					;2019-05-28T14:15:25+01:00;25,968
67;15/05/2019;?;Forbes Magazine subscription website (forbesmagazine.com) ;Researchers from Bad Packets discover that hackers injected the Forbes' subscription website with a Magecart script which collects payment card data customers introduce on the checkout page and exfiltrates it to a server controlled by the attackers.;Malicious Script Injection;Not Found;Not Found;US;https://www.scmagazine.com/home/security-news/data-breach/boost-mobile-was-hit-with-a-breach-which-affected-an-unknown-number-of-customer-accounts/;Paolo Passeri					;2019-05-28T14:15:25+01:00;25,968
68;15/05/2019;Anonymous Italia;Four Websites related to Italian Healthcare Providers;In name of #OpPharma, Anonymous Italia defaces and dumps data from the websites of four healthcare websites: the National Association of Hospital Primaries, ASSIST Italy, HS Hospital Services, and the Association of Surgeons and Odontologists in Savona.;SQLi;Not Found;Not Found;IT;https://www.scmagazine.com/home/security-news/data-breach/boost-mobile-was-hit-with-a-breach-which-affected-an-unknown-number-of-customer-accounts/;Paolo Passeri					;2019-05-28T14:15:25+01:00;25,968
69;15/05/2019;?;Paterson Public Schools;The Paterson Public Schools is hit by a massive breach: 23,103 account passwords and other computer access tokens are stolen.;Unknown;Not Found;Not Found;US;https://www.scmagazine.com/home/security-news/data-breach/boost-mobile-was-hit-with-a-breach-which-affected-an-unknown-number-of-customer-accounts/;Paolo Passeri					;2019-05-28T14:15:25+01:00;25,968
70;15/05/2019;?;Single Individuals;Security researchers MalwareHunterTeam and JayTHL discovered nearly 200 web sites hosted on the Azure App Services platform that are used for displaying tech support scams.;Account Hijacking;Not Found;Not Found;>1;https://www.scmagazine.com/home/security-news/data-breach/boost-mobile-was-hit-with-a-breach-which-affected-an-unknown-number-of-customer-accounts/;Paolo Passeri					;2019-05-28T14:15:25+01:00;25,968
71;15/05/2019;?;Multiple Targets;Researchers from Akamai reveal a new method to evade detection to make sure that the traffic generated by their malicious campaigns is not being detected, a technique based on SSL/TLS signature randomization and dubbed cipher stunting.;SSL/TLS signature randomization;Not Found;Not Found;>1;https://www.scmagazine.com/home/security-news/data-breach/boost-mobile-was-hit-with-a-breach-which-affected-an-unknown-number-of-customer-accounts/;Paolo Passeri					;2019-05-28T14:15:25+01:00;25,968
72;15/05/2019;Chinese State-sponsored actors;Multiple Targets;Security researchers from Chronicle discover a Linux version of the Winnti malware.;Targeted Attack;Not Found;Not Found;>1;https://www.scmagazine.com/home/security-news/data-breach/boost-mobile-was-hit-with-a-breach-which-affected-an-unknown-number-of-customer-accounts/;Paolo Passeri					;2019-05-28T14:15:25+01:00;25,968
73;15/05/2019;?;Boost Mobile;Boost Mobile is hit with a breach which affected an unknown number of customer accounts. The company experienced unauthorized online account on March 14, 2019.;Unknown;Not Found;Not Found;US;https://www.scmagazine.com/home/security-news/data-breach/boost-mobile-was-hit-with-a-breach-which-affected-an-unknown-number-of-customer-accounts/;Paolo Passeri					;2019-05-28T14:15:25+01:00;25,968
1;12/04/2019;?;Flashpoint;A 0-day vulnerability in the Yuzo WordPress plugin causes the Flashpoint website to briefly redirect the users to an external website with a pop-up leading to malware.;O-day Wordpress Vulnerability ;Not Found;Not Found;US;https://securityaffairs.co/wordpress/84487/hacking/social-warfare-zero-day.html;Paolo Passeri					;2019-05-16T11:26:57+01:00;23,142
2;16/04/2019;?;iOS users from the U.S. and multiple European Union;Researchers from Confiant discover eGobbler, a massive malvertising campaign targeting iOS users from the U.S. and multiple European Union. Roughly 500 million users sessions were exposed.;Malvertising;Not Found;Not Found;>1;https://securityaffairs.co/wordpress/84487/hacking/social-warfare-zero-day.html;Paolo Passeri					;2019-05-16T11:26:57+01:00;23,142
3;16/04/2019;?;Multiple Ukrainian military departments;Researchers from FireEye reveal that multiple Ukrainian military departments were targeted by a spear phishing campaign which attempted to drop a RATVERMIN backdoor as part of a second-stage payload delivered with the help of a Powershell script.;Targeted Attack;Not Found;Not Found;UA;https://securityaffairs.co/wordpress/84487/hacking/social-warfare-zero-day.html;Paolo Passeri					;2019-05-16T11:26:57+01:00;23,142
4;16/04/2019;?;Single Individuals;Researchers from ESET reveal the details of Scranos, a rootkit-enabled operation spyware operation.;Malware;Not Found;Not Found;>1;https://securityaffairs.co/wordpress/84487/hacking/social-warfare-zero-day.html;Paolo Passeri					;2019-05-16T11:26:57+01:00;23,142
5;16/04/2019;?;Remotely Accessible Samba Servers;A new ransomware family called NamPoHyu Virus or MegaLocker Virus is targeting victims, running locally on a victim's computer, and remotely encrypt accessible Samba servers.;Malware;Not Found;Not Found;>1;https://securityaffairs.co/wordpress/84487/hacking/social-warfare-zero-day.html;Paolo Passeri					;2019-05-16T11:26:57+01:00;23,142
6;16/04/2019;?;Users of the popular Electrum Bitcoin wallet;Researchers from Malwarebytes reveal that since at least late December 2018, users of the popular Electrum Bitcoin wallet have fallen victim to phishing attacks, estimated to net crooks over 771 Bitcoins, approximately $4 million at current exchange rate.;Account Hijacking;Not Found;Not Found;>1;https://securityaffairs.co/wordpress/84487/hacking/social-warfare-zero-day.html;Paolo Passeri					;2019-05-16T11:26:57+01:00;23,142
7;16/04/2019;?;Single Individuals;Researchers from ZeroFOX discover multiple campaigns exploiting the tragic fire of Notre Dame for fake donation pages and new phishing campaigns.;Account Hijacking;Not Found;Not Found;>1;https://securityaffairs.co/wordpress/84487/hacking/social-warfare-zero-day.html;Paolo Passeri					;2019-05-16T11:26:57+01:00;23,142
8;16/04/2019;?;Centrelake Medical Group;Centrelake Medical Group notifies almost 198,000 patients after a virus investigation reveals earlier intrusion and suspicious activity.;Malware;Not Found;Not Found;US;https://securityaffairs.co/wordpress/84487/hacking/social-warfare-zero-day.html;Paolo Passeri					;2019-05-16T11:26:57+01:00;23,142
9;17/04/2019;?;Organizations in the Middle East and North Africa (ministries, military organizations, intelligence agencies, energy companies).;Researchers from Cisco Talos reveal the details of Sea Turtle, a state-sponsored attack manipulating DNS systems, targeting primarily national security organizations in the Middle East and North Africa.;DNS Hijacking;Not Found;Not Found;>1;https://securityaffairs.co/wordpress/84487/hacking/social-warfare-zero-day.html;Paolo Passeri					;2019-05-16T11:26:57+01:00;23,142
10;17/04/2019;?;Verint;The Israel offices of US cyber-security firm Verint are hit by ransomware.;Malware;Not Found;Not Found;IL;https://securityaffairs.co/wordpress/84487/hacking/social-warfare-zero-day.html;Paolo Passeri					;2019-05-16T11:26:57+01:00;23,142
11;17/04/2019;?;Multiple Targets;Researchers from Trend Micro discover a potential targeted attack, making use of legitimate script engine AutoHotkey, in combination with malicious script files. ;Targeted Attack;Not Found;Not Found;>1;https://securityaffairs.co/wordpress/84487/hacking/social-warfare-zero-day.html;Paolo Passeri					;2019-05-16T11:26:57+01:00;23,142
12;17/04/2019;?;Chipotle;Some Chipotle customers claim their accounts have been hacked and report fraudulent orders charged to their credit cards. The company states credential stuffing is to blame.;Credential Stuffing;Not Found;Not Found;US;https://securityaffairs.co/wordpress/84487/hacking/social-warfare-zero-day.html;Paolo Passeri					;2019-05-16T11:26:57+01:00;23,142
13;18/04/2019;Lab Dookhtegan;OilRig, AKA APT34, AKA HelixKitten;A collective dubbed Lab Dookhtegan reveal details about the inner workings of the cyber-espionage group known as OilRig, APT34, and HelixKitten, linked to the Iranian government. The source code of their tools is leaked on Telegram.;Unknown;Not Found;Not Found;IR;https://securityaffairs.co/wordpress/84487/hacking/social-warfare-zero-day.html;Paolo Passeri					;2019-05-16T11:26:57+01:00;23,142
14;18/04/2019;?;The Weather Channel;"The Weather Channel is hit by a ransomware attack.
";Malware;Not Found;Not Found;US;https://securityaffairs.co/wordpress/84487/hacking/social-warfare-zero-day.html;Paolo Passeri					;2019-05-16T11:26:57+01:00;23,142
15;18/04/2019;?;Entities from North America, Europe, Asia, and the Middle East;"Researchers from Palo Alto Networks reveal the details of ""Aggah"", a malicious campaign targeting entities from North America, Europe, Asia, and the Middle East using a combination of pages hosted on Bit.ly, BlogSpot, and Pastebin to evade detection.";Targeted Attack;Not Found;Not Found;>1;https://securityaffairs.co/wordpress/84487/hacking/social-warfare-zero-day.html;Paolo Passeri					;2019-05-16T11:26:57+01:00;23,142
16;18/04/2019;?;Single Individuals;A new variant of the CryptoMix ransomware emerges, appending the .DLL extension to encrypted files and is said to be installed through hacked remote desktop services.;Malware;Not Found;Not Found;>1;https://securityaffairs.co/wordpress/84487/hacking/social-warfare-zero-day.html;Paolo Passeri					;2019-05-16T11:26:57+01:00;23,142
17;18/04/2019;?;City of Augusta;The City of Augusta municipal services are hit by a ransomware attack.;Malware;Not Found;Not Found;US;https://securityaffairs.co/wordpress/84487/hacking/social-warfare-zero-day.html;Paolo Passeri					;2019-05-16T11:26:57+01:00;23,142
18;18/04/2019;TA505;Financial entities in the United States and worldwide;Researchers at Cyberint uncover a new campaign of the russian actor TA505 against financial entities in the United States and worldwide.;Targeted Attack;Not Found;Not Found;>1;https://securityaffairs.co/wordpress/84487/hacking/social-warfare-zero-day.html;Paolo Passeri					;2019-05-16T11:26:57+01:00;23,142
19;18/04/2019;?;Multiple Targets;The attackers responsible for launching phishing campaigns against Wipro, India’s third-largest IT outsourcing firm, also appear to have targeted a number of other competing providers, including Infosys and Cognizant.;Account Hijacking;Not Found;Not Found;>1;https://securityaffairs.co/wordpress/84487/hacking/social-warfare-zero-day.html;Paolo Passeri					;2019-05-16T11:26:57+01:00;23,142
20;19/04/2019;?;Ad Agencies;Researchers from Check Point uncover a series of applications conducting fraudulent activities against Ad Agencies, carried out via a mobile malware dubbed ‘PreAMo’. The malware totaled over 90 million installs from Google Play across 6 applications.;Malware;Not Found;Not Found;>1;https://securityaffairs.co/wordpress/84487/hacking/social-warfare-zero-day.html;Paolo Passeri					;2019-05-16T11:26:57+01:00;23,142
21;19/04/2019;?;Partners for Quality;Partners for Quality notifies 3,673 clients after some employees' email accounts are compromised.;Account Hijacking;Not Found;Not Found;US;https://securityaffairs.co/wordpress/84487/hacking/social-warfare-zero-day.html;Paolo Passeri					;2019-05-16T11:26:57+01:00;23,142
22;20/04/2019;?;Atlanta Hawks;The online shop for the Atlanta Hawks professional NBA basketball team has malicious code injected into (Magecart Infection).;Malicious Script Injection;Not Found;Not Found;US;https://securityaffairs.co/wordpress/84487/hacking/social-warfare-zero-day.html;Paolo Passeri					;2019-05-16T11:26:57+01:00;23,142
23;20/04/2019;?;EmCare Inc.;EmCare Inc. discloses that an unauthorized party obtained access to a number of employees’ email accounts that contained the personal information of as many as 60,000 individuals, 31,000 of which are patients.;Account Hijacking;Not Found;Not Found;US;https://securityaffairs.co/wordpress/84487/hacking/social-warfare-zero-day.html;Paolo Passeri					;2019-05-16T11:26:57+01:00;23,142
24;22/04/2019;?;Bodybuilding.com;Bodybuilding.com notifies its customers of a security breach detected during February 2019 which was the direct result of a phishing email received back in July 2018. Potentially 18M users are impacted.;Account Hijacking;Not Found;Not Found;US;https://securityaffairs.co/wordpress/84487/hacking/social-warfare-zero-day.html;Paolo Passeri					;2019-05-16T11:26:57+01:00;23,142
25;22/04/2019;?;Vulnerable WordPress Sites;Researchers from Palo Alto Networks discover an additional campaign exploiting the CVE-2019-9978 vulnerability of the Social Warfare Wordpress plugin.;Vulnerability (CVE-2019-9978);Not Found;Not Found;>1;https://securityaffairs.co/wordpress/84487/hacking/social-warfare-zero-day.html;Paolo Passeri					;2019-05-16T11:26:57+01:00;23,142
26;22/04/2019;?;Embassy officials from at least seven countries (Italy, Kenya, Bermuda, Nepal, Guyana, Lebanon, and Liberia);Researchers from Check Point reveal the details of FINTEAM, a cyber espionage campaign leveraging a weaponized version of TeamViewer to target embassy officials from at least seven countries (Italy, Kenya, Bermuda, Nepal, Guyana, Lebanon, and Liberia).;Targeted Attack;Not Found;Not Found;>1;https://www.zdnet.com/article/godaddy-takes-down-15000-subdomains-used-for-online-scams/;Paolo Passeri					;2019-05-16T11:26:57+01:00;23,142
27;23/04/2019;?;Aebi Schmidt;Aebi Schmidt, a Swiss manufacturing giant with operations in the U.S., is hit by a ransomware attack.;Malware;Not Found;Not Found;CH;https://www.zdnet.com/article/godaddy-takes-down-15000-subdomains-used-for-online-scams/;Paolo Passeri					;2019-05-16T11:26:57+01:00;23,142
28;23/04/2019;?;Multiple Targets;Researchers from Netskope discover a malware hosted on Google Sites. The threat is a dropper for an information stealer that sends data to a MySQL server controlled by the attacker.;Malware;Not Found;Not Found;>1;https://www.zdnet.com/article/godaddy-takes-down-15000-subdomains-used-for-online-scams/;Paolo Passeri					;2019-05-16T11:26:57+01:00;23,142
29;23/04/2019;State-sponsored actor;Multiple Targets;Researchers from Kaspersky discover six more companies hit by the ShadowHammer Operation: Electronics Extreme, Innovative Extremist, Zepetto, and three additional companies in South Korea (video gaming, conglomerate holding and pharmaceutical).;Targeted Attack;Not Found;Not Found;>1;https://www.zdnet.com/article/godaddy-takes-down-15000-subdomains-used-for-online-scams/;Paolo Passeri					;2019-05-16T11:26:57+01:00;23,142
30;23/04/2019;?;Companies in Lebanon and the United Arab Emirates (UAE);Researchers from Cisco Talos reveal the details of the Karkoff malware, the new weapon used by the threat actor behind the DNSpionage campaign, and a possible link with the Oilrig APT.;Targeted Attack;Not Found;Not Found;"UAE
LB";https://www.zdnet.com/article/godaddy-takes-down-15000-subdomains-used-for-online-scams/;Paolo Passeri					;2019-05-16T11:26:57+01:00;23,142
31;23/04/2019;?;A2 Hosting;A ransomware infection takes down the operations of A2 Hosting, a US-based web hosting provider.;Malware;Not Found;Not Found;US;https://www.zdnet.com/article/godaddy-takes-down-15000-subdomains-used-for-online-scams/;Paolo Passeri					;2019-05-16T11:26:57+01:00;23,142
32;23/04/2019;?;Android Users;Researchers from Avast discover 50 apps relating to lifestyle services which masquerade as legitimate software but are actually adware (Android:Agent-SEB [PUP]), downloaded a total of 30 million times.;Malware;Not Found;Not Found;>1;https://www.zdnet.com/article/godaddy-takes-down-15000-subdomains-used-for-online-scams/;Paolo Passeri					;2019-05-16T11:26:57+01:00;23,142
